Link,brand,volume,description,ingredients,how_to_use,product_key
https://www.caretobeauty.com/us/apivita-express-beauty-deep-cleansing-face-mask-2x8ml/,APIVITA,x8,"APIVITA Express Beauty Face Mask Green Clay is a mattifying face mask for oily and combination skin types. Formulated with green clay, a very absorbent type of clay which is known for its purifying action, this mask offers a deep-cleansing action to the pores. As a result, it reduces the appearance of blackheads. At the same time, it absorbs excess sebum from the surface of the skin, thus creating a matte, velvety-soft complexion.","Main Ingredients

Green clay and saponaria cleanses the pores in-depth, reducing blackheads as a result. At the same time, green clay absorbs excess sebum, thus offering a mattifying effect;
Propolis provides mild antiseptic benefits;
Aloe, chamomile, and wheat proteins leave the skin softer and visibly more radiant;
This product contains a patented infusion of 3 different species of organic Greek mountain tea instead of plain water; this natural ingredient helps boost the antioxidant properties already present in the formula, due to its high concentration of polyphenols.","How to use
Apply a thick layer of APIVITA Express Beauty Face Mask Green Clay to clean skin, while taking care to avoid the eye area. Leave on for 10 minutes, then remove excess with a damp cotton pad. Rinse thoroughly in order to fully remove the clay from the skin. In order to achieve the best possible results, follow with your favorite face cream from the APIVITA range.",855
https://www.caretobeauty.com/us/avene-cleanance-detox-mask-50ml/,Avène,50ml,"Avène Cleanance Detox Mask 50ml (1.69floz) meets the needs of combination to oily, sensitive skin prone to blemishes. This detox mask combines the power of mattifying and purifying properties with soothing and hydrating benefits, leaving the skin feeling comfortable and soothed. At the heart of this mask is a duo of clays that work to absorb excess sebum. The inclusion of perlite provides a gentle exfoliation, helping to remove dead skin cells. This combination not only purifies and mattifies the skin but also visibly tightens pores. Additionally, the mask features Av&egrave;ne Thermal Spring Water and glycerine, which work together to soothe and moisturize the skin. These ingredients ensure that the skin remains hydrated and calm, even while deep-cleansing action takes place. Users will find that imperfections are significantly reduced, with 90% reporting clearer skin.
Another key point is the texture. The mask has a green texture that ensures an even application, spreads easily, and rinses off without hassle, leaving the skin purified, matte, and refreshed. It also delights the senses with a fresh floral fragrance! Plus, this mask works its magic in just five minutes, making it a great addition to any skincare routine of those with blemish-prone skin. As a last note, the formula is both biodegradable and vegan.","Main Ingredients

19% Clay duo combines white and green clay. This duo absorbs sebum and impurities, leaving the skin mattified and purified.
Perlite, extracted from volcanic rock, offers gentle exfoliating properties;
Av&egrave;ne Thermal Spring Water, with a unique and rich composition, has the ability to soothe, soften, and calm while refreshing and hydrating the skin.","How to use
Apply Avène Cleanance Detox Mask 50ml (1.69floz) evenly to clean, dry skin of the face and leave it for 5 minutes. Then, rinse well with lukewarm water.",855
https://www.caretobeauty.com/us/ziaja-microbiome-balance-fat-free-face-mask-for-oily-skin-7ml/,Ziaja,7ml,"Ziaja Microbiome Balance Fat-Free Face Mask For Oily Skin 7ml (0.24 fl oz) is a face mask for oily skin designed to maintain strong microflora of the skin. In other words, this oil-free formula, composed of 99% ingredients of natural origin, supports the skin's microbiome and overall health. It contains inulin, a prebiotic that helps to maintain a healthy skin barrier, enhancing the skin's natural defenses. Fermented minerals further aid in maintaining a healthy microbiome, promoting balanced and resilient skin. In particular, zinc has antibacterial properties helping to prevent blemishes. Additionally, thermal water in the formula provides soothing benefits. 
So, these ingredients work together to leave the skin feeling revitalized and purified. With a gel consistency, it spreads easily on the skin and absorbs quickly, making it a convenient addition to the daily skincare routine. All in all, this face mask supports the skin's natural barrier and overall health, while ensuring that the skin remains blemish-free, calm, and comfortable.","Main Ingredients

Thermal Water helps soothe the skin;
Inulin is a polysaccharide with prebiotic effects. In other words, it supports a healthy skin microbiome;
Fermented Minerals (zinc, iron, silicon, copper and magnesium) help maintain a healthy skin barrier and deliver soothing effects.","How to use
Apply an even layer of Ziaja Microbiome Balance Fat-Free Face Mask For Oily Skin 7ml (0.24 fl oz) onto clean skin of the face, avoiding the eye and mouth areas. Then, leave it on until it fully absorbs. Finally, follow with the night cream. This product is suitable for daily use.",855
https://www.caretobeauty.com/us/ziaja-microbiome-balance-calming-face-mask-for-sensitive-skin-7ml/,Ziaja,7ml,"Ziaja Microbiome Balance Calming Face Mask For Sensitive Skin 7ml (0.24 fl oz) is a face mask with 90% ingredients of natural origin, that supports the skin's microbiome and overall health. It contains inulin, a prebiotic that helps to maintain a healthy skin barrier, enhancing the skin's natural defenses. Fermented minerals further aid in maintaining a healthy microbiome, promoting balanced and resilient skin. Thermal water in the formula provides soothing benefits, while hyaluronic acid, shea butter, and canola oil provide hydration and nourishment. 
So, these ingredients work together to leave the skin feeling soft, smooth, and revitalized. Moreover, the mask's soothing benefits make it particularly suitable for sensitive skin. With a light, creamy consistency, it spreads easily on the skin and absorbs quickly, making it a convenient addition to the daily skincare routine. All in all, this face mask supports the skin's natural barrier and overall health, while ensuring that the skin remains hydrated, calm, and comfortable.","Main Ingredients

Thermal Water helps soothe the skin;
Inulin is a polysaccharide with prebiotic effects. In other words, it supports a healthy skin microbiome;
Hyaluronic Acid attracts and retains water, functioning as a humectant and helping the skin to restore its water balance. Therefore, it leaves the skin soft and plump;
Fermented Minerals ( zinc, iron, silicon, copper and magnesium) help maintain a healthy skin barrier and deliver soothing effects.","How to use
Apply an even layer of Ziaja Microbiome Balance Calming Face Mask For Sensitive Skin 7ml (0.24 fl oz) onto clean skin of the face, avoiding the eye and mouth areas. Then, leave it on until it fully absorbs. Finally, follow with the night cream. This product is suitable for daily use.",855
https://www.caretobeauty.com/us/revolution-skincare-purifying-charcoal-peel-off-mask-100g/,Revolution,100g,"Revolution Skincare Purifying Charcoal Peel Off Mask 100g (3.53oz) is a peel off facial mask perfect for oily skin with clogged and dilated pores. In this sense, this mask adheres effortlessly to the skin of your face, drying completely after a few minutes. Then it is supposed to be peeled off, which becomes an extremely satisfying task. That said, this product has the ability to grab and remove any excess dirt, debris and oil on the skin. In turn, the skin gains a new feeling of extreme cleanliness and purification.
The composition of this face mask has Charcoal as a key ingredient. Namely, this ingredient helps to draw out sebum and dirt from the pores and decongest the skin. Thus, your face instantly gains a more even complexion in terms of its texture as well as becoming more mattified. In the end, everything that is also blackheads is easily removed giving way to smaller and disguised pores. Furthermore, the presence of Amino Acids help to hydrate the skin while effortlessly smoothing it. At the same time, they balance the skin's microbiome, improving the overall complexion.
All in all, this face mask is not only very satisfying but also a great ally for oily skin. This, in turn, has a more uniform and clean appearance as the blackheads and excess oil disappear. In addition, the skin receives a necessary dose of hydration, thus becoming smoother and softer to the touch. Finally, the skin also gains a matte finish that lasts all day.","Main Ingredients

Charcoal Powder absorbs accumulated impurities and also excess oil from the skin leaving the complexion fresher and mattified;
Amino acids help to attract and retain water onto the skin.","How to use
Apply Revolution Skincare Purifying Charcoal Peel Off Mask 100g (3.53oz) to clean, dry skin avoiding the hairline, eyes, eyebrows and lips. After 20 minutes, gently peel the mask off and remove any remaining product with warm water. Use one to two times a week.",855
https://www.caretobeauty.com/us/apivita-express-beauty-face-mask-artichoke-2x8ml/,APIVITA,x8,"APIVITA Express Beauty Face Mask Artichoke 2x8ml (2x0.27 fl oz) is the ultimate express solution for achieving radiant and smooth skin. With 95% natural origin ingredients, this product blends exfoliant acids with artichoke extract to reveal a brighter and smoother complexion. On one hand, a combination of alpha hydroxy acids and poly hydroxy acids exfoliate the skin thus refining skin texture and promoting skin radiance. On the other hand, artichoke extract is coupled with Azelaic acid to not only illuminate the complexion but also refine the appearance of pores. Another important ingredient of this formula is hyaluronic acid which provides hydration and, in addition, this product also boasts the soothing properties of aloe vera and panthenol. As a result, this product offers an express treatment and, in just 10 minutes, buffs away dullness, consequently revealing a radiant complexion.
As a last note, with a single dose format it's a convenient option to add to your skincare routine. Use it once to twice a week and experience its brightening and smoothing benefits!","Main Ingredients

Artichoke extract is rich in antioxidants, thus preventing free radical damage;
AHA and PHA exfoliate the skin and, as a consequence, not only contribute to a brighter complexion but also to smoother skin;
Azelaic acid inhibits melanin synthesis by reducing the enzyme tyrosinase, involved in this process. As a result, it reduces hyperpigmentation and helps achieve a more even skin tone;
Hyaluronic acid is a well-known ingredient for its hydrating power. It retains water and, consequently, moisturizes and plumps the skin;
Aloe vera and panthenol have both soothing and hydrating benefits;
Vitamin E is an antioxidant, neutralizing free radicals.","How to use
Apply a generous layer of APIVITA Express Beauty Face Mask Artichoke 2x8ml (2x0.27 fl oz) to clean dry skin and leave it on for 10 minutes. Then, remove it with a damp cotton pad or reusable alternative and rinse the skin with water.",855
