Link,brand,volume,description,ingredients,how_to_use
https://www.caretobeauty.com/us/garnier-skin-active-eye-makeup-remover-2-in-1-125ml/,Garnier,125ml,"Garnier Skin Active Eye Makeup Remover 2-in-1 is a biphasic micellar water suitable for the eye area that combines two products in one. First, it removes any type of makeup, even the most complex one to remove. Be it long-lasting makeup or waterproof! In addition, it also helps to remove any traces of dirt from the skin or even excess sebum or oil accumulated inside the pores. Secondly, this micellar water helps to fortify and densify your lashes. This is possible thanks to the presence of Arginine of natural origin in this composition. Specifically, this ingredient has the power to penetrate deep into the hair fiber helping it to strengthen from the inside. This way the lashes end up being more voluminous, longer and more dense. Finally, through this micellar biphasic water your skin is completely free of make-up in addition to being much more cared for.","Main Ingredients

Micelles trap and remove impurities from the skin without rinsing while respecting the cutaneous balance;
Arginine penetrates deeply into the hair fiber and helps to fortify it from the inside. Thus, the lashes end up becoming denser, healthier and voluminous. It also prevents them from becoming thin and short.","How to use
Shake the Garnier Skin Active Eye Makeup Remover 2-in-1 well before using. Apply to a cotton pad, place it over your closed eyes and let it act for a moment before removing the pad. You can also apply on the lips area."
https://www.caretobeauty.com/us/frezyderm-mild-wash-liquid-extra-mild-cleanser-200ml/,Frezyderm,200ml,"Frezyderm Mild Wash Liquid Extra Mild Cleanser is a face and body cleanser suitable for normal, sensitive and delicate skin. The texture is liquid and refreshing, lending the skin a smooth and hydrated feel. This delicate cleanser is suitable for daily cleansing and is formulated with a neutral pH, excluding soap, fragrance, color and parabens from the ingredient list. 
In order to moisturize and protect the skin, it contains Allantoin, Aloe and Panthenol. Equally important, the formula contains CM-Glucan to strengthen the natural barrier of the skin. Mild surfactants allow a gentle cleanse, creating the perfect formula for skin conditions such as contact dermatitis, eczema and atopic skin. In addition, it is recommended for daily cleansing and makeup removal. It is also recommended in case of intolerance to traditional alkaline soaps and as an intimate cleanser for pre-puberty and post-menopause.","Main Ingredients

Allantoin and Aloe coupled with Panthenol not only moisturize the skin but also protect it against irritation;
Mild surfactants allow a gentle cleanse;
CM-Glucan strengthens the natural defenses of the skin.","How to use
Apply Frezyderm Mild Wash Liquid Extra Mild Cleanser onto wet skin and massage the product gently. The following step is to rinse the product thoroughly and pat the skin dry."
https://www.caretobeauty.com/us/la-roche-posay-cleansing-micellar-foaming-water-150ml/,La Roche-Posay,150ml,"La Roche-Posay Cleansing Micellar Foaming Water&nbsp;is a cleansing liquid-to-foam product that gently cleanses all the impurities from the skin. The foam enables you to have the lather without the need for a harsh cleanser ingredient - this way it is a formula suitable for all skin types, including sensitive.","Main Ingredients

La Roche-Posay Thermal Spring Water soothes the skin and gently hydrates.","How to use
Apply La Roche-Posay Cleansing Micellar Foaming Water onto wet skin and massage the foam to remove all impurities."
https://www.caretobeauty.com/us/bioderma-sensibio-h2o-eye-biphasic-micellar-makeup-remover-125ml/,Bioderma,125ml,"Bioderma Sensibio H2O Eye Biphasic Micellar Makeup Remover 125ml (4.2 fl oz) is a makeup remover formulated specifically for the eyes and lips. This biphasic micellar makeup remover comprises 30% of a lipophilic phase and 70% of an aqueous phase with micellar technology. As a result, this product cleanses impurities, pollutants, and all makeup, including waterproof eye and lip makeup without leaving a greasy finish. With a unique formula, it instantly and effectively removes makeup and hydrates and soothes the skin at the same time. On one hand, it contains Hyaluronic acid to deliver hydration to the skin while the D.A.F. complex hydrates and reinforces the skin's tolerance threshold. On the other hand,&nbsp;a combination of fructooligosaccharides soothes the skin.&nbsp;
Moreover, this product strengthens the fragile eye contour area and the eyelashes thanks to provitamin B5. In fact, the eyelashes become thicker, and stronger, and get more volume. All in all, this makeup remover was formulated to suit even the most sensitive skin. It has good cutaneous and ocular tolerance and protects&nbsp;the skin's natural barrier.&nbsp;","Main Ingredients

Hyaluronic acid is a well-known hydrating ingredient naturally present in the skin. It hydrates the skin and leaves it comfortable;
Furotolygosaccharides namely glucose and fructose prevent skin irritation and soothe the skin;
D.A.F. complex comprises laminaria extract and soothing sugars and it increases the skin tolerance threshold to reduce sensitivity and reactivity;
Provitamin B5 also known as panthenol strengthens the skin and the eyelashes.&nbsp;","How to use
Firstly, shake well to mix the two phases. Apply Bioderma Sensibio H2O Eye Biphasic Micellar Makeup Remover 125ml (4.2 fl oz) on a cotton pad and apply it to the area to be cleaned. Gently press and swipe the cotton pad. Do not rinse."
https://www.caretobeauty.com/us/uriage-cleansing-cream/,Uriage,"500ml (16.91 fl oz)
                                                                                            - Out of Stock","Uriage Cleansing Cream is a 2-in-1 cleansing and nourishing product suitable for all skin types, including sensitive. On one side, the presence of Glycerin in the formula shields the skin from environmental sources of irritation while offering long-lasting moisture. Simultaneously, Uriage Thermal Water is responsible for relieving sensations of discomfort through a soothing action. As a result, this pleasantly scented product leaves the skin perfectly soft, moisturized and equally clean. In fact, its soap-free cleansing base eliminates all impurities, while nourishing ingredients preserve the skin's balance and comfort.","Main Ingredients
		
Glycerin draws moisture from the air and binds it to the skin. Therefore, this ingredient not only keeps the skin moisturized but also shielded from environmental sources of irritation;
Uriage Thermal Water is pure and naturally rich in mineral salts and trace elements. This component soothes the skin and relieves sensations of discomfort.","How to use
Use Uriage Cleansing Cream to cleanse the skin of your body and face, and your hair. Apply an appropriate amount to the damp skin or hair. Then, massage gently to create a lather. Lastly, finish by rinsing thoroughly."
https://www.caretobeauty.com/us/bioderma-abcderm-h2o-micelle-solution-ultra-mild-cleanser/,Bioderma,1L (special price),"Bioderma ABCDerm H2O Micelle Solution Ultra-Mild Cleanser offers a practical way to gently cleanse the delicate skin of babies and children. Rich in Allantoin and impregnated with Micellar Technology, this micellar water can effectively remove impurities while respecting the skin’s natural protective film. Suitable for the face, eye area, and also nappy area it can gently cleanse the skin without drying and be used whenever necessary throughout the day. Its formula provides maximum security and tolerance. It has a very good cutaneous and eye tolerance respecting and protecting the fragile skin of babies and children. It is easy to use, requires no rinsing, and allows a gentle cleansing in a single gesture. All in all, it offers a quick and practical way to gently but effectively cleanse the baby's sensitive skin.","Main Ingredients

Allantoin helps regenerate, soften and also soothe the skin;
Micellar Technology has the ability to effectively remove impurities while respecting the skin’s natural protective film.","How to use
Apply Bioderma ABCDerm H2O Micelle Solution Ultra-Mild Cleanser to a cotton pad. Gently wipe the area to cleanse and repeat the process if necessary. It does not require rinsing with water. The micellar water can be applied to the face, eye area, and diaper area and used whenever necessary throughout the day."
https://www.caretobeauty.com/us/bioderma-sebium-gel-moussant-actif-cleansing-active-foaming-gel-200ml/,Bioderma,200ml,"Bioderma Sébium Gel Moussant Actif Cleansing Active Foaming Gel is a daily cleansing gel specially formulated to tend the needs of oily and acne-prone skin. With a unique formula, it can not only gently cleanse and purify the skin but also regulate sebum production. To begin with, it contains both Glycolic Acid and Salicylic Acid. With anti-inflammatory and exfoliating properties, they help unclog pores and reduce pimples, renewing the complexion and refining the skin texture. In addition, also enriched with Zinc Gluconate, this foaming gel also helps regulate sebum production which neutralizes shine and helps mattify the complexion. All in all, it is able to daily cleanse and purify the skin not only mattifying the complexion but also limiting the appearance of blemishes. 90% of the declared the skin was deeply cleansed and 87% of the users felt the skin immediately smoothed.","Main Ingredients

D.A.F patent increases the tolerance threshold of the skin in order to strengthen its resistance;
Glycolic Acid helps remove the outermost layer of dead cells lending the skin an even, fresher and also smoother appearance;
Salicylic Acid has anti-inflammatory properties and also a keratolytic action due to its ability to penetrate the pores and exfoliate the skin. It not only stimulates cell renewal but also helps regulate sebum and eliminate impurities;
Zinc Gluconate has antibacterial and sebum-regulating properties helping purify the skin.","How to use
Apply Bioderma Sébium Gel Moussant Actif Cleansing Active Foaming Gel morning and/or evening onto damp skin. Massage the product to create a lather and gently cleanse the skin. Rinse thoroughly with lukewarm water."
https://www.caretobeauty.com/us/garnier-skin-active-micellar-gel-all-in-1-200ml/,Garnier,200ml,"Garnier Micellar Cleansing Gel Wash All-In-One consists of a micellar gel suitable for all types of skin, even the most sensitive. Its gentle formula effectively cleanses the face while removing makeup in a single gesture. Additionally, this gel even removes makeup from the eyes, a more sensitive and easily irritated area. However, this gel is gentle enough not to cause irritation and still remove all traces of impurities and sebum accumulated in the pores. In turn, this dermatologically tested micellar gel contains neither perfume nor parabens, which makes it even more special. 
Regarding its composition, this micellar gel is enriched with micelles. Thus, this product gains the ability to lift makeup, impurities and dirt away from the skin without leaving it dry. On the other hand, it has Grape Fruit Extract, an ingredient rich in antioxidants and with a soothing, moisturizing and nourishing action. Finally, your skin is visibly cleaner, without any traces of make-up, fresher and smoother.","Main Ingredients

Micelles trap and remove impurities from the skin without rinsing while respecting the cutaneous balance;
Grape Fruit Extract is rich in antioxidants and has a soothing, moisturizing and nourishing action on the skin.","How to use
Apply Garnier Micellar Cleansing Gel Wash All-In-One to wet face and eye contour skin with a gentle massage. Rinse thoroughly."
https://www.caretobeauty.com/us/cetaphil-pro-redness-control-foam-wash-236ml/,Cetaphil,236ml,"Cetaphil Pro Redness Control Foam Wash is a gentle cleanser for sensitive and redness-prone skin. Infused with allantoin, a known anti-irritant active, this mild face wash cleanses the skin without drying or damaging its hydrolipidic barrier. Despite its gentle formulation, this product is effective in removing both impurities and make-up from the delicate skin of the face and neck. After washing and rinsing, the skin emerges both soft and smooth, noticeably calmer and more comfortable.","Main Ingredients

Allantoin soothes the skin due to its anti-irritant properties. It is also effective in reducing redness;
Glycerin contributes to maintain the skin's levels of hydration.","How to use
Apply Cetaphil Pro Redness Control Foam Wash to damp skin, twice a day. Massage gently, then rinse thoroughly. Avoid contact with the eyes."
https://www.caretobeauty.com/us/tonymoly-floria-nutra-energy-foam-cleanser-150ml-ne/,TONYMOLY,150ml,"TONYMOLY Floria Nutra Energy Foam Cleanser is an ideal facial cleanser for really dry and dehydrated skin. It is normal day after day for our facial skin to become drier, heavier and dull due to stress and even external agents such as pollution. In this way, this cleanser removes impurities from the skin and excess sebum while moisturizing, nourishing and refreshing the skin. That way, your face is cleaner, smoother and radiant. On the other hand, its texture does not dry out the skin after cleaning, so that you always feel comfortable. 
For this gentle cleanser to work, it contains a composition with highly nourishing ingredients. In this case it has Safflower Extract and Organic Argan Oil. This way, the skin is really hydrated as you wash it, in addition to being softer and more subtle. In short, if you need a facial cleanser that really cleans your face and removes all traces of dirt, this product is essential in your skin care routine.","Main Ingredients

Organic Argan Oil is rich in Vitamin E, which provides intense hydration and nourishment for the skin;
Safflower Extract contains Vitamin B9 which helps to calm and hydrate the skin.","How to use
Foam a desired amount of TONYMOLY Floria Nutra Energy Foam Cleanser by rubbing in wet hands. Massage onto your face and rinse thoroughly with warm water."
https://www.caretobeauty.com/us/nivea-naturally-clean-exfoliating-face-cleansing-bar-75g/,Nivea,75g,"Nivea Naturally Clean Exfoliating Face Cleansing Bar is an eco-friendly solid bar with active Charcoal designed to refine skin texture. Besides this peeling facet, this also balances out the skin's pH, stabilizing and soothing for the most pleasant finish. Thus, it detoxifies congested complexions while being both plastic and soap-free. Minimalistic as well as 100% vegan, this cleanses in-depth. In fact, the beads of Charcoal make the skin instantly smoother. Finally, apart from being extremely easy to use, this bar comes in entirely recyclable paper packaging. In other words, it creates as little waste as possible looking after the planet in the same way it cares for your skin's well-being!","Main Ingredients

Citric Acid balances the skin and works by exfoliating the upper layer of dead skin cells to help clean pores;
Palmitic Acid keeps your complexion moisturized as well as free of wrinkles or age spots. Common in multiple anti-aging treatments, it smooths and softens from within;
Charcoal Powder absorbs accumulated impurities and excess oil from the skin, leaving your complexion fresher as well as mattified;
Lastly, Tocopherol - better known as Vitamin E - is an antioxidant that can protect the skin from damaging free radicals. Besides, it has wonderful moisturizing properties.","How to use
Start by lathering the Nivea Naturally Clean Exfoliating Face Cleansing Bar into your wet hands. Then, gently massage the bar into the face performing circular as well as upward motions. Finally, rinse off with plenty of water until you remove all the foam."
https://www.caretobeauty.com/us/bioderma-pigmentbio-h2o-brightening-micellar-water-250ml/,Bioderma,250ml,"Bioderma Pigmentbio H2O is a cleansing micellar water especially formulated for hyperpigmented skin. Because of its patented combination of active ingredients, which regulate the biological mechanisms that cause dark spots, this cleansing product is the perfect first step in any depigmenting skincare routine. The gentle formula, which has very good cutaneous and ocular tolerance, removes make-up from both the face and eyes without triggering irritation, making it ideal for sensitive skin types.","Main Ingredients

The micelles contained in this formula remove impurities while respecting the cutaneous balance;
Azelaic acid works on the skin as a gentle leave-on exfoliant, which helps unclog pores and refine the skin's surface.","How to use
Pour Bioderma Pigmentbio H2O onto a cotton pad and apply to the skin and neck in order to cleanse and remove make-up. Pat the skin dry, then proceed with your usual skincare routine."
https://www.caretobeauty.com/us/eucerin-dermatoclean-3-in-1-micellar-cleansing-fluid-200ml/,Eucerin,200ml,"Eucerin DermatoCLEAN 3-in-1 Micellar Cleansing Fluid is a mild but effective fluid that removes impurities and make-up, all the while helping the skin maintain its natural moisture balance. Suitable for all skin types, including sensitive, this formula is enriched with APG Complex, an extra mild cleanser that cleans the skin by dissolving and removing impurities, and Gluco-Glycerol, a powerful hydrating active that helps the skin retain moisture and improve its own barrier function. The skin is cleansed, refreshed and nourished all in a single step, for a soft and supple feeling.","Main Ingredients

APG Complex is an extra mild cleanser that cleans the skin by dissolving and removing impurities;
Gluco-Glycerol, also known as Glyceryl Glucoside, stimulates the skin’s own water system, help it retain moisture and improve its barrier function.","How to use
Apply Eucerin DermatoCLEAN 3-in-1 Micellar Cleansing Fluid to the face, neck and décolletage using a cotton wool pad. Repeat until the pad is clean and all impurities have been removed."
https://www.caretobeauty.com/us/a-derma-ultra-rich-cleansing-bar-100g/,A-Derma,100g,"A-Derma Ultra Rich Cleansing Bar is indicated for daily hygiene of dry and sensitive skin of the face and body. It is soap-free and has a mild cleansing base with physiological pH that cleanses the skin without harming it.&nbsp;Protects against external aggressions and restores the protective film of the skin, reducing irritations.",Not found,"How to use
Apply&nbsp;A-Derma Ultra Rich Cleansing Bar&nbsp;in the bath, on the moist skin of the face and body and remove with water.&nbsp;"
https://www.caretobeauty.com/us/eucerin-dermatoclean-hyaluron-micellar-water-400ml/,Eucerin,400ml,"Eucerin DermatoCLEAN Hyaluron Micellar Water  has a unique formula that gently but effectively cleanses the skin. Containing APG Complex, an extra mild cleanser, it is not only particularly gentle on the skin but also able to thoroughly and effectively eliminate all the impurities that build on the surface of the skin. In addition, it is enriched with both Glycerin and Hyaluronic Acid. This means it can deeply moisturize the skin and keep it hydrated being able to cleanse the skin without drying. All in all, this micellar water not only removes impurities and make-up, but also lends the skin a pleasant feeling of cleanliness, moisture, and comfort. It is ideal if you are looking for a practical cleanser that can effectively cleanse without drying, moisturize, and also prepare the skin for the next skincare product.","Main Ingredients

APG Complex is an extra mild cleanser. It is not only particularly gentle on the skin but also able to thoroughly and effectively eliminate all the impurities that build on the surface of the skin;
Glycerin attracts water and binds it to the skin, keeping it hydrated and also shielded from environmental sources of irritation;
Hyaluronic Acid is a natural part of the skin's connective tissue and has the capacity to retain water. It not only deeply moisturizes the skin and but also helps keep it hydrated.","How to use
Apply Eucerin DermatoCLEAN Hyaluron Micellar Water to a cotton pad. Gently wipe the face and eye area and repeat the process if necessary."
https://www.caretobeauty.com/us/caudalie-vinosource-hydra-travel-essentials-set/,Caudalie,Not found,,Not found,Not found
https://www.caretobeauty.com/us/cetaphil-gentle-skin-cleanser-dry-sensitive-skin/,Cetaphil,473ml (15.99 fl oz),"Cetaphil Gentle Skin Cleanser Dry&Sensitive Skin cleanses and refreshes all skin types, including the dry and sensitive skin of the face. In fact, since it only includes non-irritating ingredients in its composition, this is a gentle product that does not harm the skin. By introducing it into your daily routine, you will enjoy a refreshing cleanse without depriving the skin of its natural emollients or protective oils. On the contrary, the Cetaphil Gentle Skin Cleanser Dry&Sensitive Skin helps to keep optimal levels of moisture on the skin, leaving it soft, plump and healthy. Meanwhile, it equally purifies it, removing residues and unclogging the pores.  

In addition to all of these benefits, the Cetaphil Gentle Skin Cleanser Dry&Sensitive Skin is an easy-to-use and flexible product that does not necessarily require rinsing. With a soap-free mild formula, this cleansing option offers freshness, elasticity and moisture with or without water.","Main Ingredients 
 
 Sodium Lauryl Active is a cleansing substance combined in a safe micelle with emollient not damaging, therefore, the lipid coat; 
 Cetyl Alcohol and Stearyl Alcohol are emollients that restore and also protect the lipid layer of the skin; 
 Propylene Glycol is a humectant and moisturizes by retaining water in the epidermis.","How to use 
To use the Cetaphil Gentle Skin Cleanser Dry&Sensitive Skin without water, apply the formula to the skin and massage gently. Then, remove the excess product with a soft towel or a cloth, leaving a thin layer on the skin. Alternatively, after applying and massaging the product in the skin, finish by rinsing thoroughly."
https://www.caretobeauty.com/us/nivea-creme-care-facial-cleansing-wipes-x25/,Nivea,x25,"Nivea Creme Care Facial Cleansing Wipes help you remove all kinds of makeup on a daily basis, cleansing all skin types gently and without clogging pores. In addition, these also exfoliate, mattifying your complexion as well as refining its texture. Thus, a few swipes are enough to take off daily impurities or waterproof mascara, allowing the pores to breathe better and the skin to feel softer. In fact, these tissues wipes produce instant effects, improving hydration levels while also leaving eyelashes intact. Enriched with Panthenol, each application creates a reliable protecting film over the epidermis, looking after your lips, eyes and other vulnerable areas. For optimal results, use these on a daily basis, increasing personal comfort.","Main Ingredients

Panthenol acts as a skin protectant with anti-inflammatory qualities. It tends to enhance the skin's hydration and elasticity, smoothing its appearance. Ultimately, this component helps with moisture retention;
Caring Cleansing Oils soothe your complexion while also removing all kinds of impurities and nourishing the skin. These help your pores breathe better;
Dimethicone seals hydration, shields your skin from environmental threats, and includes soothing as well as astringent properties;
Lastly, Eucerit® is the first stable water-in-oil emulsion to keep skin moisturized naturally, effectively, and for longer. It not only moisturizes but also gently exfoliates when in conjunction with Alpha-Hydroxy Acids.","How to use
Take out one of the Nivea Creme Care Facial Cleansing Wipes from the packaging. Clean your face as delicately and evenly as possible while having your eyes shut. Don't forget to reseal the pack after use to preserve the freshness of your wipes. Finally, place the dirty wipe on the waste bin instead of it flushing it down the toilet."
https://www.caretobeauty.com/us/noviderm-boreade-cl-cleansing-cream-200ml/,Boréade,200ml,"ACM Laboratoire Boréade CL Cleansing Cream 200ml (6.76floz) is a product that deeply cleanses the skin without stripping it which makes it perfect for combination to oily skin facing dryness and dehydration due to dermatological treatments. With a luxuriously creamy texture, this product can be used in the morning and/or evening to nourish and balance the skin. This product cleanses deeply without stripping the skin's natural oils, making it perfect for daily use. Glycerin not only moisturizes by drawing moisture from the air but also acts as a protective shield against environmental irritants. Combined with Bisabolol this product offers powerful anti-inflammatory and soothing benefits, while Phospholipids provide emollient properties to keep skin supple and hydrated.
This cleansing cream is infused with Zinc Gluconate that not only helps to control sebum production but also provides antibacterial properties. Also, this product has 96% of ingredients of natural origin. In essence, it promotes a clearer, calmer, and more balanced complexion. In this efficient yet gentle formula, your skin finds the protection and care it seeks against external aggressors.","Main Ingredients

Bisabolol provides anti-inflammatory and soothing properties;
Glycerin draws moisture from the air and binds it to the skin. Therefore, this ingredient not only keeps it moisturized but also shielded from environmental sources of irritation;
Phospholipids provides emollient properties;
Zinc Gluconate not only helps control sebum production but also has antibacterial properties.","How to use
Apply ACM Laboratoire Boréade CL Cleansing Cream 200ml (6.76floz) in the morning and/or evening onto damp skin and gently massage it to remove all impurities. Rinse with tepid or cold water."
