Link,brand,volume,description,ingredients,how_to_use
https://www.caretobeauty.com/us/beauty-of-joseon-radiance-cleansing-balm-100ml/,Beauty of Joseon,100ml,"Beauty of Joseon Radiance Cleansing Balm 100ml (3.38 fl oz) cleans the skin with efficacy while delivering the utmost respect. To begin with, this balm elevates your skincare routine through a sensorial experience. It has a soft balm texture that melts upon contact with the skin, to melt away all impurities. Nonetheless, this product is incredibly formulated to maintain its solid sherbet texture without being affected by bathroom temperature and humidity! Most importantly, the oil-based formulation will effortlessly melt away makeup and sebum, presenting an effective cleansing solution. Even more, it removes lip and eye makeup such as mascara and eyeliner without stinging the eyes.
At the same time, the formula is infused with ingredients that embody centuries-old wisdom in Korean history. In particular, this formula features Rice bran and various grain extracts that provide the skin with moisture. In other words, this cleanser does not strip down the skin and avoids the feeling of tightness, leaving the skin feeling comfortable. All in all, this cleanser provides a pleasant and effective cleaning experience to be your getaway to perfectly clean skin. As such, it is a great addition to your double cleansing routine in order to effectively remove makeup.","Main Ingredients

Rice Bran is rich in minerals and amino acids. It moisturizes the skin and, consequently, keeps it hydrated and radiant.","How to use
Take a coin-sized amount of Beauty of Joseon Radiance Cleansing Balm 100ml (3.38 fl oz) with the spatula and apply it to dry skin, massaging gently. Then, rinse thoroughly with lukewarm water."
https://www.caretobeauty.com/us/clarins-gentle-peeling-smooth-away-cream-50ml/,Clarins,50ml,"Clarins Gentle Peeling Smooth Away Cream is a facial scrub that gently removes dead cells and impurities to reveal radiant and smooth skin. The texture is purifying and suitable for all skin types, even to the most sensitive skin. In order to provide amazing and visible results, the formula blends Great Burdock and Primrose extract. Great Burdock has a purifying and cleansing action while soothes the skin. At the same time, Primrose extract helps to maintain an ideal pH balance and help to keep clean and radiant skin. Equally important, this facial scrub is formulated without alcohol, essential oil, fragrance and silicones.
With the everyday-cleanse the skin is free from impurities and excess oils, but alone, it is not enough. Once or twice a week, the skin needs a more in-depth cleanse to remove excess dead cells and to unclog the pores. This gentle facial scrub comforts the skin and helps to reveal the natural radiance.","Main Ingredients

Great Burdock has a purifying and cleansing action while soothes the skin;
Primrose extract helps to maintain an ideal pH balance while helps to keep clean and radiant skin.","How to use
Apply Clarins Gentle Peeling Smooth Away Cream onto the dry skin of the face and neck, avoiding the eye area. Leave the product on the skin for about one minute before massaging gently, from the center of the face outwards. Lastly, rinse it off with lukewarm water and follow with a lotion and a moisturizer."
https://www.caretobeauty.com/us/uriage-bariederm-cleansing-cica-gel-200ml/,Uriage,200ml,"Uriage Bariederm Cleansing Cica-Gel is a hygiene product for irritated face and body skin for all family. It is a cleansing, soothing and purifying gel indicated to reduce the discomfort sensations triggered by micro-organisms, with a ultra-rich formula to keep the skin moisturized. Copper and Zinc Gluconates limit bacterial proliferation, and Uriage Thermal Water soothes the skin, protecting it and preventing new irritations.","Main Ingredients

Uriage Thermal Water soothes the skin;
Patented TLR2-Regul Complex reduces the discomfort sensations triggered by micro-organisms;
Copper and Zinc Gluconates regulates skin's bacterial flora;
Gentle soap-free cleansing base keeps the skin hydrated.","How to use
Apply Uriage Bariederm Cleansing Cica-Gel on the wet skin and massage to transform the gel into foam. Rinse thoroughly. Avoid contact with the eyes."
https://www.caretobeauty.com/us/uriage-roseliane-dermo-cleansing-fluid-250ml/,Uriage,250ml,"Uriage Roséliane Dermo-Cleansing Fluid is a cleansing lotion that eliminates all traced of make-up and impurities while guaranteeing high tolerance for sensitive skins subject to redness. Formulated with a careful selection of plant extracts that includes Apricot Kernel Oil, which contains strong anti-inflammatory and soothing properties, and Uriage Thermal Water, which relieves sensations of discomfort, this lotion provides the skin with purity, freshness and instant well-being.","Main Ingredients
		
Apricot Kernel Oil has strong anti-inflammatory properties and helps soothe the skin and reduce redness;
Uriage Thermal Water, which is pure and naturally rich in mineral salts and trace elements, soothes the skin and relieves sensations of discomfort.","How to use
Apply Uriage Roséliane Dermo-Cleansing Fluid all over the face, neck and eye contour area using a cotton pad. Repeat with a new cotton pad until the skin is completely free of any traces of make-up or impurities. No need to rinse."
https://www.caretobeauty.com/us/nivea-essentials-normal-skin-kit/,Nivea,Not found,"This set contains the following products:

Nivea Refreshing 24h Moisture Day Cream SPF15 50ml
Labello Soft Rosé Lip Balm 4.8g
Nivea MicellAIR 5In1 Micellar Water Normal Skin 200ml

Nivea Refreshing 24h Moisture Day Cream SPF15 gives an instant feeling of moisture and hydration that lasts for up to 24h. The presence of Glycerin results in the ability to retain water on the skin, protect against irritation and also repair the skin barrier. On the other hand, Shea Butter is responsible for its emollient properties and for soothing the skin. And the Vitamin E in the product leads to an antioxidant activity that protects against free radicals and UV rays. With a lightweight formula, quickly absorbed through the skin, this daily moisturizer leaves the skin hydrated and with a refreshing and plumping feeling. In addition, the presence of sunscreen filters allows this product to also protect the skin against UVA and UVB. All in all, it not only deeply hydrates the skin for up to 24 hours but also refreshes, plumps and protects the skin being perfect for everyday use.
Labello Soft Rosé Lip Balm  is an iconic product that not only deeply nourishes your lips but also enhances its natural pink undertone. In fact, this unique lip balm is the perfect blend between care and beauty, leaving your lips smooth and shiny, at the same time. On one side, the incredibly hydrating benefits of this formula are able to keep your skin soft and comfortable for up to 24 hours. Like so, this lip balm not only provides instant nourishment but also prevents future dryness. Concurrently, with each application, the Labello Soft Rosé Lip Balm heightens the natural beauty of your lips, providing a soft fragrance and a delicate tone, as well.
Nivea MicellAIR 5In1 Micellar Water Normal Skin is a practical cleanser that offers five benefits in a single product. This all-in-one formula not only removes makeup but also cleanses the skin while moisturizing, without leaving any product residue, allowing your skin to breathe. Moreover, this cleanser is dermatologically and ophthalmologically tested as well as fragrance-free so it is safe to use on the face, eyes, or lips. Thanks to its micellar technology, it does not require rinsing, ensuring a practical cleansing experience for those with normal skin types.",Not found,Not found
https://www.caretobeauty.com/us/nivea-essentials-sensitive-skin-kit/,Nivea,Not found,"This set contains the following products:

Nivea Nutritive Day Cream - Dry and Sensitive Skin SPF15 50ml
Nivea MicellAIR 5In1 Micellar Water Fragrance Free 200ml
Labello Strawberry Shine Lip Balm 4.8g

Nivea Nutritive Day Cream - Dry and Sensitive Skin SPF15 is a meticulously crafted formula designed to provide intense nourishment and long-lasting hydration for dry and sensitive skin. Infused with natural Almond Oil and Magnolia Extract, it deeply moisturizes the skin for up to 24 hours, ensuring a balance in the skin's moisture level. This formula not only smoothens and nourishes the skin but also shields it from external stressors. Dermatologically approved for its compatibility, this day cream with SPF 15 offers added protection against sun-induced damage, making it an ideal daily skincare solution for maintaining healthy, hydrated, and protected skin.
Nivea MicellAIR 5In1 Micellar Water Fragrance Free 200ml is a practical cleanser that offers five benefits in a single product. To begin with, this micellar water effectively cleans all impurities and removes makeup in a single gesture while being gentle on the skin. At the same time, its formula provides soothing and hydrating benefits. And lastly, it leaves the skin soft and smooth. That said, this cleanser is dermatologically and ophthalmologically tested as well as fragrance-free so it is safe to use on the face, eyes, or lips. As a matter of fact, it was even formulated to meet the needs of sensitive skin, being suitable for all skin types due to its gentle and soothing formula. Thanks to its micellar technology, it does not require rinsing so it is a very practical product.
Labello Strawberry Shine Lip Balm is the perfect blend of care and beauty since it deeply nourishes the lips while providing a beautiful shine and color. In fact, this multipurpose composition promises to deliver not only smooth and healthy skin but also a fun glossy finish. On one side, the Strawberry Shine Lip Balm has a soft red color and a delicious strawberry aroma. Infused with Shine Pigments, this unique lip balm adds a touch of color and radiance to your lips. At the same time, besides its beautifying properties, the Strawberry Shine Lip Balm ensures that your lips have optimal hydration levels for up to 24 hours. The result? You will be able to target chapped lips and flaunt a trendy look, simultaneously!",Not found,Not found
https://www.caretobeauty.com/us/holika-holika-mugwort-pure-essence-foam-cleanser-150ml/,Holika Holika,150ml,"Holika Holika Mugwort Pure Essence Foam Cleanser 150ml (5.07 fl oz)&nbsp;provides deep cleansing with a formula that contains Mugwort Extract that was fermented for three years. Thus, it includes exceptional toning, anti-inflammatory and antiseptic properties. Moreover, this leads to balanced sebum levels and less irritable skin. On top of that, it improves tissue renewal and enhances the skin's resistance to external aggressors, contributing to faster wound healing and relieving any swelling.
On another note, the Charcoal present in this cleanser ensures exfoliation and unclogs the pores. You can say goodbye to any impurities and dead skin cells. Last, but not least, it boosts cell growth and improves the skin texture.
In the end, besides getting a clearer complexion, it leaves it bright and calms it down.","Main Ingredients

Mugwort Extract possesses soothing and anti-inflammatory properties, making it ideal for sensitive or irritated skin. Thus, it calms redness, minimizes skin irritation, and promotes a more balanced complexion. It also contains antioxidants that protect the skin from environmental damage and improve the overall appearance, resulting in healthier, clearer, and more rejuvenated skin;
Charcoal has a porous structure which allows it to effectively absorb excess oil, dirt, and impurities from the skin, making it a great ingredient for deep cleansing and detoxification. Furthermore, it unclogs pores, reduces the appearance of blackheads and acne, and balances oil production. Its antibacterial properties combat bacteria, preventing breakouts and promoting a clearer complexion. Additionally,&nbsp; exfoliates dead skin cells, resulting in smoother and brighter skin.","How to use
Mix a small amount of&nbsp;Holika Holika Mugwort Pure Essence Foam Cleanser 150ml (5.07 fl oz)&nbsp;with a small amount of water. Then, apply it to a damp face and massage it in a circular motion. Finally, rinse thoroughly with lukewarm water."
https://www.caretobeauty.com/us/nivea-micellair-5in1-micellar-water-fragrance-free-100ml/,Nivea,100ml,"Nivea MicellAIR 5In1 Micellar Water Fragrance Free 100ml (3.38 fl oz)&nbsp;is a practical cleanser that offers five benefits in a single product. To begin with, this micellar water effectively cleans all impurities and removes makeup in a single gesture while being gentle on the skin. At the same time, its formula provides soothing and hydrating benefits. And lastly, it leaves the skin soft and smooth. That said, this cleanser is dermatologically and ophthalmologically tested as well as fragrance-free so it is safe to use on the face, eyes, or lips. As a matter of fact, it was even formulated to meet the needs of sensitive skin, being suitable for all skin types due to its gentle and soothing formula. Thanks to its micellar technology, it does not require rinsing so it is a very practical product.&nbsp;Even more, this 100ml capacity turns it ideal to take with you anywhere or while traveling.&nbsp;
In addition to respecting the skin, this micellar water also respects the environment given its vegan formula and packaging with 95% of recycled material (excluding caps and labels).&nbsp;","Main Ingredients

Grape Seed oil contains antioxidants and fatty acids that protect and nourish the skin, providing a smooth feel;
Glycerin is a great humectant, meaning it has the ability to attract and retain water in the skin. Consequently, it hydrates the skin;
Panthenol moisturizes the skin but it also provides anti-inflammatory properties, soothing the skin and reducing irritation.&nbsp;","How to use
Apply Nivea MicellAIR 5In1 Micellar Water Fragrance Free 100ml (3.38 fl oz)&nbsp;&nbsp;into a cotton pad or reusable alternative. Then, swipe it over your face, eyes, and lips with gentle movements to completely remove the makeup."
https://www.caretobeauty.com/us/uriage-refreshing-make-up-removing-jelly-150ml/,Uriage,150ml,"Uriage Refreshing Make-up Removing Jelly 150ml (5 fl oz) is a soft cleansing gel that helps to clean and purify the skin, while also being able to remove makeup. Due to the presence of soft cleansing agents, this product cleanses the skin without stripping it, which leaves a fresh and comfortable feeling on the skin. With the combination of Uriage Thermal Water and Edelweiss Extract, besides cleansing the skin, this gel is also able to soothe, improve the skin barrier and prevent the proliferation of bacteria. The presence of Glycerin provides this formulation with humectant properties, which help to not only hydrate the skin by capturing water present in the air but also protect it from external aggressors. With the regular use of this product, in the morning and/or evening, it leaves the skin clear, soft, and smooth.","Main Ingredients

Uriage Thermal Water not only hydrates and soothes but also improves the skin barrier;
Edelweiss Extract helps both soothe and hydrate the skin, while also providing some anti-bacterial properties;
Glycerin draws moisture from the air and binds it to the skin. Therefore, this ingredient not only keeps it moisturized but also shielded it from environmental sources of irritation.","How to use
Lather Uriage Refreshing Make-up Removing Jelly 150ml (5 fl oz) on your hands with some water. Then apply the foam to your face and softly massage using circular motions in order to deeply cleanse the skin. Then rinse the product thoroughly with water until the product is fully removed. Follow up with your normal skincare routine."
https://www.caretobeauty.com/us/sisley-paris-eye-and-lip-gel-make-up-remover-120ml/,Sisley Paris,120ml,"Sisley Paris Eye and Lip Gel Make-Up Remover 120ml (4 fl oz)&nbsp;is a high-end makeup remover specially designed to remove stubborn and waterproof makeup from the eye and lip area. It has been ophthalmologically&nbsp;tested. On top of being extremely effective, it is also very gentle so it doesn't irritate these delicate areas. At the same time, it infuses the skin with skincare benefits by hydrating and refreshing it, without leaving an oily feeling. Additionally, it reduces the loss of lashes associated with makeup removal, as it enhances and softens them. Hence, the eye area looks more rested and luminous. Due to its melting gel texture, it applies easily and provides moments of comfort, leaving the skin soft and cleansed. In the end, this makeup remover creates a special well-being moment in the skincare routine for both the face and mind. Expect the area around the eyes and lips to be free of dust and impurities.","Main Ingredients

Peony Extract has many nourishing properties that protect the skin barrier from damage and moisture loss. At the same time, it is a gentle extract that provides softness and comfort to the skin. Lastly, it also brightens the complexion and boosts skin regeneration;
Cornflower Hydrolat has healing and anti-aging properties that plump and tone the skin, leaving it soft and smooth;
Plant Glycerin protects against irritation and infection, thanks to its healing properties. At the same time, it boosts skin elasticity;&nbsp;
Ginseng has anti-aging properties that stimulate good circulation and boost skin radiance. Hence it reduce wrinkles and fine lines, evening the tone.","How to use
Apply Sisley Paris Eye and Lip Gel Make-Up Remover 120ml (4 fl oz)&nbsp;either with a cotton pad or with the fingertips onto the eyes and/or lips. Then, massage from the inside out in circular movements. Repeat until all the makeup has been removed. If you use the fingertips, finish the procedure with a cotton pad and do not rinse."
https://www.caretobeauty.com/us/uriage-tolederm-control-make-up-removing-milky-gel-150ml/,Uriage,150ml,"Uriage Toléderm Control Make-up Removing Milky Gel 150ml (5 fl oz) is a soft cleansing milky gel that helps to clean and purify the skin, while also being able to remove makeup. Due to the presence of soft cleansing agents, this product cleanses the skin without stripping it, which leaves a comfortable feeling on the skin. With the combination of Uriage Thermal Water and Glycerin, besides cleansing the skin, this milky gel is also able to soothe, improve the skin barrier and protect the skin from external aggressors. The presence of Squalane provides this formulation with nourishing properties. This helps to not only hydrate the skin but also restore the skin barrier. With the regular use of this product, in the morning and/or evening, it leaves the skin clear, soft, and hydrated. Due to its minimalist formula, this product can be safely used on allergic or intolerant skin types without causing irritation.","Main Ingredients

Uriage Thermal Water not only hydrates and soothes but also improves the skin barrier;
Glycerin draws moisture from the air and binds it to the skin. Therefore, this ingredient not only keeps it moisturized but also shielded from environmental sources of irritation;
Squalane replenishes the skin’s natural lipids, providing therefore a nourishing touch.","How to use
Apply Uriage Toléderm Control Make-up Removing Milky Gel 150ml (5 fl oz) with a cotton pad/washable cleansing pad or with fingertips. The product does not need to be rinsed off, however, if you feel more comfortable you can rinse it with water. Follow up with your normal skincare routine."
https://www.caretobeauty.com/us/codex-beauty-bia-gentle-cleansing-oil-30ml/,Codex Labs,30ml,"Codex Labs Bia Gentle Cleansing Oil 30ml (1.01fl oz) is a light and effective cleansing oil that removes impurities and makeup without disrupting the skin's moisture barrier. Infused with an impressive blend of nourishing and protective ingredients, this cleanser promises to leave your skin matte and purified, supporting hydration levels simultaneously. In fact, components like Borage Flower Oil, Chia Seed Oil, and Oat Lipids prevent water loss while soothing and nourishing your complexion. Even more, the presence of Blackcurrant Seed shields the skin from environmental aggressions supplying a rejuvenating action, as well.
In addition to these benefits, the Bia Gentle Cleansing Oil also provides a pleasant user experience thanks to its unique texture. The rich oily consistency becomes a milky emulsion when in contact with water ensuring an effortless rinsing process.
To conclude, the Bia Gentle Cleansing Oil has a vegan composition and is certificated as a cruelty-free product by the Leaping Bunny Program.","Main Ingredients

Borage Flower Oil helps to protect the skin water balance and prevent water loss;
Blackcurrant Seed not only protects the skin from environmental aggressions but also provides a rejuvenating effect;
Oat Lipids are responsible for soothing and calming the skin;
Chia Seed Oil also has balancing and hydrating properties that protect the skin&rsquo;s moisture barrier.","How to use
Use Codex Labs Bia Gentle Cleansing Oil 30ml (1.01fl oz) as part of your regular morning and evening skincare routine. Apply an appropriate amount to the wet skin of your face and neck with the help of your fingers. Then, gently massage the formula with rotating movements in order to melt impurities and makeup. Finish by rinsing thoroughly. Discover the remaining Bia Collection to improve your results."
https://www.caretobeauty.com/us/babe-micellar-water/,Babé,400ml (13.53 fl oz),"Babé Micellar Water is a cleansing micellar water that in a single gesture removes both impurities and makeup from face, eyes and lips. Due to the presence of a soothing complex that helps reduce itching and irritation, this product is suitable for all skin types including those more sensible. In addition, it also contains moisturizing ingredients. Altogheter, this cleansing water provides comfort, freshness and moisture to the skin.","Main Ingredients

1% Betaine moisturizes, calms and also helps reduce inflammation;
2,50% Glycerin keeps the skin hydrated;
0,25% Soothing Complex reduces itching and also irritation.","How to use
Apply Babé Micellar Water  to both face and eyes, using a cotton pad. Repeat application if necessary. Do not rinse."
https://www.caretobeauty.com/us/a-derma-biology-micellar-water-hydra-cleansing/,A-Derma,400ml (13.53 fl oz),"A-Derma Biology Micellar Water Hydra-Cleansing is a refreshing cleanser suitable for fragile skin that removes makeup and impurities. Containing 100% of ingredients of natural origin, this refreshing water cleanser allows a quick and thorough cleanse without rinsing, suitable for the eye area. The formula feels incredibly gentle on the skin and manages to cleanse without leaving the skin feeling dry. This product replaces the original A-Derma Sensifluid Water Cleansing Micellar now with a new and improved formulation.
Featuring Rhealba® oat together with dandelion, this vegan formula not only cleanses but also replenishes fragile skin. Organic Rhealba® oat hydrates the skin all the while helping to bring it back to balance. At the same time, dandelion extract works to protect the skin with powerful anti-pollution action. Both hydrating and non-sticky, this cleansing water was tested on allergic skin and grants a complete cleanse all the while being gentle on the skin.","Main Ingredients

Organic Rhealba® oat hydrates fragile skin and helps to bring skin back to balance at the same time;
Dandelion extract protects the skin with a powerful anti-pollution action;","How to use
Apply A-Derma Biology Micellar Water Hydra-Cleansing over a cotton pad and then work it gently across the face, including the eye area. No need for rinsing afterward."
https://www.caretobeauty.com/us/d-aveia-pta-acneic-skin-cleansing-emulsion-200ml/,D'AVEIA,200ml,"D'AVEIA PTA Acneic Skin Cleansing Emulsion 200ml (6.76fl oz) is a gentle fluid emulsion that provides daily cleansing for your skin. Specifically, this facial cleanser is indicated for oily skin, with acne tendency or seborrheic dermatitis. This is because this emulsion has a seborregulatory, keratolytic and calming action, ideal for these types of skin. Furthermore, this product helps to deeply cleanse your skin so that it is free of any traces of dirt or accumulated oil. In turn, the presence of Salicylic Acid prevents sebum retention, while Azeoglycine reduces the oiliness of the skin's surface. This way your physiological balance is restored while you also gain a new, cleaner and fresher appearance. Regarding skin sensitivity and irritation, Beta Glucan, Europaea Oil and Gamma-Orizanol exert an anti-irritant and soothing action. Finally, according to dermatological tests by D'AVEIA, the skin has a lesser tendency to oily throughout the use of this emulsion. All in all, this product helps to deeply cleanse your skin while helping to reduce oiliness and acne.","Main Ingredients

Colloidal oatmeal is rich in antioxidants and has soothing properties for the skin;
Salicylic Acid helps control the skin's sebum production. Furthermore it can exfoliate skin both on the surface and in the pores;
Olive Fruit Oil has great nourishing and moisturizing capabilities for the skin.","How to use
Apply D'AVEIA PTA Acneic Skin Cleansing Emulsion 200ml (6.76fl oz) to your moistened skin and massage it gently. Leave it for a few minutes and then rinse. Can be used on face and torso."
