Link,brand,volume,description,ingredients,how_to_use
https://www.caretobeauty.com/us/round-lab-mugwort-calming-toner-300ml/,Round Lab,300ml,"Round Lab Mugwort Calming Toner 300ml (10.1floz) is a hydrating and soothing toner that helps calm irritated skin. Crafted with the power of mugwort, this toner provides a refreshing experience that soothes and restores irritated skin. Sourced from Geomun-do Island, where the plant is nurtured by fresh sea breezes, this key ingredient is ideal for reducing redness and calming skin discomfort. Additionally, madecassoside further delivers skin-calming effects. The formula is also enriched with a blend of ingredients such as red seaweed, sugarcane, cocoa seed extracts, and betaine, which collectively enhance the toner's soothing effects. So, these ingredients bring additional hydrating and antioxidant benefits, helping to maintain a healthy, resilient complexion.
Lastly, this lightweight toner allows for effortless application and is ideal for layering. Its non-sticky texture allows it to be absorbed quickly, leaving the skin feeling refreshed and comfortable without any residue. So, whether you're dealing with stressed skin or simply seeking a toner that offers soothing hydration, this toner is a good option to add to your daily skincare routine.","Main Ingredients

Mugwort Extract helps to soothe irritated skin and also provides antioxidant effects;
Red Seaweed Extract is rich in compounds such as beta-carotene and antioxidants such as zeaxanthin and lutein, helping to protect the skin from oxidative damage including blue light exposure. Additionally, it helps hydrate and smooth the skin;
Betaine is a humectant that helps to balance the skin's water levels;
Sugarcane Extract helps the skin attract and retain water. Therefore, it hydrates the skin;
Madecassoside comes from Centella asiatica. It helps soothe inflammation, reduce free radical damage, and enhance hydration;
Cocoa Seed Extract has antioxidant properties.","How to use
Apply an appropriate amount of Round Lab Mugwort Calming Toner 300ml (10.1floz) onto the skin of the face, after cleansing. Then, gently tap the skin to promote absorption."
https://www.caretobeauty.com/us/babe-stop-akn-astringent-tonic-lotion-250ml/,Babé,250ml,"Bab&eacute; Stop AKN Astringent Tonic Lotion is a purifying toner lotion, that balances combination/oily and acne-prone skin.",Not found,"How to use
Apply&nbsp;Bab&eacute; Stop AKN Astringent Tonic Lotion to your face using a cotton pad."
https://www.caretobeauty.com/us/nuxe-very-rose-refreshing-toning-mist-200ml/,NUXE,200ml,"NUXE Very Rose Refreshing Toning Mist is a gentle toner, suitable for all skin types, including sensitive skin. Removing cleanser residues and preparing the skin for the application of the next skincare product it is perfect to complete your cleansing routine. In the form of a mist, it is a quick and easy product to apply that will refresh, soothe, and comfort your skin due to its unique formula. Containing 95% natural origin ingredients it helps retain water in the skin and offers both soothing and softening properties. Preventing dryness and strengthening the skin barrier this toning mist helps preserve the natural balance of the skin. In addition, along with these benefits, it is able to provide you a wonderful sensorial experience with its subtle, fresh, and delicate rose scent.","Main Ingredients

Allantoin, which is known for its soothing and also softening properties;
Rose Floral Water has the ability to both soothe and soften all skin types including sensitive skin;
Skin-Respect Complex, a combination of botanical-origin sugars, has the ability to retain water and strengthen the skin barrier. It helps prevent dryness and preserve the natural balance of the skin.","How to use
While keeping your eyes closed, spray NUXE Very Rose Refreshing Toning Mist over the face from a distance of 15cm. Leave it to dry or remove the excess with a tissue."
https://www.caretobeauty.com/us/cosrx-bha-blackhead-power-liquid-100ml/,COSRX,100ml,"COSRX BHA Blackhead Power Liquid has a simple yet deeply effective formula designed to detoxify oily or acne-prone skin types. In fact, thanks to a liquid texture, it enters your skin ready to regenerate the natural moisture barrier, unclogging as well as refining pores. With each application, a gentle chemical exfoliation takes place, ridding your complexion of acne, blemishes, or other types of daily impurities. To the same extent, this nutritive cleansing option helps regulate excess sebum production, balancing as well as soothing for a long period of time. In the end, you'll notice an extra luminous finish, as dead skin cells and blackheads are cast aside. Made of Beta Hydroxy Acid and reinforced with Willow Bark Water, it prevents irritation/redness, being a powerful ally for the most sensitive skin types. Fortified, moisturized, and shield from harmful external factors, the epidermis regains its health in a heartbeat.","Main Ingredients

Willow Bark Water helps to reduce inflammation - as well as other types of congestion - and soothe the skin;
Niacinamide - also known as vitamin B3 - minimizes the impact of external threats, improving one's skin tone. Water-soluble, this ingredient soothes your complexion, targeting enlarged pores as well as fine lines, wrinkles, or dullness;
Lastly, Panthenol acts as a skin protectant with anti-inflammatory qualities. It tends to enhance the skin's hydration and elasticity, smoothing its appearance. Ultimately, this component retains moisture and water in the skin, allowing it to hydrate from the inside out;","How to use
COSRX BHA Blackhead Power Liquid can be used as an essence or a toner and should be applied after cleansing the skin. You should apply a small portion into a cotton pad or a reusable towel. Then, delicately sweep it all over your face, staying away from the sensitive eye and mouth sections. If used as a toner you should make sure the liquid is fully absorbed before applying the next skincare products."
https://www.caretobeauty.com/us/benton-deep-green-tea-toner-150ml/,Benton,150ml,"Benton Deep Green Tea Toner helps to rejuvenate and soften one's complexion by relying on over 50% Green Tea Leaf Water. Originally from Korea, this ingredient relieves redness and irritation, putting a stop to imbalances in skin tone/texture.  Moreover, this toner works best when used right after cleansing your face as it helps to preserve optimal moisture levels. Among other skin-loving components, this option includes Centella Asiatica, Houttuynia Cordata, and Willow Bark Extracts. 
To the same extent, Hyaluronic Acid acts like a sponge that attracts a vast quantity of water in the air. In turn, truly hydrated as well as nourished, your complexion is able to thrive and live up to its full potential. Meanwhile, the liquid formula penetrates easily into damaged skin tissues allowing them to recover so they can receive the benefits of other products. Thus, after each application, you're free to use your makeup essentials, finishing off your beauty routine. Finally, free of artificial fragrances and pigments, this toner suits and balances the pH levels of all skin types for the ultimate polished outcome.","Main Ingredients

Green Tea Leaf Water is rich in polyphenols, which target free radicals, particularly those caused by UV-induced skin damage;
Sodium Hyaluronate - also known as Hyaluronic Acid - is a restorative ingredient that not only boosts skin hydration as it holds in moisture;
Centella Asiatica Extract soothes as well as restores the skin, promoting long-term radiance and hydration;
Houttuynia Cordata Extract re-firms the appearance of the skin while also reducing puffiness around more sensitive areas;
Pomegranate Fruit Extract is rich in antioxidants and helps support skin renewal while also protecting against harsh environmental influences;","How to use
Apply a generous amount of Benton Deep Green Tea Toner over the face and pat gently to facilitate the absorption of beneficial ingredients. For optimal results, use in conjunction with Benton Deep Green Tea Serum as well as Benton Deep Green Tea Lotion. Finally, you can also complete this soothing treatment by resorting to Benton Deep Green Tea Cleansing Foam. Apply the different products with your hands or using a cotton pad/reusable towel."
https://www.caretobeauty.com/us/madara-clarifying-toner-200ml/,Mádara,200ml,"Mádara Clarifying Toner  is a purifying product specially developed for oily skin and to target conditions associated with this type of complexion. On one side, we are talking about a formula that balances the skin’s pH and controls the oil levels thanks to ingredients like Oak Bark and Sweet Flag. This toner also has a deeply exfoliating performance, unclogging pores and mattifying the skin. Therefore, the Clarifying Toner does not only effectively prevent blemishes but also keeps the skin looking and feeling fresh. In addition to that, it has a pore-minimizer effect and prepares your skin to be moisturized. With regular use, your skin will look more radiant, uniform, and healthy. 
The Mádara Clarifying Toner also follows the brand’s ethical and sustainable concerns. In fact, this is a vegan and cruelty-free formula that comes in a 100% post-consumer recycled bottle. 
You can apply this product in the morning or at night-time, with the help of a cotton pad or by just applying some drops of the product in your hands and gently tapping the face.","Main Ingredients 
 
Oak Extract is a powerful natural astringent; 
Sweet Flag Extract helps to keep the skin fresh and matte thanks to its ability to reduce oiliness; 
Salvia Leaf Extract is an antibacterial and antiseptic component that also balances the skin; 
Salicylic Acid is an exfoliating ingredient that effectively reduces black and whiteheads. Moreover, this component has anti-inflammatory and soothing proprieties, additionally hydrating and calming the skin; 
Sage is an antioxidant ingredient.","How to use 
Apply Mádara Clarifying Toner  to clean skin with cotton pad or by delicately splashing it with your hands. Then, follow up with your favourite moisturizer."
https://www.caretobeauty.com/us/evolve-liquid-radiance-glycolic-toner-100ml/,Evolve,100ml,"Evolve Liquid Radiance Glycolic Toner 100ml (3.38fl oz) is natural exfoliating treatment suitable for all skin types, even the most sensitive. For skin that looks dull, uneven, and lacking in natural luminosity, this exfoliating toner combines 100% natural origin AHAs (alpha hydroxy acids) and BHAs (beta hydroxy acids) in order to boost cellular turnover and reveal a glowing, naturally beautiful complexion. Glycolic, Malic, and Salicylic Acids gently exfoliate and refine the surface of the skin, making it brighter and even.  On the other hand, Galactoarabinan works to prevent loss of water which helps minimize dryness, sensitivity, and irritation. The skin is renewed with minimum irritation, emerging with a newfound glow that radiates health and beauty.","Main Ingredients

Salicylic Acid, sourced from willow bark, increases cell turnover in order to renovate and refine the surface of the skin. It exfoliates with minimal irritation, thus unveiling a smooth and healthy-looking complexion;
Glycolic Acid offers a gentle exfoliating action, improving radiance and evening out the skin tone;
Malic Acid gently exfoliates the skin to improve the skin texture and brightness;
Galactoarabinan is a natural polysaccharide that comes from the Western Larch tree. Not only does it prevent moisture loss, therefore reducing the appearance of fine lines on the surface of the skin, but it also boosts the effectiveness of AHAs.","How to use
In the evening, apply Evolve Liquid Radiance Glycolic Toner 100ml (3.38fl oz) to the previously cleansed skin of the face and neck. Use gentle sweeping motions in order to cover all the desired areas. Do not rinse. Since this product is a chemical exfoliator, you should always apply sunscreen in the morning after using it.
Because this product contains willow bark extract, it is not recommended for use during pregnancy."
https://www.caretobeauty.com/us/obagi-nu-derm-toner-198ml/,Obagi,198ml,,Not found,Not found
https://www.caretobeauty.com/us/frezyderm-ac-norm-normalizing-lotion-200ml/,Frezyderm,200ml,"Frezyderm Ac-Norm Normalizing Lotion 200ml (6.76floz) is specifically suitable for oily and acne-prone skin. This product stands out for its unique blend of active ingredients aimed at addressing various concerns associated with acne-prone skin. One of the key ingredients is Oleanolic acid-NDGA, known for its sebum-regulation and anti-microbial properties. This component plays a crucial role in balancing oil production and combating acne-causing bacteria. Additionally, Fomes officinalis in the formula adds pore-tightening and astringent effects. This ingredient aids in minimizing the appearance of enlarged pores, a common concern for those with oily skin. The formula also includes Deepsan, an innovative component that helps reduce skin discomfort and irritation.
Another key point of this lotion is its versatility as it can be used on both the face and body. It is especially effective in treating back acne. In summary, this lotion is a great choice for complementing the cleansing step in oily and acne-prone skin. Its formula combines sebum-regulating, antimicrobial, pore-tightening, and soothing ingredients to address the multiple facets of acne-prone skin. All in all, it provides a cleaner and more refined skin texture while contributing to a comfortable skin feel.","Main Ingredients

Oleanolic acid-NDGA helps reduce skin inflammation and limit excessive sebum production, abnormal keratosis, and bacterial proliferation. Therefore, it helps fight acne;
Fomes officinalis extract is a mushroom extract that naturally contains agaric acid with astringent properties. Consequently, it helps tighten the pores;
Deepsan helps reduce skin irritation and discomfort.","How to use
Soak a cotton pad or reusable alternative with Frezyderm Ac-Norm Normalizing Lotion 200ml (6.76floz) and swipe over clean, dry skin. Suitable for acne on the back."
https://www.caretobeauty.com/us/rvb-lab-microbioma-balancing-hydra-toner-200ml/,RVB LAB,200ml,"RVB LAB Microbioma Balancing Hydra-Toner 200ml (6.8 fl oz) is a toner that helps maintain a healthy skin barrier and microbiota. The ReviBiome System, integral to this toner, includes prebiotics and probiotics that balance the skin’s microbiota and strengthen its barrier function. So, this helps prevent irritation, dehydration, and also premature aging, ensuring the skin stays healthy and resilient. The toner also features microspheres of hyaluronic acid that gently melt into the skin, releasing a boost of hydration. This provides the skin with a feeling of softness and freshness. Additionally, this toner is enriched with trehalose, a sugar that not only hydrates the skin but also protects its cells from external aggressors and oxidative stress.
This toner is especially suitable for sensitive and sensitized skin or for anyone looking to maintain a healthy complexion. So, by incorporating this toner into your daily routine, you can enjoy the benefits of a well-balanced microbiota and a stronger skin barrier, leading to healthier, more radiant skin.","Main Ingredients

ReviBiome System consists of prebiotics (glucan oligosaccharides), probiotics (Lactobacilli acidophilus and Lactobacilli casei), and microbiome boosters (Revivyl™ and Acetyl Heptapeptide-4), which help maintain a healthy skin microbiome and reinforce the skin barrier;
Hyaluronic Acid attracts and retains water, functioning as a humectant and helping the skin to restore its water balance. Therefore, it leaves the skin soft and plump;
Trehalose is a plant sugar that helps to retain moisture, hydrating the skin. It also has antioxidant properties, helping to protect the skin against environmental damage.","How to use
Dispense an appropriate amount of RVB LAB Microbioma Balancing Hydra-Toner 200ml (6.8 fl oz) onto a cotton pad. Then, gently wipe it across the skin in circular motions in order to release the hyaluronic acid from the spheres."
https://www.caretobeauty.com/us/babe-depigment-lotion-glow-150ml/,Babé,150ml,"Babé Depigment+ Lotion Glow 150ml (5.07 fl oz) illuminates, renews, and evens out the skin tone. For that purpose, the formula blends ingredients with depigmenting action, namely vitamin C, and niacinamide, alongside an exfoliating acid. On one hand, vitamin C contributes to increasing luminosity and evenness of skin tone. Then, niacinamide plays a dual role. It not only helps in unifying the skin tone but also strengthens the skin's barrier function. Accompanying this is gluconolactone, a gentle exfoliating acid that aids in the softening and smoothing of the skin surface. Additionally, pantenol and hyaluronic acid both work to provide hydration. Last but not least, a pre-postbiotic supports a healthy microbiome. As such, this product helps reduce the appearance of dark spots.
The innovative texture of this product offers a refreshing experience and is suitable for daily use, both morning and night, as a step following facial cleansing. In summary, this lotion aims to brighten, renew, and even out the skin tone.","Main Ingredients

2% vitamin C derivative is an antioxidant with the ability to brighten the skin and reduce the appearance of dark spots and uneven skin tone;
3% niacinamide inhibits melanin transfer and has brightening properties, thereby reducing the appearance of dark spots;
5% gluconolactone is a polyhydroxy acid known for its gentle exfoliating properties. As such, it helps renew the skin's surface, consequently making it smoother, more radiant, and even;
2% panthenol has hydrating and soothing properties;
0.1% hyaluronic acid has the ability to retain water which makes it an excellent hydrating agent, thus helping to keep the skin plump and hydrated;
0.1% pre-postbiotic is a postbiotic lysate that also acts as a prebiotic. This ingredient supports the skin's microbiome, which is essential for a healthy skin barrier and protecting the skin against aggressions.","How to use
Apply Babé Depigment+ Lotion Glow 150ml (5.07 fl oz) to clean, dry skin. Pat gently to absorb."
https://www.caretobeauty.com/us/one-thing-hyaluronic-acid-complex-toner-150ml/,One Thing,150ml,"One Thing Hyaluronic Acid Complex Toner 150ml (5.0 fl oz) is a focused skincare solution, specially formulated for those who prefer a minimalist approach to their skincare routine. In particular, this toner features hyaluronic acid, a renowned ingredient for its moisturizing properties. This toner utilizes hyaluronic acid's ability to provide deep hydration, effectively plumping fine lines and making them less noticeable. In particular, it combines the effectiveness of low molecular and high molecular hyaluronic acid. High molecular weight hyaluronic acid forms a film on the skin's surface that prevents water evaporation while low molecular hyaluronic acid delivers deep hydration. As such, this toner focuses on delivering intense hydration and addressing fine lines that are often highlighted by dehydrated skin. The result is soft, smooth and elastic skin!","Main Ingredients

Hyaluronic acid, in both low and high molecular weights, actively boosts skin hydration. On one hand, 9,500ppm low molecular weight hyaluronic acid acts deeply in the skin to capture and retain moisture. The 9,500ppm low molecular weight hyaluronic acid penetrates deep into the skin to capture and retain moisture. Meanwhile, the 500ppm high molecular weight hyaluronic acid forms a protective, hydrating film on the surface to prevent dehydration. Consequently, this dual action leaves the skin hydrated and plumped.","How to use
Apply One Thing Hyaluronic Acid Complex Toner 150ml (5.0 fl oz) to clean, dry skin after cleansing, with a cotton pad or reusable alternative. Alternatively, mix 5-10% with your skincare products on the palm of your hand (for example: 5 to 10 ml of this product with 100 ml cream). You can also soak a cotton/reusable pad with the product and apply it to the affected areas for 10 minutes. You can also transfer a portion of the toner to a small spray bottle to create your mist and spritz it whenever necessary."
https://www.caretobeauty.com/us/skinfood-pantothenic-water-parsley-toner/,SKINFOOD,"300ml (10.14 fl oz)
                                                                                            - Out of Stock","SKINFOOD Pantothenic Water Parsley Toner is a toner that helps to decrease excess sebum while also soothing and hydrating the skin. It is especially suited for acne-prone skin, due to being able to calm inflammation, which is common with breakouts. So, this toner contains Hanjae water parsley extract, which is processed by a special method that helps to extract larger amounts of beneficial compounds. Water parsley contains pantothenic acid, which helps to hydrate the skin and to keep a healthy skin barrier. It also helps to decrease excess sebum and soothe the skin. Additionally, this product contains a complex of sage, chamomile and Centella asiatica, as well as dipotassium glycyrrhizate, further helping to soothe inflamed skin. Even more, this toner contains salicylic acid, an ingredient known for acting on pores to clear up excess oil and skin cells, targeting blemishes.
One study found that, after 4 weeks of using this product, the amount of sebum on the face decreased by 25%. All in all, this toner helps to regulate excess oil while hydrating and calming inflamed skin, making it ideal for oily to combination skin, especially acne-prone skin.","Main Ingredients

Water Parsley Extract contains pantothenic acid, also called Vitamin B5. Vitamin B5 hydrates the skin and helps to maintain a healthy skin barrier. It also acts by regulating excess oil on the skin and has soothing and anti-inflammatory properties;
Dipotassium glycyrrhizate is found in licorice. It has soothing, anti-inflammatory, and sebum-regulating effects;
A complex of three plant extracts, Sage, Chamomile and Centella asiatica, helps to soothe inflamed skin;
Salicylic Acid, also called a beta-hydroxy acid (BHA), is an oil-soluble acid. Due to this, it removes dead skin cells not only on the skin's surface but also inside the pores. So, this makes it effective in refining the skin texture and reducing blackheads and whiteheads. It also soothes inflamed skin.","How to use
Soak a cotton pad with SKINFOOD Pantothenic Water Parsley Toner and apply onto previously cleansed skin of the face. Alternatively, apply the product to the fingers and then massage the face. Do not rinse."
https://www.caretobeauty.com/us/dr-ceuracle-pro-balance-biotics-toner-300ml/,Dr. Ceuracle,300ml,"Dr. Ceuracle Pro Balance Biotics Toner 300ml (10.14 fl oz) helps to complement your cleansing routine while delivering hydrating and soothing benefits. So, this toner's formula is enriched with Biomimetic Water. As the name suggests, this ingredient resembles the natural composition of the skin, by containing water, proteins, and lipids - more precisely mineral water, L-theanine, glutathione, and milk lipids. So, it delivers a boost of hydration and nourishment to the skin, as well as soothing effects. Additionally, it protects the skin, thanks to six probiotic ingredients that help to support a healthy skin microbiome and strengthen the skin barrier. Even more, ingredients such as Purslane and Centella Asiatica extracts enhance this toner's soothing effects, helping to calm redness and irritation.
This toner's formula is alcohol-free and has a low, skin-optimal pH, making it gentle for the skin. All in all, this is a great choice to rebalance the complexion and finish off your cleansing steps, removing any remaining impurities and preparing your skin to receive the next products of your skincare routine.","Main Ingredients

Biomimetic Water consists of a blend of mineral water, theanine, glutathione, and milk lipids. It shows emollient and hydrating properties, helping to moisturize, soften, and soothe the skin; 
Phyto G.Fer-kefir and a Complex of 5 Probiotics support a healthy skin microbiome. So, they help to maintain and strengthen the skin barrier, protect against environmental aggressions, and restore the skin's oil-moisture balance.","How to use
Dispense an appropriate amount of Dr. Ceuracle Pro Balance Biotics Toner 300ml (10.14 fl oz) onto a cotton pad or directly onto the palms. Then, apply it to previously cleansed skin of the face and neck, gently wiping the product. Wait until the product is fully absorbed before continuing with your skincare routine."
https://www.caretobeauty.com/us/la-cabine-hyaluronic-infusion-micellar-tonic-multi-action-toner-200ml/,La Cabine,200ml,,Not found,Not found
https://www.caretobeauty.com/us/pestle-mortar-clarify-toner-200ml/,Pestle & Mortar,200ml,,Not found,Not found
https://www.caretobeauty.com/us/dr-hauschka-clarifying-toner-100ml/,Hauschka,100ml,"Dr. Hauschka Clarifying Toner is a fine mist which balances the skin thanks to the botanical blend that helps to regulate sebum and hydrate. Perfect for man as an after-shave for irritated skin, this fine mist can be directly sprayed onto the skin after cleansing, shaving or throughout the day. In order to help unregulated skins, this toner tightens dilated pores and regulates sebum production, while keeping the skin hydrated at the same time.","Main Ingredients

Anthyllis extract provides not only an antioxidant effect but also a hydration kick that deeply moisturizes the skin;
Nasturtium provides antioxidant protection in order to fight free radicals.","How to use
Spray Dr. Hauschka Clarifying Toner&nbsp;in the morning and evening after cleansing the skin. Then, follow with light pressing movements in order to help it penetrate the skin better. For men, this toner is perfect for using after shaving."
