Link,brand,volume,description,ingredients,how_to_use
https://www.caretobeauty.com/us/esthederm-osmoclean-hydra-replenishing-fresh-lotion-200ml/,Esthederm,200ml,"Esthederm Osmoclean Hydra-Replenishing Fresh Lotion is a refreshing toning lotion that helps to remove the last traces of make-up and impurities from the skin. On the other hand, this lotion has a great moisturizing action for the skin while leaving it cleaner and fresher. Furthermore, this luxurious product is ideal for soothing the visible dry effects on the skin caused by overly mineralized water. Finally, its smooth, light and refreshing texture clings to the skin in order to remove all impurities deep in the pores. With an excellent tolerance and safety, this product is indicated for all skin types leaving them without any discomfort, more clean and hydrated.","Main Ingredients

Cellular Water is part of all Esthederm products. It consists of water enriched with mineral salts that excels in providing high quality hydration to the skin;
Glycerin attracts water and binds it to the skin, keeping it hydrated and also shielded from environmental sources of irritation;
Citric Acid has an exfoliating action by gently lifting dead skin cells from your skin, leaving it cleaner and fresher.","How to use
Apply Esthederm Osmoclean Hydra-Replenishing Fresh Lotion to the face using a cotton pad soaked with the product after cleaning with Esthederm Osmoclean Hydra-Replenishing Cleansing Milk."
https://www.caretobeauty.com/us/one-day-s-you-pore-tightening-toner-150ml/,One-day's you,150ml,,Not found,Not found
https://www.caretobeauty.com/us/g9-skin-white-in-milk-toner/,G9 Skin,"50ml (1.69 fl oz)
                                                                                            - Out of Stock","G9 Skin White in Milk Toner is a hydrating toner that offers multiple benefits to the skin. That said, this incredible formula not only provides optimal moisture levels but also improves skin's radiance and the appearance of wrinkles. To begin with, the formula features a complex of nine brightening and nourishing ingredients, with Niacinamide and Milk Protein extract included. Then, it also contains a blend of moisturizing and soothing ingredients, amongst which are Hyaluronic acid, Almond oil, and Ceramide NP. And lastly, this formula boasts the anti-aging properties of Adenosine to improve the appearance of wrinkles. This powerful combination of exceptional ingredients results in astonishing results!
Furthermore, this product it's incredibly versatile as you can use it as a toner or as a makeup primer, whether in the morning or the evening routine. In conclusion, this toner helps to brighten and nourish the skin.","Main Ingredients

Milk Protein Extract is rich in properties that help nourish and brighten the skin;
Glutathione is an important antioxidant in cells, protecting from free radical damage. Besides, it also brightens the skin, thus promoting an even skin tone;
Niacinamide has several benefits. It has antioxidant and sebum-regulating properties. At the same time, it improves the skin barrier and hydration, thus painting an optimal water-oil balance. Last but not least, it brightens the skin and helps diminish hyperpigmentation;
Ceramide NP promotes a healthy skin barrier and, consequently, helps prevent moisture loss and keep the skin moisturized;
Adenosine is able to promote the production of collagen and therefore improve the appearance of wrinkles.","How to use
Apply G9 Skin White in Milk Toner on a cotton pad or reusable alternative and swipe it across the face. Alternatively, use your hands and pat gently into the skin until complete absorption."
https://www.caretobeauty.com/us/clean-clear-blackhead-clearing-toner-200ml/,Clean & Clear,200ml,"Clean & Clear Blackhead Clearing Toner 200ml (6.7 fl oz)&nbsp;is a facial toner that targets blackheads by removing any impurities trapped inside the pores. Due to the Salicylic Acid present in its formula, it acts as a great exfoliator and it is gentle enough so that it can be used daily. As a result of removing dirt, dead skin cells and excess oil, not only does it cleanse the skin but it also prevents future blackheads from forming. This product penetrates easily and deeply into the pores so you can see results from day one. Therefore, you can expect a clear and smooth complexion.","Main Ingredients

Glycerin is a natural moisturizer present in our skin. It has been used for more than half a century, not as a mere moisturizer but also to protect the skin against irritation. Additionally, it keeps the skin healthy, restoring its barrier. It is effective from low percentages;
Salicylic Acid has a great chemical exfoliation action that tackles whiteheads, dead skin cells and sebum secretion. As a result, it fights acne and inflammation;
Citric Acid unclogs pores by promoting the exfoliation of dead skin cells. On top of that, it attenuates the appearance of fine lines and wrinkles. As a result, the skin tone is even and the skin looks brighter and softer.","How to use
Apply Clean & Clear Blackhead Clearing Toner 200ml (6.7 fl oz)&nbsp;once or twice a day. Firstly, apply to a cotton pad and, then, wipe all over the face and neck, paying special attention to the T-zone and avoiding the eye area. Alternatively, use it after cleansing to tighten and tone pores. In the end, do not rinse."
https://www.caretobeauty.com/us/sensilis-purify-balancing-toner-200ml/,Sensilis,200ml,"Sensilis Purify Balancing Toner 200ml (6.76fl oz) is a facial toner that doubles up as a purifying essence. Ideal for combination to oily skin types, this vegan toner helps to regulate excess sebum and perfectly finishes your cleansing routine. This product replaces the Sensilis Ritual Care Purifying Toner with a new formula and packaging.
Combining astringent ingredients such as hamamelis water and zinc, the formula offers a gentle purifying action that reduces the appearance of pores. At the same time, hyaluronic acid helps to hydrate, promoting soft and plump skin. Apply it as a toner and essence to refresh the skin. As a result, it helps reduce excess sebum production as well as to minimize the appearance of enlarged pores.","Main Ingredients

Hyaluronic acid hydrates, promoting soft and plump skin;
Hamamelis water coupled with zinc offers a gentle astringent action that reduces the appearance of pores.","How to use
To begin with, thoroughly cleanse the skin and pat it dry. Then, apply a few drops of Sensilis Purify Balancing Toner 200ml (6.76fl oz) onto the hands and pat it gently onto the face and neck. Alternatively, you may apply it to a cotton round. Allow a few moments and then follow with your favorite serum and/or facial moisturizer."
https://www.caretobeauty.com/us/clarins-hydrating-toning-lotion/,Clarins,400ml (eco refill),"Clarins Hydrating Toning Lotion is particularly tailored for those with normal to dry skin types. This hydrating toner completes the cleansing process, consequently leaving the skin not just clean, but deeply hydrated and ready for subsequent skincare products. At the heart of the formula, the innovative [Microbiote Complex] combines saffron flower polyphenols and a marine prebiotic. This unique complex supports the preservation of the skin&rsquo;s microbiome balance. Moreover, it features aloe vera and organic fig extract that hydrate and soften the skin, promoting a supple and smooth complexion. As a result, this lotion leaves the skin not only hydrated but also soft, fresh, and rebalanced.
This toner stands out not only for its moisturizing benefits but also for its lightweight, comforting texture that leaves the skin feeling soft and fresh. This aspect of the toner ensures that it fits seamlessly into any skincare routine, offering a pleasant and refreshing experience. In summary, this lotion specifically targets dehydration, leaving the skin hydrated. So, if you're looking to introduce a burst of hydration into your routine, this toner is a great addition especially for those with normal to dry skin. t's available in different formats, including an eco-refill.","Main Ingredients

[Microbiote Complex] combines polyphenols from saffron flower extract and a marine prebiotic from laminaria. These work together to help rebalance the skin's microbiome;
Fig extract helps to boost skin hydration;
Aloe vera contains polysaccharides which help retain water in the skin, therefore providing moisturizing benefits. It also has soothing properties.","How to use
Soak a cotton pad or reusable alternative with Clarins Hydrating Toning Lotion and swipe across the face and neck."
https://www.caretobeauty.com/us/dr-grandel-cleansing-soft-tonic/,DR. GRANDEL,400ml (13.53 fl oz),,Not found,Not found
https://www.caretobeauty.com/us/l-oreal-paris-revitalift-filler-ha-replumping-toner-200ml/,L'Oréal Paris,200ml,"L'Oréal Paris Revitalift Filler [HA] Replumping Toner provides an anti-aging action while moisturizing the skin, smoothing it and leaving a feeling of freshness. This toner leaves an immediate sensation of clean, fresh skin and without a tugging sensation. At the same time, it provides advanced anti-wrinkle efficacy helping to fill them, moisturizing the skin and visibly smoothing it. Thus, this luxurious toner penetrates the skin leaving a radiant finish.  
The formula of this face toner contains pure Hyaluronic Acid that intensely hydrate skin, smooth and replump wrinkles and the skin in general. In addition, this formula contains two types of Hyaluronic Acid. Macro muleculas provide a boost of hydration leaving the skin soft to the touch. Micro muleculas penetrate into the layers of the skin to help plump out wrinkles and lines of expession. With this, this toner can not only provide you a plumped and revitalized look but also helps to cleanse your skin leaving it fresh and hydrated. With daily use, your skin feels softer and is replumped with moisture. Wrinkles and expression lines appear reduced and contours look smoother and fuller. It is also suitable for all skin types looking for a rejuvenated and revitalized complexion.","Main Ingredients

Hyaluronic Acid, which is a natural part of the skin connective tissue and has the capacity to retain water. This ability to not only deeply moisturize the skin but also plump it up keeps the skin hydrated while helping reduce fine lines and wrinkles.","How to use
Apply L'Oréal Paris Revitalift Filler [HA] Replumping Toner morning and evening with a cotton pad as part of your anti-aging cleansing routine. No need to rinse."
https://www.caretobeauty.com/us/ziaja-manuka-tree-purifying-astringent-face-toner-200ml/,Ziaja,200ml,"Ziaja Manuka Tree Purifying Astringent Face Toner 200ml (7.0 fl oz) is a toner for normal, oily, and combination skin types. This product serves as a complementary step to the cleansing process, helping to remove any remaining dirt and makeup residues while restoring the skin's natural balance and freshness. Its vegan formula contains 98% ingredients of natural origin. It includes manuka leaf extract, with antibacterial properties, which helps combat acne blemishes and keep the skin clear. The formula also features astringent zinc gluconate, which aids in fighting acne lesions and reducing the appearance of enlarged pores. Additionally, mandelic acid and lactobionic acid provide gentle exfoliation, smoothing the skin and unclogging pores.
Last but not least, panthenol helps to calm irritated skin and provides essential moisture, so that the skin remains soft and comfortable. In essence, this product's combination of antibacterial, astringent, exfoliating, and soothing ingredients works together to improve the overall condition of the skin, for clean, fresh skin that feels balanced.","Main Ingredients

Manuka Tree Leaf Extract has antibacterial properties;
Zinc Gluconate shows antibacterial and sebum-regulating effects;
Panthenol is a humectant, so it helps the skin to attract and retain water. It helps to decrease transepidermal water loss, leading to more hydrated skin. It also has soothing effects;
Mandelic Acid is an alpha-hydroxy acid that gently removes dead skin cells from the surface of the skin, making the skin smoother and softer. It also shows antimicrobial properties;
Lactobionic Acid is a polyhydroxy acid, or PHA. It is a gentle and less irritating exfoliating acid that removes dead skin cells, helping to smooth and even the complexion. It also has humectant and antioxidant properties.","How to use
Dispense an appropriate amount of Ziaja Manuka Tree Purifying Astringent Face Toner 200ml (7.0 fl oz) onto a cotton pad or reusable alternative. Then, gently wipe it across the skin of the face, avoiding the eye area. Do not rinse."
https://www.caretobeauty.com/us/round-lab-1025-dokdo-toner-100ml/,Round Lab,100ml,"Round Lab 1025 Dokdo Toner 100ml (3.38floz) is a gentle yet effective solution for daily skin refinement and hydration. This toner makes use of clean and mineral-rich deep-sea water sourced from Ulleung-do, in Korea. It also employs the patented technology Hatching EX-07, which gently but efficiently exfoliates dead skin cells. So, this gentle exfoliation helps remove daily impurities and smooth the skin’s surface, revealing a fresher and more refined texture. To further enhance the product's benefits, the formula contains a blend of moisturizing and soothing agents including panthenol, allantoin, and betaine, as well as extracts from red seaweed and sugarcane. This combination not only boosts the skin’s moisture levels but also provides relief to tired and irritated skin, making it feel calm and comfortable.
Suitable for all skin types, including those with sensitive skin, this toner is designed for daily use. Moreover, its lightweight texture absorbs quickly, leaving no sticky residue behind. In essence, with regular use, this toner helps to maintain a balanced, hydrated, and smooth complexion, making it a perfect staple in your daily skincare regimen.","Main Ingredients

Deep Sea Water from Ulleung-do is clean and mineral-rich water extracted from deep under the sea;
Hatching EX-07 is a patented protease enzyme that gently exfoliates dead skin cells;
Panthenol is a humectant, so it helps the skin to attract and retain water. It helps to decrease transepidermal water loss, leading to more hydrated skin. It also has soothing effects;
Allantoin soothes irritated skin, moisturizes and softens it;
Betaine is a humectant that helps to balance the skin's water levels;
Red Seaweed Extract is rich in compounds such as beta-carotene and antioxidants such as zeaxanthin and lutein, helping to protect the skin from oxidative damage including blue light exposure. Additionally, it helps hydrate and smooth the skin;
Sugarcane Extract helps the skin attract and retain water. Therefore, it hydrates the skin.","How to use
Dispense an appropriate amount of Round Lab 1025 Dokdo Toner 100ml (3.38floz) onto a cotton pad or reusable alternative. Then, gently wipe it across clean skin of the face. Alternatively, soak cotton pads with the toner and apply them on top of the skin. Then, leave them on for 5 to 10 minutes."
https://www.caretobeauty.com/us/clarins-soothing-toning-lotion/,Clarins,400ml (eco refill),"Clarins Soothing Toning Lotion is particularly tailored for those with very dry or sensitive skin. This soothing toner completes the cleansing process, consequently leaving the skin soothed, comfortable, and ready for subsequent skincare products. At the heart of the formula, the innovative [Microbiote Complex] combines saffron flower polyphenols and a marine prebiotic. This unique complex supports the preservation of the skin&rsquo;s microbiome balance. Moreover, it features organic chamomile extract, specifically chosen for its calming and soothing properties. Therefore, this toner stands out for its ability to rebalance and soothe the skin. The skin is left feeling beautifully soft, fresh, and rehydrated.
This toner stands out not only for its soothing benefits but also for its lightweight yet comforting gel-like texture that leaves the skin feeling soft and fresh. This aspect of the toner ensures that it fits seamlessly into any skincare routine, offering a pleasant and soothing experience. In summary, this lotion offers more than just toning. It's a multi-benefit solution that soothes, softens, refreshes, and rebalances the skin. As such, it is a great addition to the skincare routine, particularly for those seeking to alleviate discomfort associated with dryness or sensitivity. It's available in different formats, including an eco-refill.","Main Ingredients

[Microbiote Complex] combines polyphenols from saffron flower extract and a marine prebiotic from laminaria. These work together to help rebalance the skin's microbiome;
Chamomile extract has soothing properties, consequently relieving any feeling of tightness or discomfort.","How to use
Soak a cotton pad or reusable alternative with Clarins Soothing Toning Lotion and swipe across the face and neck."
https://www.caretobeauty.com/us/coxir-black-snail-collagen-toner-150ml/,coxir,150ml,"coxir Black Snail Collagen Toner 150ml (5.07floz) is a facial toner designed to enhance skin elasticity, deeply hydrate, and promote a youthful complexion. Infused with ingredients such as snail mucin, collagen, and black rice extract, this toner helps rejuvenate skin by providing intense moisture, diminishing the appearance of wrinkles, and improving skin texture and luminosity. So, snail mucin is renowned for its regenerative properties, offering benefits that include enhanced skin repair, improved skin texture, and reduced signs of aging. This natural ingredient is also packed with nutrients that help maintain hydration and leave the skin looking smooth and radiant.
Then, collagen helps hydrate and plump the skin, reducing the appearance of fine lines and wrinkles. Black rice enhances the formula with its anti-aging benefits, further aiding in achieving a smoother and more even complexion. Perfect for use after cleansing, this toner prepares the skin for the following steps of the routine while leaving it protected, hydrated, and smoother.","Main Ingredients

Snail Mucin helps hydrate and restore the skin, as well as reduce the appearance of wrinkles and fine lines;
Collagen is a humectant that helps the skin attract and retain water, making it more hydrated. Therefore, it also promotes a smoother and plumper appearance;
Black Rice Extract is rich in antioxidants, helping to protect the skin against free radical damage. Additionally, it boasts moisturizing, soothing, and anti-aging benefits.","How to use
Dispense an appropriate amount of coxir Black Snail Collagen Toner 150ml (5.07floz) onto the palms or a cotton pad. Then, apply it to clean skin of the face and neck. Finally, gently pat until the product fully absorbs."
https://www.caretobeauty.com/us/martiderm-blooming-toner-200ml/,Martiderm,200ml,"Martiderm Blooming Toner is a soothing and revitalizing toner for normal to dry skin. With a comforting texture, this is the ideal toner for those who suffer from dryness and sensitivity. Contrary to most toners for dry skin, which usually just nourish, this toner contains a blend of active ingredients that improve the complexion. Vitamin C, together with niacinamide, calendula, proteoglycans and prebiotics balance the skin in order to improve the comfort levels and to deeply hydrate the skin and revitalize it. On one hand, the fluid but nourishing texture glides onto the skin to protect and soothe. On the other hand, active ingredients help to ensure that the skin is ready to absorb all the ingredients from your favorites serums and moisturizers. This toner, therefore, achieves the perfect balance between a nourished skin and a toner that improves the skin quality. A clinical study has proved that within 24h, the skin is 23% more nourished and within one month the skin has improved radiance and hydration levels.","Main Ingredients

Allantoin soothes the skin and helps the skin to regenerate;
Lilly extract hydrates the skin and provides an antioxidant boost;
Vitamin C and Niacinamide revitalize and soothe the skin;
Proteoglycans, Bamboo extract and Aesculus hippocastanum boost firmness, hydrate and have an antifatigue effect;
Calendula extract and prebiotics soothe the skin and additionally protect and balance the complexion;
Seaweed extracts tone the skin and revitalize the skin.","How to use
Firstly, soak a cotton pad with&nbsp;Martiderm Blooming Toner and then swipe it all over your cleansed face, neck and d&eacute;collet&eacute;. Don't rinse and follow with your favorites serums and moisturizers."
https://www.caretobeauty.com/us/purito-aha-bha-refreshing-solution-100ml/,PURITO,100ml,"PURITO AHA BHA Refreshing Solution 100ml (3.38 fl oz) is a leave-on exfoliating solution designed to refine skin texture and unclog pores, therefore preventing blemishes. This formula combines the benefits of alpha hydroxy acids (AHAs) and beta hydroxy acids (BHAs) to offer a dual-action approach to exfoliation. With 7% glycolic acid, an AHA known for its ability to gently exfoliate the skin's surface and remove dead skin cells, this solution promotes a smoother and more radiant complexion. In addition to glycolic acid, the solution contains 2% salicylic acid, a BHA that has the ability to penetrate the pores. So, salicylic acid excels at removing dead skin cells from within the pores, effectively unclogging them and preventing the formation of blemishes such as blackheads and whiteheads. 
To balance the exfoliating properties, this product is infused with Willow Bark Water, a natural ingredient that delivers soothing effects. In essence, regular application of this solution results in noticeably smoother skin with a healthy glow. Its ability to unclog pores and prevent blemishes helps maintain a purified and more luminous complexion.","Main Ingredients

7% Glycolic Acid is an alpha-hydroxy acid (AHA) that has many benefits for the skin. It exfoliates the skin, stimulating the removal of dead skin cells to reveal newer skin. This helps to smooth the complexion, even the skin tone, and restore the skin's glow. Glycolic acid also has hydrating properties;
2% Salicylic Acid also called a beta-hydroxy acid (BHA), is an oil-soluble acid. Due to this, it removes dead skin cells not only on the surface of the skin but also inside the pores. So, this makes it effective in refining the skin texture and reducing blackheads and whiteheads. It also soothes inflamed skin;  
Willow Bark Water contains salicin which helps soothe the skin. It also shows astringent and antiseptic properties.","How to use
Apply an appropriate amount of PURITO AHA BHA Refreshing Solution 100ml (3.38 fl oz) onto a cotton pad or reusable alternative and swipe it across the skin of the face, avoiding the eye area. Do not rinse. Apply sunscreen in the morning routine. Note that a light tingling sensation and redness may occur after application of this product. It is recommended to introduce this product gradually into your routine if your skin is not used to exfoliating acids (for example, start by using it once a week and gradually increase the frequency)."
https://www.caretobeauty.com/us/b-lift-age-supreme-active-tonifying-water-200ml/,Not found,200ml,"B-Lift Age Supreme Active Tonifying Water 200ml (6.76 fl oz)&nbsp;is designed to tone, refresh and brighten the skin, after cleansing. This delicate and light thermal water contains rich ingredients such as hyaluronic acid and active rosebud water. Consequently, its formula provides luminosity, softness and elasticity to the skin. In addition to being suitable for all skin types, this toning water is ideal for preparing the skin before applying face cream.","Main Ingredients

Hyaluronic acid (10% solution) is an acid that the human body naturally produces. Because its main function is to retain water, it keeps the skin tissues well-lubricated and moist. Hence this ingredient helps revitalizes the skin;
Active rosebud water contains antioxidants and anti-inflammatory properties that give it a soothing, protective and repairing function. Besides, it reduces the appearance of lines and wrinkles.","How to use
Apply B-Lift Age Supreme Active Tonifying Water 200ml (6.76 fl oz)&nbsp;in the morning and the evening on the face and neck, after cleansing your skin. However, when applying, you should avoid contact with the eyes. In the end, there is no need to rinse. Afterwards, proceed with your skincare routine as usual.
This product must be kept out of the sight and reach of children."
