Link,brand,volume,description,ingredients,how_to_use
https://www.caretobeauty.com/us/svr-sebiaclear-cleansing-gel/,SVR,"55ml (1.86 fl oz)
                                                                                            - Out of Stock","SVR Sebiaclear Purifying Cleansing Gel is a cleansing gel that effectively purifies and maintains the skin's health while being gentle enough for even sensitive skin types. This cleansing gel not only regulates sebum production but also offers keratolytic properties that aid in unclogging pores. As a key ingredient, this formula contains Gluconolactone, a polyhydroxy acid that excels in purifying the skin and unclogging pores without harshness. This ingredient ensures that the cleansing process does not strip the skin of its natural oils, which can often lead to irritation or dryness. Instead, it maintains a healthy balance in the skin’s microbiome, making it suitable for daily use.
Also, combined with Salicylic Acid this product not only provides anti-inflammatory and keratolytic properties but also helps regulate sebum production and has antimicrobial properties. It penetrates deep into the pores to exfoliate the skin, manage excess oil, and reduce blemishes. Besides, the presence of gentle cleansing agents allows for a deep cleaning of the skin while respecting its natural balance. These agents ensure that the skin is left clean and healthy without any compromise to its inherent protective barrier, thus minimizing the risk of irritation and making the gel suitable for those with sensitive skin. In essence, this is more than just a skincare product; it's a solution that ensures your skin remains clean, balanced, and vibrant without harsh cleansing agents.","Main Ingredients

Gluconolactone is responsible for purifying the skin and unclogging the pores, at the same time;
Gentle Cleansing Agents leave the skin cleansed and healthy while respecting its natural balance. This component is, like so, delicate enough even for sensitive skin;
Salicylic Acid has anti-inflammatory properties and also a keratolytic action due to its ability to penetrate the pores and exfoliate the skin. Furthermore, it has antibacterial and sebum-regulating properties. It helps regulate excess sebum and reduce blemishes.","How to use
Apply SVR Sebiaclear Purifying Cleansing Gel onto damp skin and gently massage to cleanse the skin. Then thoroughly rinse with water to remove the product. Follow with the rest of your skincare routine."
https://www.caretobeauty.com/us/eucerin-dermopure-cleansing-gel/,Eucerin,400ml (13.53 fl oz),"Eucerin DERMOPURE Cleansing Gel&nbsp;is a gentle cleanser specially formulated for oily and blemish and acne-prone skin. Yet it is suitable for combination skin as well. This is due to the gentle formula of this gel, which was formulated to effectively clean the skin without drying it out. In fact, this soap-free cleanser resorts to the cleansing properties of amphoteric surfactants that work to remove excess sebum, dirt, and makeup with efficiency while avoiding a stripping effect and supporting the skin's condition. As a result, the skin feels clean, fresh, and supple after cleansing. But most important for oily skin, this non-comedogenic cleansing gel avoids shine and helps prevent breakouts.&nbsp;
Also important to note is that, given the mild cleansing action of this gel, it is appropriate to use on blemish-prone skin undergoing medical treatment, and even during pregnancy. Suitable for daily use, applying this cleansing gel twice a day will remove excess sebum and impurities accumulated during the day or night. As a last note, clinical and dermatological studies confirm this product has great skin tolerability.","Main Ingredients

6% Amphoteric surfactants&nbsp;are mild, detergent-like molecules that work to gently yet effectively remove excess sebum, impurities, and makeup.","How to use
Apply a small amount of&nbsp;Eucerin DERMOPURE Cleansing Gel and gently massage it in your hands to lather. Apply on the face and massage. Lastly, rinse thoroughly with lukewarm water. Avoid contact with eyes."
https://www.caretobeauty.com/us/cerave-foaming-cleanser-normal-to-oily-skin/,CeraVe,473ml (15.99 fl oz),"CeraVe Foaming Cleanser Normal to Oily Skin is ideal for the daily cleansing of normal to oily skin. With a gentle formula, this foaming gel is able to wipe away all impurities without disrupting the skin. Its unique vegan formula not only removes excess sebum and impurities but also promotes a healthier skin barrier comforting the skin. With Ceramides, it helps repair and reinforce the natural skin barrier. With Hyaluronic Acid it helps deeply moisturize the skin and keep it hydrated. And, due to the presence of Niacinamide, it also helps soothe and comfort the skin. It is, therefore, not only ideal for normal to oily skin but also for those using aggressive treatments for acne. All in all, it is a practical product suitable for both face and body, that helps restore the skin barrier, enhance hydration and calm the skin.","Main Ingredients

Ceramides help repair and reinforce the natural skin barrier. They keep the skin hydrated and enhance the protection against external aggressors;
Hyaluronic Acid is a natural part of the skin connective tissue and has the capacity to retain water. It helps deeply moisturize the skin and keep it hydrated;
Niacinamide has anti-inflammatory properties and also increases ceramide synthesis. This not only leads to better skin hydration and a healthier skin barrier but also helps reduce discomfort soothing the skin.","How to use
Apply CeraVe Foaming Cleanser Normal to Oily Skin both morning and evening to wet skin. Gently massage to lather. Then rinse with lukewarm water."
https://www.caretobeauty.com/us/avene-cleanance-cleansing-gel/,Avène,400ml (13.53 fl oz),"Avène Cleanance Cleansing Gel is a gentle cleanser specially formulated for the daily care of oily and acne-prone skin. With Avène Thermal Spring Water this gel helps both hydrate and soothe the skin. And with Zinc Gluconate this gel also helps mattify and purify the skin. But its star ingredient is Comedoclastin™. Significantly reducing sebum production, Comedoclastin™ can not only visibly reduce excess sebum and shine but also limit the appearance of blemishes. So, with a unique formula, it is able to cleanse and purify the skin, not only removing impurities but also helping regulate sebum production. It is, therefore, ideal to help neutralize excess shine on oily and acne-prone skin. Forming a pleasant foam, this gel also respects sensitive skin and is able to gently cleanse the skin without drying it.
All in all, it cleanses, purifies, and soothes the skin helping mattify the complexion and limit the appearance of blemishes. 95.9% of the users felt the skin immediately free of impurities and 85.7% of the users declared the skin was immediately mattified.","Main Ingredients

60.3% Avène Thermal Spring Water has a unique and rich composition. It has the ability to not only soothe but also hydrate and soften fragile and sensitive skin;
0.7% Comedoclastin™ helps to regulate sebum production and limit the appearance of blemishes;
Zinc Gluconate has antibacterial and sebum-regulating properties helping mattify and purify the skin.","How to use
Apply Avène Cleanance Cleansing Gel morning and/or evening onto damp skin. Massage the product to create a lather and gently cleanse the skin. Rinse thoroughly with lukewarm water."
https://www.caretobeauty.com/us/bioderma-sensibio-h2o-make-up-removing-micelle-solution/,Bioderma,Promotional Pack,"Bioderma Sensibio H2O Make-Up Removing Micelle Solution is a mild cleansing solution indicated for sensitive and intolerant skin. This micellar water is suitable for removing impurities, pollution particles and makeup, while still respecting the integrity of even the most sensitive complexions. It does so by resorting to the power of Micellar Technology, a component inspired by the skin's lipids that is able to capture residues without disrupting the skin's natural protective layer. As a result, the Bioderma Sensibio H2O offers a gentle and practical cleansing process that does not require rinsing.
As a well-known makeup artist's favorite, this formula has been conquering the market for quite a while and continues to be a bestseller all over the world. Although formulated to keep sensitive skin's integrity, this formula is suitable for all skin types.","Main Ingredients

Complex of Three Biomimetic Soothing Sugars help to prevent the inflammatory process;
Micellar Technology is able to cleanse the skin and remove makeup without requiring rinsing. This system utilizes Micelles, a component inspired by the skin's lipids that is able to capture impurities without disrupting the skin's natural protective layer;
D.A.F. Patent Complex has a strengthening action that improves the levels of resistance on all skin types.","How to use
Soak a cotton pad with Bioderma Sensibio H2O Make-Up Removing Micelle Solution. Then, gently cleanse the skin by lightly tapping it, without dragging it. Re-apply until the cotton pad becomes clean. Do not rinse. Complement the use of this product with other formulas from the same line in order to achieve optimal results."
https://www.caretobeauty.com/us/sesderma-hidraven-soap-free-cream-face-body-cleansing-300ml/,Sesderma,300ml,"Sesderma Hidraven Foamy Soap Free Cream is an extra gentle cleanser for the face and eyes. This formula is heavy in highly soothing ingredients which makes it suitable for skins undergoing dermatological treatments. The skin is gently cleansed and the skin integrity is preserved, even when used twice a day.","Main Ingredients

Chamomile extract, Oat, Mimosa and Aloe Vera provide a hydrating and soothing action that helps to regenerate the skin;
Triclosan helps to cleanse the skin.","How to use
Apply Sesderma Hidraven Foamy Soap Free Cream onto wet skin and massage until it lathers. Rinse abundantly with water."
https://www.caretobeauty.com/us/svr-topialyse-cleansing-gel/,SVR,"55ml (1.86 fl oz)
                                                                                                                                        - 25% Off","SVR Topialyse Cleansing Gel is a gentle daily cleanser specially formulated to respect sensitive skin. With gentle cleansing actives and Glycerin, it respects and protects the skin's natural barrier and is able to gently cleanse the skin without drying. It hydrates and softens the skin and helps reduce feelings of discomfort such as dryness, itching and tightness providing long-lasting comfort. Suitable for the whole family, it is ideal to daily cleanse the skin from head to toe. It respects and protects the skin and is a practical product suitable for the body, face, hair, and intimate area. After 21 days of use, 95% of the users declared their skin was instantly comforted and soothed, 95% noticed it reduced itching sensations and 91% said it left their skin hydrated and reduced feelings of tightness and irritation.","Main Ingredients

Gentle cleansing actives that do not disrupt the skin while cleansing. They respect the skin's natural barrier and are able to help reduce feelings of discomfort such as dryness, itching and tightness;
Glycerin attracts water and binds it to the skin. It not only keeps the skin hydrated but also helps restore the skin barrier enhancing the protection against daily aggressions.","How to use
Apply SVR Topialyse Cleansing Gel  to damp skin and gently massage to create a lather. Then thoroughly rinse. It is a practical product suitable for the body, face, hair and intimate area."
https://www.caretobeauty.com/us/cerave-hydrating-cleanser-normal-to-dry-skin/,CeraVe,473ml (15.99 fl oz),"CeraVe Hydrating Cleanser Normal to Dry Skin gently cleanses all skins and is especially suited to those who have normal to dry skin, but it is also approved by National Eczema Association to use on atopic skin and psoriasis. With a vegan formulation and a non-foaming texture, it gently cleanses all the impurities, leaving the skin comfortable as well as smooth without disrupting the skin barrier thanks to the ceramides and hyaluronic acid.","Main Ingredients

Essential ceramides 1, 3 and 6-II help to restore the skin barrier thanks to the biocompatibility and the ability to retain moisture;
Hyaluronic acid can hold up to 1000x its weight in water, which means that it's available to hydrate the skin;
MVE Delivery Technology ensures a slow release of the active ingredients in order to keep the skin hydrated all day.","How to use
Apply CeraVe Hydrating Cleanser Normal to Dry Skin in the morning as well as in the evening, onto wet skin. Then, massage to remove the impurities and rinse with lukewarm water."
https://www.caretobeauty.com/us/avene-cleansing-foam/,Avène,50ml (1.69 fl oz),"Avène Cleansing Foam is a daily cleansing care without soap, suitable for face and eyes, especially for normal to combination skin with excess shine. With soothing and moisturizing actions, this foam helps removing make-up and impurities, for a sensation of freshness on the skin. The Glutamic Acid regulates the sebaceous secretion, fighting the brightness on the forehead, nose, and chin. With a sweet fragrance, this foam leaves perfectly matte finish.","Main Ingredients

Avène Thermal Spring Water soothes and calms the skin;
Glutamic Acid regulates oil production, for a mattified skin;
Gentle Cleansing Base removes make-up and impurities from the face and eyes.","How to use
Apply Avène Cleansing Foam in the morning and evening on wet or dry face, massaging with your fingertips. Rinse with water."
https://www.caretobeauty.com/us/cerave-sa-smoothing-cleanser-bumpy-skin/,CeraVe,473ml (15.99 fl oz),"CeraVe SA Smoothing Cleanser Bumpy Skin is a skin cleanser suitable for the face and body. Its composition embodies salicylic acid, a potent exfoliant and anti-inflammatory, and hyaluronic acid, a powerful moisturizer, hence resulting in a smoother, softer and brighter skin, eliminating its roughness and bumpiness. Also, this product is formulated with 3 ceramides that help protect the skin's natural barrier. It is a very delicate cleansing gel since it is free of physical exfoliants and fragrance. Also, it is non-irritating and non-comedogenic, all the while it removes oil, dirt, and make-up. Additionally, it is suitable for skin prone to Keratosis Piliaris. Overall, this product efficiently cleanses the skin, providing a fresher and healthier look to the complexion.","Main Ingredients

Salicylic acid can exfoliate skin both on the surface and in the pores, thus softening the skin;
Hyaluronic acid keeps the skin hydrated, hence smoothing the skin.","How to use
Apply CeraVe SA Smoothing Cleanser Bumpy Skin on damp skin and massage. Then, rinse with water. Avoid direct eye contact. If contact occurs, rinse thoroughly with water."
https://www.caretobeauty.com/us/avene-xeracalm-a-d-lipid-replenishing-cleansing-oil/,Avène,750ml (25.36 fl oz),,Not found,Not found
https://www.caretobeauty.com/us/bioderma-pigmentbio-foaming-cream/,Bioderma,500ml (16.91 fl oz),"Bioderma Pigmentbio Foaming Cream is a brightening cleanser that addresses all types of hyperpigmentation. That said,&nbsp;this foaming cream reduces melanin synthesis and stimulates cell renewal thus preventing and reducing hyperpigmentation.&nbsp;On one hand,&nbsp;Andrographolide and Azelaic Acid act on inhibiting melanin production. On the other hand, Citric acid and Cellulose&nbsp;microbeads provide both chemical and physical exfoliation, thus eliminating hyperpigmented skin cells. Furthermore, the D.A.F. patent increases the tolerance threshold while&nbsp;Glyceryl oleate and Coco-glucoside strengthen the skin barrier. All this while providing a gentle cleansing action. Therefore, this product is suitable even for sensitive skin despite its exfoliating effect.
In conclusion, this foaming cream gently exfoliates and cleanses the skin. As a result, dark spots are reduced while the skin reveals an even brighter complexion. As a last note, it can be used both on the body and face.","Main Ingredients

Andrographolide and Azelaic Acid are depigmenting agents that inhibit melanin production. Therefore, preventing dark spot formation. In addition, azelaic acid has an anti-inflammatory action which can be beneficial in post-inflammatory hyperpigmentation;
Citric acid is an alfa hydroxy acid that performs a chemical exfoliation while Cellulose&nbsp;microbeads provide physical exfoliation. As a result, this cleanser removes dead skin cells and helps fading hyperpigmentation;
D.A.F. (Dermatological Advanced Formulation) complex increases the tolerance threshold of the skin in order to strengthen its resistance;
Glyceryl oleate and Coco-glucoside strengthen the skin barrier.","How to use
Apply Bioderma Pigmentbio Foaming Cream daily on both the face and body. Gently massage to foam and finally, rinse thoroughly. You can also apply it as a face mask once or twice a week, leaving it on for five minutes before rinsing."
https://www.caretobeauty.com/us/bioderma-sensibio-mild-cleansing-foaming-gel-sensitive-skin/,Bioderma,"500ml (special price)
                                                                                            - Out of Stock","Bioderma Sensibio Mild Cleansing Foaming Gel Sensitive Skin was specially developed to offer a daily cleansing solution for sensitive skin. With this in mind, this cleanser presents a gentle and hydrating formula that respects even the most sensitive complexions. On one hand, it features a mild cleansing base that perfectly cleans the skin without disrupting its natural balance. In fact, this micellar gel is able to remove impurities and makeup from the face and also the eyes. On the other hand, the formula soothes the skin thanks to the presence of the exclusive D.A.F. Patent with calming ingredients. At the same time, this gel moisturizes the skin and restores its hydration levels. Moreover, the formula is fragrance and soap-free with a physiological pH. 
With each application, you will enjoy the creamy foam texture that gently cleans the skin while also providing a soothing and moisturizing action that leaves the skin comfortable. All in all, this is a great ally to clean sensitive or sensitized skin as it reinforces the skin and counteracts dehydration and tightness. Just experience the feeling of regained comfort and calmness with this cleanser!","Main Ingredients 
 
Coco-Glucoside and Glycéryl Oleate moisturize the skin and, like so, reinforce the skin barrier; 
D.A.F. patent comprises soothing ingredients such as Mannitol, Xylitol, and Rhamnose. It increases the tolerance threshold of the skin in order to strengthen its resistance;","How to use 
Apply Bioderma Sensibio Mild Cleansing Foaming Gel Sensitive Skin to damp skin and gently massage to lather. Then, rinse thoroughly."
https://www.caretobeauty.com/us/cerave-blemish-control-cleanser-236ml/,CeraVe,236ml,"CeraVe Blemish Control Cleanser 236ml (8 fl oz) is a facial cleanser specifically formulated for blemish-prone skin. Developed with dermatologists, this range from Cerave fights blemishes without disrupting the skin's natural barrier thanks to the addition of soothing ingredients. Besides reducing the appearance of blemishes and blackheads, this cleanser also removes excess oil and improves the appearance of pores.&nbsp;That said, this cleanser contains 2% Salicylic acid to help reduce blemishes along with Niacinamide and Ceramides.
In fact, Ceramides are the base of every Cerave product and this one is no exception. Then, Salicylic acid gently exfoliates dead skin cells that can clog pores and contribute to the appearance of blemishes. In addition, this cleanser contains an oil-absorbing technology that comprises Hectorite clay, a puryfing clay that absorbs excess oil and thus reduces shine. In conclusion, with a&nbsp;gel-to-foam texture, it provides a gentle cleansing that respects the natural barrier of the skin.&nbsp;","Main Ingredients

2% Salicylic acid has anti-inflammatory properties and also a keratolytic action due to its ability to penetrate the pores and exfoliate the skin. Furthermore, it has antibacterial and sebum-regulating properties. It helps regulate sebum and reduce both blackheads and blemishes lending the skin an even and smoother appearance;
Niacinamide also helps to regulate excess sebum and improve pores' appearance;
Ceramides 1, 3, and 6-II help replenish the skin's existing ceramides and thus restore the skin barrier.","How to use
Apply CeraVe Blemish Control Cleanser 236ml (8 fl oz)&nbsp;both morning and evening to wet skin. Gently massage to lather. Then rinse with lukewarm water."
https://www.caretobeauty.com/us/biretix-cleanser-purifying-cleansing-gel/,Biretix,"400ml (refill)
                                                                                            - Out of Stock","Biretix Cleanser Purifying Cleansing Gel is specifically formulated to address the needs of oily and acne-prone skin, ensuring a deep yet gentle cleansing experience. This purifying cleansing gel stands out for its hydrating, mattifying, and softening properties, thanks to its careful selection of ingredients. Central to its formulation is BIOPEP-15, an innovative ingredient that targets the bacteria responsible for acne to help control the appearance of acne lesions. The formula also contains piroctone olamine, with antibacterial and sebum-regulating properties, and aloe vera with soothing properties. In addition to these ingredients, this cleanser incorporated a blend of natural extracts with not only sebum-regulating and astringent properties but also soothing and hydrating as well as antioxidant and anti-inflammatory.
With a gentle cleansing base, this gel not only cleanses the skin of impurities and debris but also controls excess oil while maintaining the skin's delicate balance without stripping away essential moisture. In summary, its sebum-regulating and purifying action is complemented by its hydrating and soothing effects to fight blemishes and maintain balanced skin. It's available in different formats.","Main Ingredients

BIOPEP-15 is a plant-based peptide with 15 amino acids, that selectively targets Cutibacterium acnes to prevent its proliferation and, thereby, help prevent the appearance of acne lesions;
Aloe vera contains polysaccharides which help retain water in the skin, therefore providing moisturizing benefits. It also has soothing properties;
Piroctone olamine has not only antibacterial properties but also sebum-regulating, thus reducing excess sebum;
Natural extracts offer several actions such as astringent, sebum regulating, soothing, hydrating, and antioxidant.","How to use
Apply Biretix Cleanser Purifying Cleansing Gel to damp skin and massage to lather. Then, rinse well with lukewarm water."
https://www.caretobeauty.com/us/eucerin-dermatoclean-refreshing-cleansing-gel-200ml/,Eucerin,200ml,"Eucerin DermatoCLEAN Hyaluron Cleansing Gel is a mild but effective cleanser that removes impurities and make-up, all the while helping the skin maintain its natural moisture balance. Suitable for normal to combination skin types, including sensitive, this formula is enriched with APG Complex, an extra mild cleanser that cleans the skin by dissolving and removing impurities, and Gluco-Glycerol, a powerful hydrating active that helps the skin retain moisture and improve its own barrier function. The skin is thoroughly cleansed and refreshed, for a youthful and reinvigorated feeling.","Main Ingredients

APG Complex is an extra mild cleanser that cleans the skin by dissolving and removing impurities;
Gluco-Glycerol, also known as Glyceryl Glucoside, stimulates the skin’s own water system, help it retain moisture and improve its barrier function.","How to use
Apply Eucerin DermatoCLEAN Hyaluron Cleansing Gel to the face, neck and décolletage using fingertips. Massage gently, then rinse thoroughly with warm water."
https://www.caretobeauty.com/us/babe-stop-akn-purifying-cleansing-gel/,Babé,200ml (6.76 fl oz),"Babé Stop AKN Purifying Cleansing Gel is a purifying cleanser specially formulated for oily skin and acne-prone skin. That said, this cleanser has a unique formula with ingredients that help control excess sebum and consequently help prevent breakouts. First and foremost, it contains&nbsp;Cytobiol Iris&trade;, a blend of three active ingredients that not only help control excess sebum but also soothe the skin. Then, the formula also contains Salicylic acid, a well-known ingredient for its benefits on acne-prone skin because it helps control excess sebum and unclog pores. Lastly, Zinc PCA further contributes to this sebum-regulating action.
Meanwhile, the gel texture turns into a gentle foam when in contact with water, to effectively clean the skin. As a result, this refreshing cleanser removes impurities and excess sebum for a shine-free complexion.&nbsp;All in all, your skin feels fresh and purified after using this cleanser.","Main Ingredients

2%&nbsp;Cytobiol Iris&trade; comprises three ingredients. Firstly, Zinc sulfate, which has a sebum-regulating action. Secondly, Iris extract with anti-inflammatory properties that soothes the skin. And lastly, vitamin A, that promotes skin renewal.
0,2% Salicylic acid&nbsp;has anti-inflammatory properties and also a keratolytic action due to its ability to penetrate the pores and exfoliate the skin. Furthermore, it has antibacterial and sebum-regulating properties. It helps regulate excess sebum and reduce blemishes;
0,02% Zinc PCA&nbsp;has a purifying action while equally ensuring optimal levels of moisture on the skin.","How to use
Apply Babé Stop AKN Purifying Cleansing Gel to wet face and gently massage to lather. Rinse thoroughly. Avoid contact with the eye area.."
