Link,brand,volume,description,ingredients,how_to_use
https://www.caretobeauty.com/us/fillerina-12ha-densifying-filler-lip-contour-cream/,Fillerina,Grade 5,,Not found,Not found
https://www.caretobeauty.com/us/la-cabine-lip-up-lift-concentrated-ampoules/,La Cabine,1x2ml,,Not found,Not found
https://www.caretobeauty.com/us/mixa-panthenol-comfort-multi-use-cream-50ml/,Mixa,50ml,,Not found,Not found
https://www.caretobeauty.com/us/sesderma-glicare-eye-and-lip-contour-gel-30ml/,Sesderma,30ml,"Sesderma Glicare Eye and Lip Contour Gel 30ml (1.01fl oz) is a light textured gel with a non greasy texture that targets all the problems on the eye area: reduces puffiness, wrinkles and dark circles. Plus, it deeply hydrates the eye and lip contour area. Due to its content in Haloxyl®, N-Hydroxysuccinimide and Sweet Clover Extract it fights dark circles by improving blood flow and eliminating the pigments that accumulate due to capillary fragility. Furthermore, the presence of Eyeseryl® deeply reduces eye puffiness. At the same time, Hyaluronic acid helps to hydrate the skin and to prevent premature aging of the eye area. As a special action, the ingredients are slowly released to the skin, providing hydration for more than 18 hours. Finally, it is suitable for all skin types and can be used on the lip contour area without having to worry about anything.","Main Ingredients

Haloxyl® helps to remove dark circles due to the ability to reduce the accumulation of iron and other haemoglobin derivatives that cause the dark coloration;
Eyeseryl® works as an anti-puffiness agent, reducing eye bags quickly and effectively due to its decongestive action;
Hyaluronic Acid is a NMF agent that deeply hydrates the skin due to its ability to retain water and helps to fight premature aging;
N- Hydroxysuccinimide helps to remove iron deposits from the eye area, reducing dark circles;
Sweet Clover Extract is an anti-inflammatory agent that fights free radicals and improves blood flow.","How to use
Apply Sesderma Glicare Eye and Lip Contour Gel 30ml (1.01fl oz) to clean, dry skin with your fingertips, from the inside outwards, tapping lightly. Extends evenly on both eye and lip contour. You can use it both in the morning and at night."
https://www.caretobeauty.com/us/babe-healthy-aging-multi-corrector-eyes-and-lips-tensor-15ml/,Babé,15ml,"Babé Healthy Aging+ Multi Corrector Eyes and Lips Tensor is an antiaging cream, specifically formulated for the eye and lip contour area. It has the ability to not only protect your skin but also fight signs of aging and fatigue. With a unique combination of active ingredients, it targets all the problems of those areas. Containing both Bakuchiol and encapsulated Retinol, it can stimulate collagen production, boosting elasticity and firmness, and improving expression lines and wrinkles. The presence of Hyaluronic Acid allows it to not only deeply moisturize the skin but also plump it up. And, because it also contains Caffeine it boosts microcirculation contributing to the reduction of eye bags and dark circles. With a light texture, that is easily absorbed, this eye and lip care will lend you a younger and luminous complexion.","Main Ingredients

0,50% Bakuchiol, which is a retinol-like molecule from botanical origin. It stimulates collagen production, boosting elasticity, firmness and improving fine lines and wrinkles;
3% Caffeine boosts microcirculation which contributes to reduce the appearance of eye bags and dark circles;
0,25% encapsulated Retinol stimulates cell renewal, lending the skin a radiant and also smoother appearance. It also increases the skin's natural collagen production which significantly reduces fine lines and wrinkles;
1% Hyaluronic Acid, which is a natural part of the skin connective tissue and has the capacity to retain water. This ability to not only deeply moisturize the skin but also plump it up keeps the skin hydrated while helping reduce fine lines and wrinkles.","How to use
Apply 4 drops of Babé Healthy Aging+ Multi Corrector Eyes and Lips Tensor directly to the lower eyelid. Avoiding the mobile eyelid, gently massage with soft touches."
https://www.caretobeauty.com/us/martiderm-platinum-expression-gel-eyes-lips-contour-15ml/,Martiderm,15ml,"Martiderm Black Diamond Skin Complex&nbsp;is an anti-wrinkle gel that should be used on the eye contour, lip contour and the space between the eyebrows. This formula contains peptides that relax the skin and muscles in order to attenuate wrinkles and reduce fine lines. Due to its formula in gel, it can be easily applied on the areas where the skin tends to wrinkle more easily and thanks to the hyaluronic acid in the formula it fills the wrinkle to make sure it is attenuated. Suitable for sensitive skin, as it contains soothing botanical extracts.","Main Ingredients

10% Octapeptide and 4% Syn-ake&nbsp;for a relaxing effect on the wrinkles, having a filler-like effect;
2% Camomile extract relaxes the muscles to reduce the wrinkles;
Short and long chained Hyaluronic acid deeply hydrates the skin and plumps the skin to reduce wrinkles;
Retinol, alpha-tocopherol and alpha-bisabolol have antioxidant and soothing properties.","How to use
Apply Martiderm Platinum Expression Gel in the morning before the moisturizer. This gel can be applied to the eye and lip contour and on the forehead between the eyebrows."
https://www.caretobeauty.com/us/ziaja-lifting-solution-serum-eye-and-lips-area-30ml/,Ziaja,30ml,"Ziaja Lifting Solution Serum Eye And Lips Area 30ml (1.0 fl oz) is an anti-wrinkle and lifting serum specifically designed for the delicate areas around the eyes and lips. This vegan serum, formulated with 96% ingredients of natural origin, targets wrinkles and loss of firmness in these regions, providing effective care and quickly visible results. It contains ursolic acid, an ingredient that promotes collagen production. So, this helps to smooth out wrinkles and improve skin firmness. Additionally, the serum includes a polymer derived from sweet almond proteins. This ingredient creates an elastic, smooth film on the skin’s surface, delivering an immediate lifting effect. So, this lifting action provides a quick and visible improvement in the skin's appearance, making the area around the eyes and lips look more toned. Lastly, panthenol helps maintain the skin's moisture levels.
In summary, this product helps to maintain smooth, firm, and hydrated skin of the eye and lip areas.","Main Ingredients

A peptide from sweet almonds forms a film that helps lift and smooth the skin;
Panthenol is a humectant, so it helps the skin to attract and retain water. It helps to decrease transepidermal water loss, leading to more hydrated skin. It also has soothing effects;
Ursolic Acid helps maintain elastic skin and also shows antioxidant properties.","How to use
Apply an appropriate amount of Ziaja Lifting Solution Serum Eye And Lips Area 30ml (1.0 fl oz) onto the skin under the eyes and around the lips. Then, gently tap until the product fully absorbs. Use a few times a week according to the skin's needs."
https://www.caretobeauty.com/us/endocare-eye-lip-contour-15ml/,Endocare,15ml,"Endocare Eye & Lip Contour is a moisturizing, anti-aging care for eyes and lips, for a visibly younger appearance. With active anti-inflammatory and anti-wrinkle ingredients, this eye and lip care revitalizes and regenerates the skin, reducing fine lines and wrinkles, puffiness, and dark circles. With a soft, easily-absorbed texture, it smoothes, uniformizes and brightens the skin. Ideal as a complement after cosmetic treatments (peeling, laser, microdermabrasion, ...).","Main Ingredients

SCA Index Repair 8, extracted from the snail, accelerates cell regeneration;
Hygroplex HHG has a great water-binding capacity, being an excellent skin moisturizer;
Pentavitin binds to keratin in the skin to keep the moisture balance, reducing dryness and irritation;
Tetrahidrocurcuminoids have antioxidant properties to prevent premature photoaging;
Transcutol enhances the penetration of the actives into the skin.","How to use
Apply Endocare Eye & Lip Contour to the eye and lip contour area. Gently massage into skin."
https://www.caretobeauty.com/us/sensai-total-lip-treatment-15ml/,SENSAI,15ml,"SENSAI Total Lip Treatment 15ml (0.52 oz) provides extensive and targeted care to the lips, nourishing them from within while lessening aging signs.
Even when aging is inevitable, you can always prevent and ease some of its effects on the skin. Such is the motto behind SENSAI&rsquo;s new targeted lip balm. The powerful cocktail of Botanical extracts, exfoliating acids, and nourishing ingredients provides an all-encompassing treatment, from gentle exfoliation to improved definition and fullness, while also including deep hydration and moisture. Moreover, due to its unique texture, this exquisite balm glides through the lips, allowing for a nurturing massage to deeply penetrate the inner layers and then provide must-needed hydration. The result is plumped and velvety soft lips.
Last but certainly not least, this luxurious formula also helps improve the definition of the lip contour, smoothing vertical lines and lifting up the area around the lips, thus reviving the whole complexion. It is as if the face suddenly awakened from a slumber, with your luscious and soft lips as the crowning jewel.","Main Ingredients

Niacinamide is a multi-functional skincare ingredient. In smaller percentages, it helps in fading brown spots and smoothing the appearance of pores, for a more fortified skin barrier. Additionally, it helps reduce aging signs by boosting the skins elasticity. Lastly, it is also rich in antioxidant and anti-inflammatory properties, reducing skin irritation.
Salicylic Acid both exfoliates the skin and unclogs the pores, improving its texture. As such, it is ideal for treating blackheads as well as preventing acne. In addition, it also has anti-inflammatory properties;
Vitamin E is the main antioxidant in the skin. It protects the cells against damage from free radicals while also providing significant photoprotection against UVB rays. And, since it is fat-soluble, it is easily absorbed by the skin.","How to use
Apply a small amount of SENSAI Total Lip Treatment 15ml (0.52 oz) onto your hands and then massage it on the lips and resounding area. Then, lightly pressure the nasolabial lines with your middle and ring fingers for a few seconds to fully embed the area with the balm. Lastly, gently massage the skin around the lips with circular motions with just the middle fingers. Start on the upper lips, move to the lower and then finish on the corners of the mouth, applying light pressure as well."
https://www.caretobeauty.com/us/clarins-extra-firming-lip-contour-balm-15ml/,Clarins,15ml,"Clarins Extra-Firming Lip &amp; Contour Balm is a nourishing balm that softens and comforts the lips while minimizing the appearance of signs of aging. The texture is rich and immediately replenishes the skin with hydration and comfort. The formula blends powerful botanicals to achieve rejuvenating results. Raspberry Seed Oil is rich in antioxidants and visibly softens, nourishes and protects the lips. Likewise, Shea Butter deeply nourishes the skin and provides comfort. In order to deliver rich ingredients with a gentle formula, ingredients such as alcohol, parabens and silicones are excluded.
The lip area is delicate and sensitive. Not only the lip skin is thinner, but also the skin around the lips contracts every time you eat, talk and smile. Prevent and correct already existing signs of aging with a powerful nourishing balm. Use it throughout the day to provide comfort to the lips, and in the evening to replenish the lips overnight. As a result, the lips appear fuller, more hydrated and wonderfully defined.","Main Ingredients

Raspberry Seed Oil is rich in antioxidants and softens, nourishes and protects the lips;
Shea Butter deeply nourishes the skin and provides comfort.","How to use
Use the spatula to dispense a small amount of the Clarins Extra-Firming Lip &amp; Contour Balm and massage it gently both on the lips and on the lip contours. Use as the last step of your skincare routine and/or apply throughout the day as needed."
https://www.caretobeauty.com/us/noreva-norelift-chrono-filler-eye-lip-care-15ml/,Noreva,15ml,"Noreva Norelift Chrono-Filler Eye & Lip Care 15ml (0.51fl oz) is a perfect anti-aging cream for the contour of the eyes and lips. With advancing age, it is perfectly normal for certain areas of our body to acquire some wrinkles and fine lines, which is what happens in these regions. In this way, this cream helps to firm the skin by increasing its production of collagen and elastin. Through this, the skin ends up looking more rejuvenated and fuller and with fewer fine lines and visible wrinkles. 
All this is possible thanks to the presence of the active ElastigenFGF, an ingredient that stimulates fibroblast growth factors in order to provide a greater production of collagen and elastin. Furthermore, the presence of Hyaluronic Acid helps to provide an enormous hydration boost to the skin so that it ends up feeling more hydrated, smoothed, and supple. In addition, thanks to the strong presence of an anti-radical power, the area around the eyes ends up with fewer dark circles. Finally, the texture of this cream penetrates easily into the skin without leaving it sticky. All in all, this anti-aging product leaves the eye and lip contour visibly more rejuvenated, the skin firmer, hydrated, and with less visible wrinkles and fine lines.","Main Ingredients

ElastigenFGF stimulates fibroblast growth factors to activate collagen and elastin production. In this way, it helps to rejuvenate the skin by smoothing out wrinkles and fine lines;
Silk Tree Extract boosts cell energy, revitalizes tired skin, and supports the skin's natural detoxification process. Also tightens weak contours for a fresh and smooth complexion;
Hyaluronic Acid works like a sponge as it retains moisture in the skin for long-term hydration. At the same time, it helps to give the skin a fuller appearance, which helps to smooth out wrinkles and fine lines.","How to use
Apply a small amount of Noreva Norelift Chrono-Filler Eye & Lip Care 15ml (0.51fl oz) in the morning and/or at night on the marked areas around the eyes and lips."
https://www.caretobeauty.com/us/letibalm-repair-peribucal-cream-30ml/,Not found,30ml,"LETIbalm Repair Peribucal Cream repairs and protects the skin around the mouth exposed to constant dribbling and humidity. Its rich, moisturizing, and film-forming texture helps to prevent irritations. In fact, this very well-tolerated product creates a thin protective film that protects the skin against saliva and other possible external irritants. Additionally, it is suitable for babies from 6 months of age. Not only infants benefit from LETIbalm Repair Peribucal Cream, but also elderly persons with dribble problems. On one hand, it is indicated for teething, excess saliva, constant dribbling, and pediatric compulsive oral habits. On the other hand, it is a very useful product in cases of neurological disorders that cause drooling. It protects the perioral area locally altered and reddened by drooling while fostering the recovery of its normal state of smoothness and health.","Main Ingredients

Argan oil is called the liquid gold of Morocco. It contains 80% nourishing and moisturizing unsaturated fatty acids, and a large amount of antioxidant vitamin E;
Shea Butter regenerates and soothes the skin, protects it from external factors (such as UV rays or wind), and is also rich in antioxidants;
Glycerin keeps the skin lipids between our skin cells in a healthy state, protects against irritation, helps to restore skin natural protection;
Allantoin is not only soothing but also skin-softening, protecting and promotes wound healing.","How to use
Apply LETIbalm Repair Peribucal Cream and&nbsp;spread gently on clean and dry skin, in the perioral area affected by saliva (lips, mouth contour, chin). The rounded tip of the tube makes it easier to apply the product to the skin. The area where it is applied can be extended to the neck or top of the chest if necessary. Do not apply if the skin has wounds."
https://www.caretobeauty.com/us/nuxe-nuxuriancer-ultra-eye-and-lip-cream-global-anti-aging-15ml/,NUXE,15ml,"NUXE Nuxuriance® Ultra Eye and Lip Cream Global Anti-Aging is an anti-aging eye and lip contour cream with the powerful anti-aging innovation of the Bi-Floral Cells of Saffron and Bougainvillea. These ingredients end up smoothing out wrinkles and loose skin. Furthermore, this formula also fights dark circles and puffiness around the eyes. For the lips, this luxurious cream helps to smooth the skin and soothe discomfort due to dryness. Due to its prolonged-release technology, the effects last for several hours and the cream has a continuous anti-aging action that replumps the skin and attenuates wrinkles. Finally, with 7 registered patents in France, this innovative range is a must have for those who are fighting advanced signs of aging.","Main Ingredients

Caffeine has antioxidant properties that stimulate microcirculation of the blood vessels which helps improve dark under-eye circles and puffy eyes;
Hydroxyethyl Urea is known to be a great moisturizer that helps the skin to cling onto water and thus to make it hydrated and elastic;
Hyaluronic Acid locks in moisture, boosts elasticity and visibly plumps fine lines and wrinkles.","How to use
Apply NUXE Nuxuriance® Ultra Eye and Lip Cream Global Anti-Aging in the morning and evening by dispensing 1 pump of the product and applying small dots on the eye contour. Pat those dots until fully absorbed and then repeat the process on the lip contour."
https://www.caretobeauty.com/us/evolve-360-eye-lip-contour-cream-15ml/,Evolve,15ml,"Evolve 360 Eye And Lip Contour Cream 15ml (0.51fl oz) is a double-action cream that tackles dark circles, puffiness, fine lines, and wrinkles around both the eyes and lips. This lightweight product uses natural ingredients to help your skin age as gracefully as possible, with minimum disruption. This unique formula features a rejuvenating Probiotic Complex that not only helps improve the microbiome but also minimizes signs of aging and fatigue around the eyes. Besides, this product also contains firming Peptides and re-plumping Hyaluronic Acid, in order to restore elasticity and firmness to the skin and smooth out the appearance of wrinkles. Lastly, it has a lightweight formula that is easily absorbed, leaving a comfortable feeling on the skin.","Main Ingredients

Probiotics not only help improve the microbiome but also reduce the appearance of fine lines and wrinkles around the eye and lip areas. These ingredients are also effective in reducing puffiness and dark circles, thus creating a rejuvenated, revitalized look;
Peptides from Sacha inchi, improve firmness due to their ability to improve dermal density. They are also able to minimize the appearance of wrinkles and create a smoother, more even complexion;
Hyaluronic Acid of low molecular weight promotes hydration while boosting collagen production. As a result, it minimizes the appearance of fine lines and wrinkles.","How to use
Apply Evolve 360 Eye And Lip Contour Cream 15ml (0.51fl oz) to the previously cleansed skin of the eye and lip contour areas. Then, use your ring finger to gently massage the product in order to improve absorbtion."
https://www.caretobeauty.com/us/nuxe-nuxuriance-ultra-the-eye-lip-contour-cream-15ml/,NUXE,15ml,"NUXE Nuxuriance Ultra The Eye & Lip Contour Cream 15ml (0.51oz) is particularly formulated to address the main signs of aging specifically around the eyes and lips, areas most susceptible to expression lines. At the core of this cream is ALFA [3R] technology which harnesses the power of three key ingredients: alfalfa seed extract, hyaluronic acid, and Hemerocallis fulva extract. These components work synergistically to provide a comprehensive anti-aging action. It revitalizes, renews, and resurfaces the skin. This product proves its efficacy with 87% of women observing a noticeable reduction in crow’s feet, frown lines, and peribucal wrinkles, showcasing its ability to tackle signs of aging not only on the eye area but also the lip contour. In addition to this anti-aging effect, this eye cream also helps reduce the appearance of dark circles and decrease the volume of puffiness.
The product’s texture is a micro-emulsion, ensuring it is comfortable and non-sticky upon application. Moreover, the subtle and fresh fragrance enhances the application experience, providing a scent that is both modern and delicate, ensuring optimal tolerance for the fragile eye and lip areas. In summary, this product is ideal for those seeking to rejuvenate their eye and lip contours with a product that blends efficacy with sensory pleasure.","Main Ingredients

Alfalfa seed extract promotes skin renewal and boosts collagen synthesis. In this way, it contributes to a more youthful and vibrant complexion;
Hyaluronic acid is a humectant with the ability to capture and retain water molecules. Therefore, it deeply moisturizes the skin, providing immediate and long-lasting hydration. Additionally, it helps to plump up the skin, smoothing out wrinkles and fine lines;
Hemerocallis fulva extract is rich in phenolic compounds, flavonoids, carotenoids, and ascorbic acid, thus making it a strong antioxidant. Together with its antiglycation properties, this extract offers anti-aging benefits.","How to use
Apply the equivalent of 2 grains of rice of NUXE Nuxuriance Ultra The Eye & Lip Contour Cream 15ml (0.51oz) to the eye and lip contours.
Notes
This product has a new packaging and formula."
https://www.caretobeauty.com/us/weleda-redensifying-eye-and-lip-contour-10ml/,Weleda,10ml,,Not found,Not found
https://www.caretobeauty.com/us/juvena-master-care-mastercream-eye-lip-20ml/,Juvena,20ml,"Juvena Master Care MasterCream Eye & Lip 20ml (0.7 oz)&nbsp;is suitable to protect the most sensitive areas of the skin, the eyes and lips. It leaves the skin rejuvenated and restored with its anti-aging properties. Besides providing intense moisturizing, the cream tackles fine lines and wrinkles. On top of that, it attenuates puffiness and evens the skin tone. In the end, it visually improves the quality of the skin and smooths the skin texture. It has been dermatologically and ophthalmologically&nbsp;tested, so it ensures the best treatment.","Main Ingredients

Caffeine boosts metabolism and circulation in the skin, making it more receptive to further active ingredients;
Soy Peptides are rich in anti-aging properties that aid in wound healing. On top of that, they contain amino acids that are necessary for collagen production. As we age, the production of collagen, an essential vitamin for keeping our complexion plump, slows down. Thus, it is important to stimulate its synthesis;
Rice Peptides target damage caused by UV rays exposure and protects the skin against hyperpigmentation. At the same time, they attenuate the appearance of fine lines and wrinkles. Finally, they also increase collagen production;
Garden Cress Extract brightens the skin and evens the skin tone.","How to use
Apply Juvena Master Care MasterCream Eye & Lip 20ml (0.7 oz)&nbsp;whenever necessary to the eye and lip contours. Then gently massage it. Let it absorb."
https://www.caretobeauty.com/us/sisley-paris-eye-and-lip-contour-balm-30ml/,Sisley Paris,30ml,"Sisley Paris Eye and Lip Contour Balm 30ml (1 fl oz)&nbsp;is a high-end balm that deeply moisturizes and smoothes the eye and lip areas. Due to its formula rich in natural plant extracts, it protects these delicate parts of the face. For instance, the&nbsp;decongesting Witch Hazel and the stimulating Tomato Extracts present in the formula,&nbsp;reduce under-eye puffiness while also correcting wrinkles and fine lines. As it moisturizes and hydrates the face it combats skin dryness. As a result, it leaves the skin around the eyes and lips soft and fresh. Due to its light and fresh gel texture and thanks to the spatula that comes with the balm, it applies easily and provides moments of comfort, leaving the skin soft. Additionally, its transparent texture makes its application convenient, as you can carry on with your day as soon as you apply it. In the end, this balm creates a special well-being moment in the skincare routine for both the face and mind. Expect a revitalized look!","Main Ingredients

Tomato Extract relieves skin from irritation, revitalizing it. On top of that, it stimulates the skin making it delay signs of aging, remove dead skin cells and tighten enlarged pores. At the same time, it reduces excess oil from the skin;
Witch Hazel balances the oil levels and reduces inflammation. Hence, it soothes and smoothes the skin.","How to use
Apply Sisley Paris Eye and Lip Contour Balm 30ml (1 fl oz)&nbsp;preferably in the morning on previously cleansed and dry skin, before any other product. Take a small amount of the balm with the help of the spatula, and smooth it lightly around the eyes and lips with the fingertips."
