Link,brand,volume,description,ingredients,how_to_use
https://www.caretobeauty.com/us/embryolisse-3-in-1-secret-paste-100ml/,Embryolisse,100ml,"Embryolisse 3-In-1 Secret Paste 100ml (3.38 fl oz) is a versatile skincare solution offering different uses with just one product. To begin with, this product can be integrated into the routine as a purifying cleanser. Secondly, it can be used as an anti-shine mask by simply applying a generous layer of the paste to the face once or twice a week, leaving it on for about 10 minutes. The paste acts as an absorbent, focusing on reducing sebum production. After rinsing with water, the skin appears detoxified, feeling fresher and rejuvenated. With consistent use, imperfections can become visibly diminished, giving the skin a more balanced appearance. Last but not least, this paste also serves as an SOS anti-blemish care. By applying the paste directly onto blemishes in the evening, it works diligently overnight to help dry out the pimple and reduce associated redness as well.
The formula boasts the inclusion of turmeric extract, chickpea powder, and yellow clay to offer all the different benefits. In summary, this paste offers a multifaceted approach to skincare with its threefold functionality. Whether combatting a sudden breakout, seeking to reduce shine, or aiming for a daily clean, this paste is a convenient choice.","Main Ingredients

Turmeric extract has anti-inflammatory and antibacterial properties, thereby helping to fight blemishes and marks;
Chickpea powder has purifying properties, thus helping to reduce excess sebum, unclog pores, and minimize redness;
Yellow clay with absorbing properties eliminates impurities and excess sebum.","How to use
To clean the face, apply Embryolisse 3-In-1 Secret Paste 100ml (3.38 fl oz) to damp skin, massage, and then rinse. To use as a mask, apply a thick layer once or twice a week and leave for 10 minutes. Then, rinse. Alternatively, apply directly to the blemishes and leave overnight to use as an SOS treatment. Rinse in the next morning."
https://www.caretobeauty.com/us/l-oreal-paris-revitalift-vitamin-c-salicylic-acid-foaming-cleanser-150ml/,L'Oréal Paris,150ml,"L'Oréal Paris Revitalift Vitamin C + Salicylic Acid Foaming Cleanser 150ml (5.07 fl oz) harnesses the brightening properties of vitamin C and the exfoliating benefits of salicylic acid to unveil brighter, more radiant skin. First and foremost, vitamin C takes center stage in the formula. This vitamin is known for its potent antioxidant and brightening properties. As such, this powerhouse ingredient illuminates the complexion. On the other hand, salicylic acid is an exfoliant that efficiently rids the skin of impurities, dead cells, and excess sebum. As a result, it minimizes pores and leaves the skin with a smoother texture. That said, this cleanser offers results since the first application as it effortlessly sweeps away impurities, ensuring no residue is left behind, just soft, clean skin. This cleanser suits all skin types, even in the case of sensitive skin. In conclusion, this product brings back your skin's radiance and paves the way for a smoother and more youthful appearance.","Main Ingredients

Vitamin C is a renowned antioxidant that fights free radicals to prevent oxidative stress. Furthermore, it boosts collagen production and has a brightening effect. As a result, this ingredient works to fight aging signs, illuminate the complexion, and even out the skin tone, improving the overall appearance of the skin;
Salicylic acid is an exfoliating acid thus it removes dead skin cells. Consequently, it helps tighten pores and lend the skin an even and smoother appearance.","How to use
Apply L'Oréal Paris Revitalift Vitamin C + Salicylic Acid Foaming Cleanser 150ml (5.07 fl oz) to damp skin of the face and neck and gently massage to lather. Then, rinse well with lukewarm water."
https://www.caretobeauty.com/us/la-cabine-nature-skin-food-citrus-love-facial-cleanser-250ml/,La Cabine,250ml,,Not found,Not found
https://www.caretobeauty.com/us/atashi-cellular-micellar-water-250ml/,Atashi,250ml,"Atashi Cellular Micellar Water 250ml (8.4fl.oz.)&nbsp;removes any traces of makeup from your face, including sensitive areas such as the eyes and lips. Its formula is made of 100% natural micelles, Vitamin E and Lemon Extract. These ingredients work together to not only cleanse and soften the skin but also provide an anti-aging effect, protecting the skin from damage caused by environmental aggressions. In fact, they purify the skin and stimulate collagen production. As we age, the production of collagen, an essential vitamin for keeping our complexion plump, slows down. Thus, it is important to boost its synthesis.
On another note, this micellar water absorbs easily into the skin, toning it and restoring its brightness.
In this way, the skin is purified without feeling sticky or tight. Its ultra-gentle formula makes it suitable to remove makeup from the most senstive and driest skin. Moreover, it has been dermatologically&nbsp;and ophthalmologically tested. In the end, it soothes the skin providing a moment of comfort.","Main Ingredients

Vitamin E is an antioxidant that reduces skin damage caused by radiation exposure and free radicals;
Lemon Extract is rich in vitamin C. Hence, it prevents premature aging caused by environmental factors. Additionally, it boosts collagen production;
Glycerin is a natural moisturizer present in our skin. It has been used for more than half a century, not as a mere moisturizer but also to protect the skin against irritation. Additionally, it keeps the skin healthy, restoring its barrier. It is effective from low percentages.","How to use
Apply Atashi Cellular Micellar Water 250ml (8.4fl.oz.)&nbsp;in the morning and evening. Apply it with a cotton pad, without rinsing."
https://www.caretobeauty.com/us/arganicare-aloe-hydra-2-in-1-foaming-cleanser-225ml/,Arganicare,225ml,"Arganicare Aloe Hydra 2-in-1 Foaming Cleanser 225ml (7.5 fl oz) is a face lotion that both removes impurities from the skin while also refreshing it. Ideal for all skin types, including sensitive skin.
Aloe Vera, its main ingredient, is rich in antioxidants. As a result, the skin will feel instantly refreshed and soothed but never dry. Therefore, this product is suitable both as a facial cleanser, preparing the skin to receive a moisturizer and make-up afterward, or even as a make-up remover. In either case, the skin will feel soft and clean, with its characteristic radiant and youthful glow back.","Main Ingredients

Aloe Vera has rich antibacterial and anti-inflammatory components, therefore helping the skin to regenerate itself. In addition, with its humectant and emollient properties, it is also a very gentle moisturizer, commonly used to hydrate the skin without damaging its barrier.","How to use
Apply Arganicare Aloe Hydra 2-in-1 Foaming Cleanser 225ml (7.5 fl oz) on still-damp skin and gently massage it with circular movements, avoiding the eye area. Afterward, rinse it thoroughly with cold water and dry the skin with a gentle non-abrasive towel."
https://www.caretobeauty.com/us/revlon-professional-revlonissimo-technics-color-clean-cleanser-250ml/,Revlon Professional,250ml,"Revlon Professional Revlonissimo Technics Color Clean Cleanser 250ml (8.45fl oz) is a professional cleanser designed to safely remove hair dye from the skin. In particular, this product guarantees premium color services that are completely gentle on the skin, making it as comfortable and healthy as possible. In this case, it prevents the skin from being stained by hair dyes, even those with high coverage. So, by just using a cotton-wool ball, this cleanser becomes a very practical and easy-to-use solution. In the end, just wash the skin with water and that's it, it's guaranteed to be cleaner and without any kind of stains.",Not found,"How to use
This product was developed for professional use only and should not, therefore, be used at home. Remove stains with Revlon Professional Revlonissimo Technics Color Clean Cleanser 250ml (8.45fl oz) before rinsing the color from the hair. First, moisten the cotton-wool ball with this lotion and gently rub on the stains. Emulsify and rinse everything."
https://www.caretobeauty.com/us/uriage-thermal-micellar-water-sensitive-skin/,Uriage,500ml (16.91 fl oz),"Uriage Thermal Micellar Water Sensitive Skin is a cleansing water that removes make-up and impurities from sensitive and redness-prone skin. Formulated with Non-Ionic Surfactants, which effectively dislodge make-up and impurities, and Uriage Thermal Water, which soothes the skin and relieves sensations of discomfort, this product purifies the skin and provides long-lasting hydration, all the while calming the skin and attenuating redness. The complexion instantly regains comfort and softness.","Main Ingredients
		
Non-Ionic Surfactants act like magnets to effectively capture make-up and impurities;
Uriage Thermal Water, which is pure and naturally rich in mineral salts and trace elements, soothes the skin and relieves sensations of discomfort.","How to use
Apply Uriage Thermal Micellar Water Sensitive Skin to the face using a soaked cotton pad. Gently wipe over the face, eyes and neck to cleanse the skin. Do not rinse."
https://www.caretobeauty.com/us/bioderma-hydrabio-h2o-moisturising-micelle-solution/,Bioderma,500ml (with pump),"Bioderma Hydrabio H2O Moisturising Micelle Solution is a daily cleanser specially formulated to tend to the needs of dehydrated and sensitive skin. It not only gently cleanses the skin from impurities and make-up but also helps hydrate and soothe. With the Aquagenium™ Complex, this micellar water can enhance skin hydration and also promote a healthier skin barrier. It not only leads to better skin hydration but also comforts and soothes the skin. And, due to the Micellar Technology, it can also gently but effectively remove impurities and make-up while respecting the skin’s natural protective film. All in all, it lends the skin a pleasant feeling of cleanliness, hydration, and comfort and offers a quick and practical way to gently but effectively cleanse the skin.","Main Ingredients

Aquagenium™ Complex consists of a combination of Apple Seed Extract and Niacinamide. Apple Seed Extract enhances the expression of the ""water channels"" naturally present in the skin and promotes the irrigation of the skin cells. Niacinamide increases ceramide synthesis and leads to better skin hydration. So in essence, this complex can not only enhance skin hydration but also promote a healthier skin barrier comforting and soothing the skin;
D.A.F. patent increases the tolerance threshold of the skin in order to strengthen its resistance;
Micellar Technology has the ability to effectively remove impurities while respecting the skin's natural protective film.","How to use
Apply Bioderma Hydrabio H2O Moisturising Micelle Solution  to a cotton pad. Gently wipe the face and eye area and repeat the process if necessary. It does not require rinsing with water."
https://www.caretobeauty.com/us/diadermine-hydrating-micellar-water-400ml/,Diadermine,400ml,"Diadermine Hydrating Micellar Water is a micellar water that helps you remove makeup from your eyes, face and lips effectively, gently and in order to care for your skin. In turn, this micellar water also helps to remove impurities and traces of dirt from your skin. Furthermore, during facial cleansing, this product allows the skin to maintain its level of hydration and thus stay revitalized, radiant, fresher and cleaner.
Regarding the composition of this product, it contains 93% natural ingredients. In addition, it contains small particles that trap and remove dirt from the face thus helping to clean the skin effectively but gently. On the other hand, this product contains Aloe Vera and Panthenol in order to purify the skin without drying it out. Finally, your facial skin is left without any traces of make-up, cleaner, hydrated and smoothed.",Not found,"How to use
Apply Diadermine Hydrating Micellar Water with the help of a cotton pad soaked in this solution. Apply it all over your face and neck in the morning and evening to remove impurities, dirt and makeup."
https://www.caretobeauty.com/us/cosrx-low-ph-good-morning-gel-cleanser-150ml/,COSRX,150ml,"COSRX Low pH Good Morning Gel Cleanser clears all skin types delicately but deeply, casting away all sorts of daily impurities. Thus, this everyday essential balances even the most sensitive complexions due to its acidic pH level. In fact, the formula rids the skin of blemishes and imperfections without causing irritation or redness. All in all, it speeds up the epidermis renewal while still preserving the skin's natural moisture barrier. To the same extent, shielding from free radicals and external threats ends up enhancing the skin's overall condition. Moreover, you'll notice immediate improvements after each application, leading to a refreshing finish. In short, it helps block various environmental aggression at the same time it removes excess sebum. To sum up, extra luminous, clean, and awakened skin cells are ready to thrive on any occasion.","Main Ingredients

Japanese Snowbell Leaf Extract gathers impressive antioxidant, anti-pollution, and soothing abilities, invigorating congest skin. Thus, this element helps gives a healthier appearance to otherwise lifeless complexions;
Evening Primrose Flower Extract nourishes even the most sensitive skin types. Due to its high concentration of omega-6, it helps sustain your complexion's elasticity and softness, giving a polished finish;
Tea Tree Leaf Oil is filled with powerful antioxidants and other nutrients that enhance the condition of your facial skin. These elements restore damaged tissues from the inside out;
Lastly, Citric Acid balances the skin and works by exfoliating the upper layer of dead skin cells to help clean pores.","How to use
Apply a generous amount of COSRX Low pH Good Morning Gel Cleanser twice a day, during the morning and evening. After placing the gel on the palm of your hand wait for it to foam up. Then massage all over your face, performing circular and upward motions with your hands. However, stay away from the sensitive eye/mouth sections. Finally, rinse it off with as much care as possible, resorting to warm water."
https://www.caretobeauty.com/us/comodynes-make-up-remover-micellar-solution-dry-skin-x20/,Comodynes,x20,"Comodynes Make-up Remover Micellar Solution Dry Skin is an innovative make-up remover suitable for normal to dry skin, including sensitive. Combining the properties of a cleanser and a moisturizer in a single product, this extra-soft towelette is moistened with a micellar solution with high skin tolerance, which eliminates impurities and make-up without disturbing the skin's natural balance.","Main Ingredients

Methylpropanediol has pronounced hydrating properties, which leave the skin with a smooth, dewy finish;
Oat extract is a natural ingredient that provides dry skin with moisturizing and soothing properties.","How to use
Massage Comodynes Make-up Remover Micellar Solution Dry Skin onto face and eyes for 1 minute to remove impurities and make-up. No need to rinse afterwards."
https://www.caretobeauty.com/us/madara-melting-cleansing-oil-100ml/,Mádara,100ml,"Mádara Melting Cleansing Oil clears your facial skin and ultimately hydrates as well as detoxifies, removing make-up, long-lasting foundation, or mineral sunscreen. Thanks to several delicate ingredients like Vitamin E, Evening Primrose, and Almond oils impurities are cast away without endangering the skin's natural protective barrier. In the end, you'll feel refreshed, as your complexion is ready to absorb the qualities of other beauty products. In fact, this lightweight oil is specially made for drier skin types that experience daily stress and deal with environmental aggressions regularly. Therefore, these are more fragile and susceptible to aging signs as well as overall dullness. 
As it melts, this 100% natural cleansing oil smoothes the rougher top layers of the skin and maximizes luminosity. Soon, you'll notice a much welcomed feather-like finish. After coming in contact with water, the formula's texture becomes soft, making it easy to apply and rinse off, at the same time. More precisely, its use tends to become rather addictive, as you realize the skin gets the treatment it deserves. At last, nourishment, protection, and long-lasting hydration lead to a perfect outcome of radiance as well as intensive cleansing. Clinically approved, while also preserving sustainability, transparency, and affordability, like the rest of Mádara's cosmetics, it shields the planet's well-being. Indeed the conscious extraction of natural resources is as important as producing optimal results in the world of skincare.","Main Ingredients

Vitamin E moisturizes and nourishes your skin, ultimately making your complexion smoother as well as healthier. Plus, it helps reduce hyperpigmentation and wrinkles, being the perfect ally for premature aging and fatigue signs. As a powerful antioxidant, it may be effective at reducing UV damage and also destroys damaging free radicals;
Almond Oil consists mainly of oleic and linoleic triglycerides, slowing down photoaging as well as a number of other skin conditions. Besides, it improves skin tone while also being highly emollient and balancing the absorption of moisture/water loss. Lastly, antibacterial and full of vitamin A, this oil also addresses acne;
Evening Primrose Oil is ideal to hydrate and soothe the skin. As a rich source of omega 6, it's pivotal to preserve the natural defensive barrier and moisture of your complexion.","How to use
Apply a small portion of Mádara Melting Cleansing Oil and delicately massage on dry or wet skin. Do so in circular upward motions until you feel the face is fully cleansed. Rinse off the product thoroughly. Then, if you wish use other Mádara cosmetics to complete your beauty regime."
https://www.caretobeauty.com/us/sensilis-ritual-care-biphasic-eye-and-lip-makeup-remover-150ml/,Sensilis,150ml,"Sensilis Ritual Care Bi-Phasic Eye And Lip Makeup Remover is a two-phase cleanser that removes even waterproof make-up from both the eyes and lips. Because it's formulated with a soothing blend of bamboo and cotton extracts, this product is perfect for these sensitive areas of the face. It removes waterproof make-up without leaving any residue, therefore preparing your skin for the next step of your beauty routine.","Main Ingredients

Bamboo extract soothes the skin while providing it with antioxidant benefits;
Cotton extract, because of its high content in vitamin E, antioxidants, and omega-3 fatty aciids, soothes even the most sensitive and reactive skin.","How to use
Shake Sensilis Ritual Care Bi-Phasic Eye And Lip Makeup Remover well before use. Apply the product to the eye and lip areas using a cotton pad."
https://www.caretobeauty.com/us/youth-lab-daily-cleanser-normal-skin-200ml/,YOUTH LAB,200ml,"YOUTH LAB Daily Cleanser Normal Skin is a rich foaming and gentle cleansing gel that removes impurities and make-up, without disturbing the natural moisture balance of normal and dry skin types. The delicate vegan formula restores the skin's radiance and brightness, provides instant hydration, and regulates the skin's production of oil/sebum. The skin emerges cleansed, purified, and beautifully supple, with no sign of dryness or dehydration.","Main Ingredients

Mild Surfactants from Aminoacids remove impurities and makeup, without dehydrating the skin;
Olive Leaf Extract provides maximum soothing, antioxidant and antimicrobial protection;
Cocoglucoside, with strong moisturizing effect, soothes irritated skin;
Sodium PCA, Sodium Lactate, Urea, Fructose &amp; Inositol hydrate, prevent transepidermal water loss and stimulate skin regeneration.","How to use
Apply a small amount of YOUTH LAB Daily Cleanser Normal Skin to the skin of the face and neck. Massage with gently circular movements. Leave on for up to 1 minute for maximum results. Rinse off with water."
https://www.caretobeauty.com/us/filorga-anti-ageing-micellar-solution-400ml/,Filorga,400ml,"Filorga Micellar Solution Face & Eyes Fragrance-Free is a gentle daily cleanser enriched with moisturizing and soothing ingredients. Suitable for all skin types, this micellar solution is able to not only gently cleanse the skin from impurities and makeup but also hydrate and soothe the skin. With Rhamnosoft, which has anti-inflammatory and also soothing properties it helps comfort and protect the skin. With Trehalose, which has water-binding properties it helps intensely moisturize the skin and provide long-lasting hydration. And, due to the Micellar Technology, it can also gently but effectively remove impurities and makeup while respecting the skin’s natural protective film. All in all, it offers a quick and practical way to gently but effectively cleanse the skin and lend it a pleasant feeling of moisture and comfort.","Main Ingredients

Micellar Technology has the ability to effectively remove impurities and makeup while respecting the skin's natural protective film;
Rhamnosoft has anti-inflammatory and also soothing properties. Its presence in the formula helps comfort and protect the skin;
Trehalose has water-binding properties. It helps intensely moisturize the skin and provide long-lasting hydration.","How to use
Apply Filorga Micellar Solution Face & Eyes Fragrance-Free to a cotton pad. Gently wipe the face and eye area and repeat the process if necessary."
https://www.caretobeauty.com/us/galenic-pur-2-in-1-face-eye-make-up-remover-200ml/,Galénic,200ml,"Galénic Pur 2-in-1 Face & Eye Make-Up Remover is a cleansing milk-lotion used to remove impurities and make-up from face and eyes in a single gesture. Its effectiveness and softness are achieved with micellar microstructures, which transport the cleansing ingredients to the impurities on the skin. Sebum and make-up get imprisoned in the center of the micelles, while the Melilotus Floral Water gently cleanses and reduces skin irritations. The skin gets slightly fragranced, fresh and smooth.","Main Ingredients

Melilotus Floral Water eliminates the toxins and reduces skin irritations;
Gentle Cleansing Surfactants cleans the skin without harming it;
Alpha Bisabolol soothes and softens the skin;
Special Gentle Cleansing Polymers imprison the impurities.","How to use
Apply Galénic Pur 2-in-1 Face & Eye Make-Up Remover on the face, neck, and eye area with a cotton pad or fingertips, with gentle circular movements. Remove the excess with a cotton pad."
https://www.caretobeauty.com/us/clarins-velvet-cleansing-milk/,Clarins,400ml (eco refill),"Clarins Velvet Cleansing Milk is an exquisite makeup remover designed for those who cherish both comfort and gentleness in their skincare routine. This luxurious cleansing milk effortlessly removes makeup from the face, eyes, and lips, along with impurities and traces of pollution, consequently leaving the skin feeling supple and refreshed. Its formula features the [Gentle Complex], which includes organic extracts of yellow gentian and lemon balm, chosen for their soothing and softening properties. Additionally, the formula contains moringa extract which promotes the elimination of pollution particles for a purified complexion.
The creamy, comforting milk texture not only cleanses but also ensures the skin remains soft and comfortable after use. Moreover, this cleanser is specially formulated to be gentle enough for use on the face, eyes, and lips, making it a versatile addition to any skincare regimen. Whether you're looking to remove light makeup or something more intense, this cleansing milk is up to the task. In summary, this cleansing milk offers a harmonious blend of cleansing efficacy and comforting benefits to remove makeup, pollution, and impurities, leaving the skin feeling clean and soft. It's available in different formats, including an eco-refill.","Main Ingredients

[Gentle Complex] combines organic yellow gentian and lemon balm extracts. These work together to offer calming, soothing, and softening properties;
Moringa extract helps to eliminate traces of pollution from the skin.","How to use
Warm the product in your hands and apply Clarins Velvet Cleansing Milk to dry skin of the face, eyes, lips, and neck. Apply with light pressure and then quickly lift the fingertips off the skin."
https://www.caretobeauty.com/us/rvb-lab-cleansing-3-in-1-two-phase-micellar-lotion-400ml/,RVB LAB,400ml,,Not found,Not found
