Link,brand,volume,description,ingredients,how_to_use,product_key
https://www.caretobeauty.com/us/ziaja-manuka-honey-anti-acne-face-mask-7ml/,Ziaja,7ml,"Ziaja Manuka Honey Anti-Acne Face Mask 7ml (0.24 fl oz) is a face mask especially recommended for acne-prone skin. This mask moisturizes and smooths the skin while helping to improve the condition of acne blemishes. With a formula comprising 95% ingredients of natural origin, it offers a nurturing and quick skincare solution. The inclusion of manuka honey in the formula provides moisturization and nourishment, soothing the skin while promoting skin healing. Moreover, manuka honey is renowned for its antimicrobial properties, making it particularly beneficial for acne-prone skin. Additionally, niacinamide plays a key role in strengthening the skin barrier. It also has sebum-regulating and calming properties, which help to decrease the appearance of acne lesions and prevent new breakouts. Last but not least, zinc ferment works synergistically with manuka honey and niacinamide, thanks to its calming effects.
This mask has a thick, honey-like consistency. However, it rinses off easily, leaving the skin feeling smooth, soft, and calm. Its pleasant, sweet fragrance enhances the overall skincare experience, making it a delightful addition to any routine.","Main Ingredients

Manuka Honey moisturizes, nourishes, and soothes the skin. It also has antimicrobial properties and helps to promote skin healing;
Niacinamide, a derivative of vitamin B3, leads to a stronger skin barrier, therefore increasing the skin's hydration and leading to healthier skin. It also has sebum-regulating and soothing properties, helping to decrease the appearance of acne lesions;
Zinc Ferment has anti-inflammatory properties.","How to use
Apply Ziaja Manuka Honey Anti-Acne Face Mask 7ml (0.24 fl oz) onto clean and dry skin of the face, avoiding the eye area. Then, leave it on for 10 to 15 minutes. Finally, rinse off thoroughly. This product may be used daily.",855
https://www.caretobeauty.com/us/apivita-express-beauty-purifying-face-mask-oily-skin-2x8ml/,APIVITA,x8,"APIVITA Express Beauty Face Mask Propolis is a purifying face mask that cleanses and balances oily and acne-prone skin. Its key ingredient, propolis, provides a mild antiseptic action that helps prevent the appearance of blemishes and spots; at the same time, heilmoor clay helps cleanse the pores, leaving the skin with a softer and more even appearance. Ideal for acne-prone skin, this mask is also rich in lemon essential oil, which refreshes and soothes the skin, leaving it comfortable all day long.","Main Ingredients

Propolis, heilmoor clay, and immortelle balance oiliness on the skin, all the while providing an antibacterial and antiseptic action;
Vitamin E and panthenol soften the skin and improve its texture;
Lemon essential oil offers a sense of enduring freshness that revitalizes and reinvigorates the complexion;
This product contains a patented infusion of 3 different species of organic Greek mountain tea instead of plain water; this natural ingredient helps boost the antioxidant properties already present in the formula, due to its high concentration of polyphenols.","How to use
Apply a thick layer of APIVITA Express Beauty Face Mask Propolis to clean skin, while taking care to avoid the eye area. Leave on for 10 minutes, then remove excess with a damp cotton pad. Rinse thoroughly in order to fully remove the product from the skin. In order to achieve the best possible results, follow with your favorite face cream from the APIVITA range.",855
https://www.caretobeauty.com/us/apivita-express-beauty-face-mask-intensive-moisturization-2x8ml/,APIVITA,x8,"APIVITA Express Beauty Face Mask Cucumber is a deeply moisturizing mask for dry and dehydrated skin. As it contains cucumber, an incredibly water-rich vegetable, this mask offers a genuine boost of moisture to the skin. At the same time, it creates an immediate feeling of freshness that lasts through the day. The skin is nourished and re-plumped from the inside out, emerging perfectly soft and supple, with newfound comfort and elasticity.","Main Ingredients

Cucumber, aloe, hyaluronic acid, and Greek thyme honey moisturize the skin in-depth;
Jojoba oil, avocado, and shea butter provide heavy duty nourishment to the skin;
Vitamin E, a potent antioxidant, helps the skin resist free radical damage;
This product contains a patented infusion of 3 different species of organic Greek mountain tea instead of plain water; this natural ingredient helps boost the antioxidant properties already present in the formula, due to its high concentration of polyphenols.","How to use
Apply a thick layer of APIVITA Express Beauty Face Mask Cucumber to clean skin, while taking care to avoid the eye area. Leave on for 10 minutes, then remove excess with a damp cotton pad. Rinse thoroughly in order to fully remove the product from the skin. In order to achieve the best possible results, follow with your favorite face cream from the APIVITA range.",855
https://www.caretobeauty.com/us/apivita-express-beauty-face-mask-radiance-revitalization-2x8ml/,APIVITA,x8,"APIVITA Express Beauty Face Mask Pomegranate is a radiance-restoring face mask for skin that's lost its luster. Infused with the antioxidant properties of pomegranate, a perennial symbol of well-being, this mask protects the skin against free radical damage, which is often responsible for dulling the complexion. A blend of hydrating active lends this mask additional moisturizing properties, ensuring the skin emerges with newfound softness and suppleness.","Main Ingredients

Pomegranate rejuvenates the appearance of the skin while offering protection against free radical damage;
Honey extract, hyaluronic acid, and shea butter moisturize and nourish the skin;
This product contains a patented infusion of 3 different species of organic Greek mountain tea instead of plain water; this natural ingredient helps boost the antioxidant properties already present in the formula, due to its high concentration of polyphenols.","How to use
Apply a thick layer of APIVITA Express Beauty Face Mask Pomegranate to clean skin, while taking care to avoid the eye area. Leave on for 10 minutes, then remove excess with a damp cotton pad. Rinse thoroughly in order to fully remove the product from the skin. In order to achieve the best possible results, follow with your favorite face cream from the APIVITA range.",855
https://www.caretobeauty.com/us/ziaja-regenerating-face-mask-7ml/,Ziaja,7ml,"Ziaja Regenerating Face Mask 7ml (0.24 fl oz) is a face mask that smoothes and nourishes the skin. This vegan formula contains 95% ingredients of natural origin, featuring brown clay, which is rich in natural minerals. This ingredient works harmoniously with other elements in the formula such as canola oil, panthenol, vitamin E, and sweet almond proteins to smooth, nourish, and revitalize the skin. Moreover, it also helps to reduce the appearance of fine wrinkles, promoting a more youthful and refreshed look. So, the combined effects of these enriching ingredients make the skin feel soft, smooth, and revitalized.
In essence, this mask is a good option for anyone looking to indulge in a nourishing and smoothing skincare experience. It is suitable for all skin types and perfect for a skin pampering session.","Main Ingredients

Brown Clay is naturally rich in minerals and is thought to have anti-aging effects; 
Canola Oil has hydrating and soothing properties;
Panthenol is a humectant, so it helps the skin to attract and retain water. It helps to decrease transepidermal water loss, leading to more hydrated skin. It also has soothing effects;
Sweet Almond Seed Extract has moisturizing properties;
Vitamin E is an antioxidant. So, it helps protect the skin from damage caused by free radicals and sun exposure.","How to use
Apply Ziaja Regenerating Face Mask 7ml (0.24 fl oz) onto clean skin of the face and neck, avoiding the eye and mouth areas. Then, leave it on for 10 to 15 minutes. Finally, thoroughly rinse with water.",855
https://www.caretobeauty.com/us/apivita-express-beauty-moisturizing-nourishing-face-mask-2x8ml/,APIVITA,x8,"APIVITA Express Beauty Face Mask Honey is a nourishing mask for skin that feels dry and dehydrated. Enriched with Greek thyme honey, a luxurious natural ingredient, this mask envelops the skin in a cocoon of comfort, thus restoring its elasticity and suppleness. The soothing formula is also rich in vitamin E, a powerful antioxidant that improves the skin's resilience against environmental aggressions. After just application, the skin feels significantly softer to the touch&mdash;no pulling, no flaking, and no discomfort!","Main Ingredients

Greek thyme honey nourishes the skin, all the while restoring a feeling of comfort;
Jojoba oil, avocado, and shea butter provide heavy duty nourishment to the skin;
Vitamin E, a potent antioxidant, helps the skin resist free radical damage;
This product contains a patented infusion of 3 different species of organic Greek mountain tea instead of plain water; this natural ingredient helps boost the antioxidant properties already present in the formula, due to its high concentration of polyphenols.","How to use
Apply a thick layer of APIVITA Express Beauty Face Mask Honey to clean skin, while taking care to avoid the eye area. Leave on for 10 minutes, then remove excess with a damp cotton pad. Rinse thoroughly in order to fully remove the product from the skin. In order to achieve the best possible results, follow with your favorite face cream from the APIVITA range.",855
https://www.caretobeauty.com/us/ziaja-soothing-face-mask-7ml/,Ziaja,7ml,"Ziaja Soothing Face Mask 7ml (0.24 fl oz) is a face mask that helps to moisturize and soothe sensitive and irritated skin. This vegan formula is crafted with 95% ingredients of natural origin. It includes pink kaolin clay, which helps absorb excess sebum while also providing soothing benefits, making it ideal for those with sensitive or reactive skin. Canola oil is included in the formula for its nourishing and softening properties. It delivers essential fatty acids that support the skin's natural barrier, helping to keep the skin moisturized and protected. Then, panthenol helps attract and retain moisture, so that the skin remains well-hydrated and comfortable. It also helps to calm irritation.
So, this soothing face mask is perfect for adding a pampering moment to your daily regimen. Its calming properties make it ideal for use when your skin needs extra care and attention, while also helping to maintain hydrated and soft skin.","Main Ingredients

Kaolin is a fine clay that helps to remove excess sebum and dirt without drying the skin. It also has soothing properties; 
Panthenol is a humectant, so it helps the skin to attract and retain water. It helps to decrease transepidermal water loss, leading to more hydrated skin. It also has soothing effects;
Allantoin soothes irritated skin, moisturizes and softens it;
Canola Oil has hydrating and soothing properties.","How to use
Apply Ziaja Soothing Face Mask 7ml (0.24 fl oz) onto clean skin of the face and neck, avoiding the eye and mouth areas. Then, leave it on for 10 to 15 minutes. Finally, thoroughly rinse with water.",855
https://www.caretobeauty.com/us/apivita-express-beauty-gentle-cleansing-face-mask-2x8ml/,APIVITA,x8,"APIVITA Express Beauty Face Mask Pink Clay is a gentle cleansing mask adapted to the needs of drier skin types. Infused with pink clay, one of the mildest types of clay, this mask purifies even the most sensitive skin, leaving it smooth and supple to the touch. A unique blend of soothing ingredients, such as rose extract, chamomile, and Greek thyme honey, helps the skin maintain its essential moisture intact; as a result, the complexion emerges softer than ever, with a visibly refined texture that radiates health and beauty.","Main Ingredients

Pink clay and saponaria purify the skin and minimize the appearance of enlarged pores;
A soothing blend of rose extract, chamomile, Greek thyme honey, calendula, and wheat proteins helps the skin retain moisture;
Rose essential oil hydrates and invigorates the skin, thus creating a glowing complexion;
This product contains a patented infusion of 3 different species of organic Greek mountain tea instead of plain water; this natural ingredient helps boost the antioxidant properties already present in the formula, due to its high concentration of polyphenols.","How to use
Apply a thick layer of APIVITA Express Beauty Face Mask Pink Clay to clean skin, while taking care to avoid the eye area. Leave on for 10 minutes, then remove excess with a damp cotton pad. Rinse thoroughly in order to fully remove the clay from the skin. In order to achieve the best possible results, follow with your favorite face cream from the APIVITA range.",855
https://www.caretobeauty.com/us/ziaja-tapioca-honey-sweet-face-care-smoothing-face-mask-7ml/,Ziaja,7ml,"Ziaja Tapioca Honey Sweet Face Care Smoothing Face Mask 7ml (0.24 fl oz) is a face mask that softens and smooths the skin, reducing roughness. This mask is formulated with 95% ingredients of natural origin, featuring honey. So, honey is known for its moisturizing properties, helping to soften and smooth the skin. It also has a calming effect, soothing irritations. Then, other moisturizing ingredients such as jojoba oil and glycerin help maintain hydrated, supple, and soft skin.
The mask has a thick consistency, reminiscent of liquid honey. It is easy to apply and features a rinsable formula that does not absorb completely into the skin. The result is skin that feels moisturized and smooth after each use. Moreover, it boasts a pleasant, sweet fragrance that makes the application process enjoyable, adding a touch of indulgence to the skincare routine. In essence, this face mask helps the skin remain soft and smooth, being a good option for dry skin.","Main Ingredients

Honey provides many benefits to the skin. It moisturizes, nourishes, and soothes the skin. It also contains antioxidants like vitamins C, E, and flavonoids, so it protects the skin from free radical damage and helps to fight signs of aging. Finally, it helps to promote skin healing;
Glycerin is a humectant, which means it attracts and retains water. Even more, it protects and restores the skin barrier, leaving the skin soft, hydrated, and healthy;
Jojoba Oil is an emollient that is rich in fatty acids and antioxidants. It is able to form a protective and moisturizing layer on the surface of the skin. It also provides nourishment, leading to soft and supple skin.","How to use
Apply an even layer of Ziaja Tapioca Honey Sweet Face Care Smoothing Face Mask 7ml (0.24 fl oz) onto clean skin of the face, avoiding the eye and mouth areas. Then, leave it on for 10 to 15 minutes. Finally, thoroughly rinse with lukewarm water.",855
https://www.caretobeauty.com/us/apivita-express-beauty-moisturizing-anti-pollution-face-mask-2x8ml/,APIVITA,x8,"APIVITA Express Beauty Face Mask Sea Lavender is an anti-pollution face mask for skin that's lost its luminosity and vitality. Infused with sea lavender, an everlasting deep blue plant found in the Mediterranean seaside, this mask helps the skin resist environmental aggressions due to its potent antioxidant properties. Hydrating actives, such as aloe and honey extracts, complement this action by replenishing the skin's lost moisture. The complexion is invigorated and revitalized, maintaining its natural luminosity for longer.","Main Ingredients

Sea lavender and propolis not only replenish moisture, but also improve the skin's resistance to environmental aggressions;
Aloe, honey extract and calendula hydrate and smooth the skin, thus lending it a softer appearance;
Lavender and geranium essential create an enduring feeling of calm and relaxation;
This product contains a patented infusion of 3 different species of organic Greek mountain tea instead of plain water; this natural ingredient helps boost the antioxidant properties already present in the formula, due to its high concentration of polyphenols.","How to use
Apply a thick layer of APIVITA Express Beauty Face Mask Sea Lavender to clean skin, while taking care to avoid the eye area. Leave on for 10 minutes, then remove excess with a damp cotton pad. Rinse thoroughly in order to fully remove the product from the skin. In order to achieve the best possible results, follow with your favorite face cream from the APIVITA range.",855
https://www.caretobeauty.com/us/caudalie-vinoperfect-glycolic-peel-mask-75ml/,Caudalie,75ml,"Caudalie Vinoperfect Glycolic Peel Mask is a facial mask that eliminates dead skin cells to reveal a radiant and more even complexion. Now with an updated image and formula, this incredible mask presents a texture that is easy to apply on the skin and suitable for all skin types (not for sensitive skin).
96% of natural ingredients work together to deliver instant and visible results that last. Glycolic acid coupled with natural AHAs - lactic, tartaric, citric acid obtained directly from or through fermentation of corn, sugar cane, beets, wheat and grapes - contribute to eliminate dead skin cells, renew and brighten the skin. At the same time, viniferine helps to reduce the appearance of dark spots and boost the radiance of the skin. In as short as ten minutes, the skin reveals more bright and refined. Apply it twice a week to keep the skin with a healthy-looking glow!","Main Ingredients

Glycolic acid coupled with natural AHAs (lactic, tartaric, citric acid obtained directly from or through fermentation of corn, sugar cane, beets, wheat and grapes) contribute to eliminate dead skin cells, renew and brighten the skin;
Viniferine helps to reduce the appearance of dark spots and boost the radiance of the skin.","How to use
To begin with, apply a layer of Caudalie Vinoperfect Glycolic Peel Mask onto dry skin, avoiding the eye contour. Allow it 10 minutes and then proceed to rinse off the mask with abundant lukewarm water.",855
https://www.caretobeauty.com/us/garnier-pure-active-3-in-1-clay-mask-scrub-wash-oily-skin-150ml/,Garnier,150ml,"Garnier Pure Active 3 in 1 Clay Mask Scrub Wash Oily Skin is a multipurpose product that works as your daily cleanser as well as your scrub and mattifying mask. The texture is creamy and purifying, ideal for oily skin prone to imperfections. The secret for this versatile product is a combination of powerful ingredients. Eucalyptus extract works together with zinc and salicylic acid to deeply purify, refine, exfoliate, control excess oil and mattify the skin. In one product, you can find all the results that oily skin needs.
Oily skin can be difficult to balance, particularly oily skin prone to imperfections. The cleansing step is essential to purify the skin and release it from excess oils, impurities, and to unclog pores. Additionally, this unique product also works to gently scrub the face, as well as a purifying and mattifying mask. After each use, the skin is more clean and free from the excess oils and impurities that can trigger blemishes and spots.","Main Ingredients

Eucalyptus extract together with zinc and salicylic acid work to deeply purify, refine, exfoliate, control excess oil and mattify the skin.","How to use
Use Garnier Pure Active 3 in 1 Clay Mask Scrub Wash Oily Skin as a cleanser, a scrub and also as a mask. Use daily as a Cleanser. Apply over wet skin, and then rinse it off with lukewarm water. Use twice a week as a Scrub. Massage it gently onto the forehead, chin and nose to remove dead skin cells and to unclog pores. Use weekly as a Mask. Apply onto the dry skin of the face and allow it three minutes before rinsing off.",855
https://www.caretobeauty.com/us/uriage-thermal-water-sleeping-mask-50ml/,Uriage,50ml,"Uriage Eau Thermale Water Sleeping Mask 50ml (1.69fl oz) is an overnight mask that fulfills the needs of tired and thirsty skin and returns the complexion a well-rested look. With powerful hydrating and soothing actives, this water sleeping mask can not only deeply hydrate the skin but also plump the complexion, returning suppleness and radiance to dull and tired skin. Providing long-lasting hydration, this night mask helps maintain optimal hydration levels and keep the skin feeling comfortable and fresh, for a rested skin and a true ""8 hours of sleep"" complexion. With a fresh and also lightly scented jellified texture, it allows you to dive your skin in a real ""Thermal Bath"" moment and return the complexion a supple and well-rested look in the morning.","Main Ingredients

Edelweiss Extract provides antioxidant and soothing properties. It not only helps strengthen the skin barrier and reduce sensitivity but also leaves the skin feeling soft and with an ultra-fresh radiance;
Hyaluronic Acid has the capacity to retain water. This ability not only hydrates the skin but also plumps it up. It helps keep the skin hydrated and supple smoothing fine lines caused by dehydration;
Hydro-Thermal Complex not only hydrates but also soothes the skin. It provides long-lasting hydration and also comforts the skin lending the complexion a well-rested look.","How to use
Apply a thin layer of Uriage Eau Thermale Water Sleeping Mask 50ml (1.69fl oz) in the evening. Apply to both clean and dry skin with a gentle massage. Then let it act throughout the night rinsing off in the morning.",855
https://www.caretobeauty.com/us/ziaja-cucumber-mint-enzyme-gel-face-mask-7ml/,Ziaja,7ml,"Ziaja Cucumber Mint Enzyme Gel Face Mask 7ml (0.24 fl oz) is an exfoliating gel mask that boasts a vegan formula with 98% ingredients of natural origin. It contains papain, an enzyme that gently removes dead skin cells, providing an enzymatic exfoliation that leaves the skin smoother, softer, and more even. The formula also includes cucumber and mint extracts, which help hydrate, soothe, and refresh the skin. Moreover, the combination of this product's gel texture with its energizing and refreshing scent provides a delicate cooling sensation that invigorates the senses while leaving the skin feeling refreshed and revitalized.
All in all, this face mask helps to maintain smooth, hydrated, and refreshed skin. Its gentle exfoliating properties, as well as its hydrating and soothing benefits, make it a valuable addition to any skincare regimen, revealing a smoother and more radiant complexion.","Main Ingredients

Cucumber Extract has a high water content and is rich in vitamins and antioxidants. It helps to refresh, moisturize and soothe the skin, while also having antioxidant effects;
Papain is an enzyme from papaya that helps to mildly exfoliate the skin, removing dead skin cells and revealing a smoother complexion;
Peppermint Extract delivers a refreshing effect.","How to use
Apply a thin layer of Ziaja Cucumber Mint Enzyme Gel Face Mask 7ml (0.24 fl oz) onto previously cleansed skin of the face. Then, leave it on for 10 to 15 minutes. Finally, thoroughly rinse with lukewarm water.",855
https://www.caretobeauty.com/us/apivita-express-beauty-radiance-face-mask-2x8ml/,APIVITA,x8,"APIVITA Express Beauty Face Mask Orange is a juicy, cream-gel mask that restores radiance to the complexion. Infused with orange extract and vitamin C, this mask improves the skin texture and creates a smooth, even complexion. Greek thyme honey and hyaluronic acid provide further benefits by hydrating and re-plumping the skin, creating a glowing, supple appearance that radiates health and youth.","Main Ingredients

Orange extract and vitamin C refine the skin texture, thus enhancing the skin's natural radiance;
Q10 coenzyme, Greek thyme honey and hyaluronic acid moisturize the skin, leaving it softer and suppler;
Orange essential oil invigorates and rejuvenates the complexion;
This product contains a patented infusion of 3 different species of organic Greek mountain tea instead of plain water; this natural ingredient helps boost the antioxidant properties already present in the formula, due to its high concentration of polyphenols.","How to use
Apply a thick layer of APIVITA Express Beauty Face Mask Orange to clean skin, while taking care to avoid the eye area. Leave on for 10 minutes, then remove excess with a damp cotton pad. Rinse thoroughly in order to fully remove the product from the skin. In order to achieve the best possible results, follow with your favorite face cream from the APIVITA range.",855
https://www.caretobeauty.com/us/apivita-express-beauty-eye-mask-grape-2x2ml/,APIVITA,x2,"APIVITA Express Beauty Eye Mask Grape is a line smoothing mask for the eye contour area. Rich in grape and lupine extracts, this mask helps minimize the look of fine lines and wrinkles around the eyes, thus rejuvenating the appearance of the skin. Grape, in particular, is a star ingredient in the Mediterranean, due to its high antioxidant content and ability to promote skin longevity. This mask is also infused with myrrh essential oil, which invigorates the eyes to renew and refresh your gaze.","Main Ingredients

Grape and lupine softens both fine lines and wrinkles around the eyes;
Beeswax, olive oil, shea butter and rice oil nourishes the skin around the eyes, thus lending it a rejuvenated appearance;
This product contains a patented infusion of 3 different species of organic Greek mountain tea instead of plain water; this natural ingredient helps boost the antioxidant properties already present in the formula, due to its high concentration of polyphenols.","How to use
Apply an even layer of APIVITA Express Beauty Eye Mask Grape to the skin around the eyes. Leave on for 10 minutes, then rinse thoroughly.",855
