Link,brand,volume,description,ingredients,how_to_use
https://www.caretobeauty.com/us/l-oreal-paris-revitalift-laser-peeling-toner-180ml/,L'Oréal Paris,180ml,"L'Oréal Paris Revitalift Laser Peeling Toner 180ml (6.09fl oz) consists of a tonic with an intense smoothing and brightening action for all skin types. More specifically, this product has an exfoliating ability that removes dead skin cells on the face to increase cell turnover. In turn, this leads to a much more even complexion in terms of texture and appearance. That is, dark spots are reduced in the long term while the skin is left without any grain in texture. Finally, with this toner, the skin is also much smoother and with a radiant and glowing complexion.
For this toner to have an exfoliating function, it is enriched with 5% pure Glycolic Acid. This main ingredient lifts and eliminates dead cells from the skin leaving it cleaner and fresher. In turn, it promotes cell renewal, revealing brighter and smoother skin. In addition to all this, through cell renewal, dark spots on the face are eventually also reduced. To counterbalance this ingredient, this tonic also contains Aloe Vera and Allantoin. These help to soothe the skin and prevent any irritation and future discomforts such as redness, tightness, or even dryness. Moreover, the skin also ends up being more hydrated in the long term. All in all, this toner designed for daily use leaves skin feeling smoother, refreshed, and with a healthy glow that will last for a long time.","Main Ingredients

5% Glycolic acid is commonly used by dermatologists for peeling treatments. It basically lifts off dead skin cells to renew, refresh and smooth the complexion;
Aloe Vera derivative has anti-inflammatory abilities, soothing and comforting the skin;
Allantoin helps regenerate, soften and also soothe the skin.","How to use
Apply L'Oréal Paris Revitalift Laser Peeling Toner 180ml (6.09fl oz) at night to a clean, dry face with your fingers or with the help of a cotton pad. Sweep across the face while avoiding the eye area. At the end, gently tap in excess with fingers. Make sure the next day you use a sun protection cream to prevent skin irritation."
https://www.caretobeauty.com/us/clarins-purifying-toning-lotion/,Clarins,400ml (eco refill),"Clarins Purifying Toning Lotion is particularly tailored for those with combination to oily skin types. This refreshing toner perfects the cleansing process, consequently leaving the skin purified, balanced, and ready for subsequent skincare products. At the heart of the formula, the innovative [Microbiote Complex] combines saffron flower polyphenols and a marine prebiotic. This unique complex supports the preservation of the skin&rsquo;s microbiome balance. Moreover, it features meadowsweet extract to help regulate excess sebum while witch hazel extract, known for its astringent properties, helps minimize the appearance of pores and refine skin texture. As a result, this lotion leaves the skin feeling purified, refreshed, and more balanced. With each application, pores become less visible, and the skin looks soft and fresh.
This toner stands out not only for its skin-balancing benefits but also for its lightweight, comforting texture that leaves the skin feeling fresh. This aspect of the toner ensures that it fits seamlessly into any skincare routine, offering a pleasant and refreshing experience. In summary, this lotion targets skin concerns of those with combination to oily skin, being a great addition to their skincare routine. It's available in different formats, including an eco-refill.","Main Ingredients

[Microbiote Complex] combines polyphenols from saffron flower extract and a marine prebiotic from laminaria. These work together to help rebalance the skin's microbiome;
Meadowsweet extract has purifying properties and helps to limit shine, therefore providing the skin with a matte and pure complexion;
Witch hazel, or hamamelis virginiana, is renowned for its astringent and toning properties, thus refining the appearance of pores.","How to use
Soak a cotton pad or reusable alternative with Clarins Purifying Toning Lotion and swipe across the face and neck."
https://www.caretobeauty.com/us/skin1004-madagascar-centella-hyalu-cica-brightening-toner/,SKIN1004,"30ml (1.01 fl oz)
                                                                                            - Out of Stock","SKIN1004 Madagascar Centella Hyalu-Cica Brightening Toner is designed to hydrate and gently exfoliate the skin right after cleansing. Ideal for those seeking a smoother and more radiant complexion, this toner is suitable for sensitive skin. So, thanks to citric acid, an AHA, and capryloyl salicylic acid, a LHA, this toner works diligently to sweep away dead skin cells. The result? A more refined skin texture that not only feels incredibly soft but also showcases a natural, revived glow. However, it's not just about exfoliation. With 74% Madagascan Centella asiatica leaf water, this toner offers a calming touch. Therefore, if your skin is prone to irritations or if it just needs a little soothing, this ingredient steps in to provide relief, ensuring a comfortable skin experience with every application. 
Additionally, this toner boasts hydrating ingredients, such as ceramide biom. This consists of ceramide nanoparticles that help replenish lost moisture and strengthen the skin's natural barrier. So, with consistent use, you'll find your skin feeling more resilient, hydrated, and overall healthier. In terms of application, the light texture absorbs rapidly, allowing you to move on to the next step in your skincare routine without any delay. All in all, this toner hydrates, exfoliates, and soothes all at once. It's a simple yet effective addition to any skincare regimen, promising healthier-looking and more radiant skin with every use.","Main Ingredients


Centella asiatica  Leaf Water from Madagascar delivers soothing, hydrating and antioxidant effects. It also helps in skin repair;
Ceramide NP is one of several types of ceramides found naturally in the skin. It helps to retain water on the skin and reinforce the skin barrier, softening dry and dehydrated skin;
Citric and Capryloyl Salicylic Acids exfoliate the skin, stimulating the removal of dead skin cells from the surface and inside the pores. So, this helps to smooth the complexion, even the skin tone, and restore the skin's glow;
Hyaluronic Acid is able to attract and retain water, so it functions as a humectant and helps the skin to restore its water balance. Therefore, it leaves the skin soft and plump.","How to use
Apply an appropriate amount of SKIN1004 Madagascar Centella Hyalu-Cica Brightening Toner to a cotton pad or directly to the palms. Then, apply it to clean, dry skin."
https://www.caretobeauty.com/us/darphin-intral-daily-micellar-toner/,Darphin,500ml (16.91 fl oz),"Darphin Intral Daily Micellar Toner&nbsp;is a refreshing toner that gently removes any remaining impurities and makeup from your skin. This is an essential final step to add to your cleansing routine especially if you struggle with sensitive and easily irritated skin. In fact, this tone is part of the Intral range, a set of products specially developed to soothe, calm, and comfort your skin. Even more, 92% of this product&rsquo;s ingredients are from a natural origin.
Infused with the botanical Calm Complex coupled with Centaurium, this formula is suitable for sensitive skin visibly reducing and preventing irritation. On the other hand, this toner contains Hyaluronic Acid of two molecular weights to deliver hydration to the skin. Lastly, Micelle Technology is responsible for removing makeup, oil, and other impurities. As a result, this toner not only completes the cleansing ritual but also moisturizes the skin, leaving it fresh, toned, and radiant.","Main Ingredients

Calm Complex comprises a mixture of Peony, Hawthorn, Chamomile,&nbsp;Panthenol, and Polysaccharides to soothe and calm irritated skin;
Centaurium has anti-inflammatory qualities being beneficial to calm sensitive and irritated skin;
Hyaluronic acid is a known ingredient for its binding water properties. Thus, it hydrates and plumps the skin.","How to use
Apply Darphin Intral Daily Micellar Toner&nbsp;to your morning and evening skincare routine, using it on your face and neck. You may apply it by soaking a cotton pad with the product and then swiping it across your skin. Alternatively, you can put a few drops into your palms and then press them into your face."
https://www.caretobeauty.com/us/pestle-mortar-nmf-lactic-acid-toner-200ml/,Pestle & Mortar,200ml,"Pestle &amp; Mortar NMF Lactic Acid Toner is the hero toner for those suffering from skin sensitivity who also want a peeling toner. Having sensitive skin is often likely to be incompatible with an exfoliating toner. However, if you choose the right ingredients, it's not that hard to achieve your skin goal of perfectly smooth skin. With lactic acid and gluconolactate, both known for their compatibility with sensitive skin, the outer layer of dead skin cells is gently removed, while at the same time the hydrolipidic mantle that protects the skin is reinforced.&nbsp;Additionally, this formula also contains natural moisturizing factors that give the product its name and improve the hydration levels. Indian gooseberry extract, together with black tea extract, help to fade hyperpigmentation and boost the radiance of the skin.
Another key point of this star product is that it's formulated without any fragrance or alcohol, which translates into a perfectly curated formula for all skin types, even those with sensitivity and redness. This toner harnesses the best ingredients for sensitive skin and combines them with ones that naturally occur on the skin, in order to achieve maximum compatibility while delivering hydration, radiance and even texture.","Main Ingredients

Natural Moisturising Factors are a powerful mix of hydrating substances that naturally occur on the skin, in order to protect it from dehydration and to keep it protected;
Lactic Acid with a free acid value of 5.34% and pH 3.8 formula gently exfoliates the skin, hence making it compatible even with sensitive skin;
Gluconolactate is a PHA with a gentle exfoliating action that helps to remove the dead cells on the top layer of the skin, thus improving the skin texture;
Indian gooseberry extract is full of Vitamin C, hence making it a perfect brightening and revitalizing treatment. Additionally, it also helps to fade hyperpigmentation and even the skin tone.","How to use
Apply Pestle &amp; Mortar NMF Lactic Acid Toner onto a cotton pad and gently sweep it over previously cleansed skin, avoiding the eye contour. You can use this toner both in the morning and evening."
https://www.caretobeauty.com/us/goodal-vegan-rice-milk-moisturizing-toner-250ml/,Goodal,250ml,,Not found,Not found
https://www.caretobeauty.com/us/clarins-my-clarins-pure-reset-purifying-matifying-toner-200ml/,Clarins,200ml,"Clarins My Clarins Pure-Reset Purifying Matifying Toner 200ml (6.7floz) is designed to rebalance and refine the complexion with its lightweight, ultra-fresh texture. Preparing the skin for further care, this toner visibly reduces shine and purifies the complexion. To begin with, at the heart of the formula is the innovative Healthy Plant Complex, which includes coconut water and alpenrose extract. This unique blend offers nutrition and antioxidant benefits thus promoting a healthy-looking complexion. Moreover, the formula contains tamarind pulp acids which help refine skin texture, and meadowsweet which helps reduce excess shine. All in all, this toner not only purifies and rebalances the skin but also provides a mattifying effect, refining the skin's texture for a smoother, more refined appearance.
Its results are recognized by users, with 97% of women reporting that the lotion helps purify the skin from the first application and 87% stating it effectively mattifies the skin. As a last note, this toner contains 98% ingredients of natural origin and a vegan formula. In conclusion, it purifies, rebalances, and mattifies the skin while refining its texture.","Main Ingredients

Coconut water delivers essential nutrients to the skin cells, providing nourishment;
Alpenrose extract offers protection against oxidative stress;
Tamarind pulp acid, namely sorbic acid, has exfoliating properties;
Fig extract helps to boost skin hydration;
Meadowsweet extract has purifying properties and helps to limit shine, therefore providing the skin with a matte and pure complexion.","How to use
Soak a cotton pad or reusable alternative with Clarins My Clarins Pure-Reset Purifying Matifying Toner 200ml (6.7floz) and swipe it across the face and neck."
https://www.caretobeauty.com/us/essence-hello-good-stuff-skin-perfecting-toner-100ml/,essence,100ml,,Not found,Not found
https://www.caretobeauty.com/us/ziaja-cucumber-face-toner-200ml/,Ziaja,200ml,"Ziaja Cucumber Face Toner 200ml (7.0 fl oz) is a toner designed for normal to oily skin types. It boasts a vegan formula that contains 90% of ingredients of natural origin, including hydrating and soothing cucumber and panthenol. So, this toner delicately finishes the cleansing process, ensuring that the skin is properly prepped for the next steps in the skincare routine. Its moisturizing and refreshing effects help to keep the skin hydrated and revitalized, making it feel fresh and clean. It also helps reduce the appearance of dilated pores and has soothing properties that help to calm the skin, providing an immediate sense of comfort.
Applying this toner is simple and effective. After cleansing, dispense it onto a cotton pad and gently wipe it over the face and neck. This will help remove any remaining impurities and prepare the skin for the application of further cosmetics, such as serums and moisturizers. Moreover, its refreshing properties make it a delightful part of the skincare routine. All in all, this is a hydrating, refreshing, and soothing toner that also helps reduce the appearance of enlarged pores.","Main Ingredients

Cucumber Extract has a high water content and is rich in vitamins and antioxidants. It helps to refresh, moisturize and soothe the skin, while also having antioxidant effects;
Panthenol is a humectant, so it helps the skin to attract and retain water. It helps to decrease transepidermal water loss, leading to more hydrated skin. It also has soothing effects.","How to use
Dispense an appropriate amount of Ziaja Cucumber Face Toner 200ml (7.0 fl oz) onto a cotton pad or reusable alternative. Then, gently wipe it across clean skin of the face and neck. Do not rinse."
https://www.caretobeauty.com/us/madara-balancing-toner-200ml/,Mádara,200ml,"Mádara Balancing Toner 200ml (6.8 fl oz) is a daily toner that helps with various skin issues like dull and unbalanced skin, giving it a vibrant and fresher look. Enriched with both Chamomile Flower Extract and Witch Hazel Leaf Water this product provides antioxidant and soothing properties. Cucumber Fruit Extract further adds to the soothing and emollient qualities of the toner. Besides, the formula also incorporates Lactic Acid to make your skin smoother by removing dead skin cells and allowing for deeper penetration of other active ingredients. Sodium PCA acts as a powerful humectant, that helps keep the skin hydrated. On the other hand, Xylitylglucoside helps increase natural moisturizing factors (NMFs) and improves the skin barrier. This amazing combination of actives provides a formula that not only helps regulate the microbiome, hydrate, and improve the skin barrier but also minimizes pores and gives the skin a fresh and vibrant look.","Main Ingredients

Chamomile Flower Extract provides both anti-inflammatory and antioxidant properties;
Cucumber Fruit Extract provides both soothing and emollient properties to the skin;
Lactic Acid removes dead skin cells making the skin smoother and fresher. Also, removing dead skin cells allows for other actives to penetrate deeper into the skin;
Sodium PCA is a great humectant that helps keep the skin hydrated;
Xylitylglucoside helps increase natural moisturizing factors (NMFs) and improves the skin barrier. Therefore it keeps the skin hydrated;
Witch Hazel Leaf Water provides astringent, soothing, antioxidant, and antibacterial properties.","How to use
Apply Mádara Balancing Toner 200ml (6.8 fl oz) onto clean skin in the morning and/or evening. Apply to a cotton pad and wipe it over the face, or you can apply it directly to the face with your hands. This product does not need to be rinsed. Be sure to follow it with your favorite serum or moisturizer."
https://www.caretobeauty.com/us/it-s-skin-power-10-formula-powerful-genius-serum-in-toner-255ml/,It'S Skin,255ml,"It'S Skin Power 10 Formula Powerful Genius Serum in Toner 255ml is a multipurpose composition that efficiently tones the skin while delivering optimal hydration. By introducing this product into your daily routine, you will enjoy supple skin, and refined texture, among many other benefits. On one side, the presence of Polyhydroxy Acid provides an efficient exfoliating action without irritating the complexion. In fact, with a larger molecular structure, this ingredient is able to remove dead skin cells and impurities whilst preventing reactivity. 

At the same time, the Powerful Genius Serum in Toner also resorts to BIOMEGENIUS 5, a complex that contains five active ingredients, including patented Lactobacillus, to simultaneously target multiple skin concerns. As it happens, this toner is part of the Power 10 Formula Powerful Genius collection – a line of products that improves the overall condition of your skin. According to the brand, this range is able to increase radiance, moisture, firmness and strength in just 10 days or regular application.","Main Ingredients 
 
 BIOMEGENIUS 5 resorts to five active ingredients, including patented Lactobacillus, to simultaneously target multiple skin concerns; 
 PHA (Polyhydroxy Acid) provides the same results as AHAs while being less sensitizing. With a large molecular structure, this ingredient does not penetrate so deeply into the skin preventing reactivity. However, PHA still provides an efficient exfoliating action, eliminating impurities and dead skin cells.","How to use 
First, pour It'S Skin Power 10 Formula Powerful Genius Serum in Toner 255ml into a cotton pad. Then, glide it gently on the dry and clean skin of your face. Complement with other products from the same range in order to obtain maximum results."
https://www.caretobeauty.com/us/caudalie-grape-water/,Caudalie,75ml (2.54 fl oz),"Caudalie Grape Water&nbsp;is a 100% natural and organic extract directly from the French vineyards. This soothing spray is one of Caudalie's bestsellers for good reasons. For one thing, it helps to improve the hydration levels of the skin by 127%, which ensures that it's the perfect product to use throughout the day and keep on your bag or desk at all times. Moreover, the skin sensitivity levels are decreased by 61%, ensuring it's suitable even for the most sensitive skins. Extracted from the grapes in Bordeaux, it goes through a low-pressure distillation process to ensure the water keeps all the grapes' properties.&nbsp;","Main Ingredients

100% Organic grape water has hydrating and soothing actions, therefore increasing the moisture levels on the skin and reducing sensitivity.","How to use
Vaporize&nbsp;Caudalie Grape Water&nbsp;onto the face as needed. In order to increase its refreshing effect, keep the bottle in the fridge due to the soothing action of the cold."
https://www.caretobeauty.com/us/embryolisse-eau-de-beaute-rosamelis-200ml/,Embryolisse,200ml,"Embryolisse Eau de Beauté Rosamelis consists of a refreshing mist capable of purifying, smoothing and toning the skin on your face. Dermatologically and ophthalmologically tested, it is suitable for all types of skin, including the most sensitive. Furthermore, its composition is enriched with natural plant extracts such as rose, orange blossom, cornflower and hamamelis flower. This way, the skin gains a boost of hydration, is refreshed and with a delicious fresh fragrance. Finally, this mist leaves your complexion sublime and soothed, thus helping to reduce discomfort from dry or irritated skin. Additionally, this mist can work as a toner for the skin, so it is applied with the help of a cotton pad in order for you to clean your skin.","Main Ingredients

Glycerin is a powerful, natural skin moisturizer that protects and repairs it;
Cornflower Flower Water contains soothing and anti-inflammatory properties;
Orange Blossom helps to relax the body in addition to having toning properties;
Lactic Acid gently lifts off dead skin cells to reveal newer, fresher, smoother skin. It also helps to hydrate the skin.","How to use
Apply Embryolisse Eau de Beauté Rosamelis in the morning and evening with a cotton pad to thoroughly cleanse the face and neck or as a refreshing mist by spraying onto the face. Can also be used as a makeup fixing mist."
https://www.caretobeauty.com/us/madara-comforting-toner-200ml/,Mádara,200ml,"Mádara Comforting Toner is the perfect addition to your skincare routine if you have dry skin and also struggle with dryness-induced discomfort and tightness. In fact, this nourishing formula will instantaneously calm your sensitive skin. Infused with soothing floral extracts such as Chamomile and Rose, this toner regulates pH balance, soothing and preventing any irritation. As the product's name itself suggests, your skin will be comforted and smoothed from the moment you apply this fantastic product. 
Furthermore, this Mádara Toner is also infused with moisturizing ingredients that deeply hydrate and tone the skin. It is a must-add step to your daily routine, right before applying your favorite moisturizer. 
The Mádara Comforting Toner also follows the brand’s ethical and sustainable concerns. In fact, this is a vegan and cruelty-free formula that comes in a 100% post-consumer recycled bottle. 
You can apply this product in the morning or at night-time, with the help of a cotton pad or by just applying some drops of the product in your hands and gently tapping the face.","Main Ingredients 
 
Camomile Flower Extract has moisturizing and smoothing benefits. Furthermore, it is an anti-inflammatory ingredient with regeneration properties; 
Rose Distillate stimulates blood circulation and reduces de appearance of small imperfections like scars, sunburns and wrinkles. Furthermore, it is a soothing ingredient with cleansing properties, that adds a natural floral scent.","How to use 
Apply Mádara Comforting Toner to clean skin with cotton pad or by delicately splashing it with your hands. Then, follow up with your favourite moisturizer."
https://www.caretobeauty.com/us/round-lab-soybean-nourishing-toner-300ml/,Round Lab,300ml,"Round Lab Soybean Nourishing Toner 300ml (10.1floz) is a skincare solution that delivers long-lasting moisture and anti-aging benefits. A great option for dry to combination skin, this nourishing toner features black soybean extract as its key ingredient. This ingredient is rich in antioxidants, which play a role in shielding the skin from environmental stressors. These antioxidants also help soothe the skin and minimize the appearance of fine lines, making this toner an excellent choice for those looking to enhance their skin's appearance and overall health. Additionally, the formula is enriched with adenosine, cocoa seed extract, ceramides, red seaweed extract, and sugarcane extract. So, this combination of ingredients provides additional anti-wrinkle benefits, fortifies the skin’s barrier, and helps the skin remain hydrated and plump. 
Lastly, the formula's low pH is designed to match the natural acidity of the skin, promoting a balanced, healthy skin environment. In summary, this toner offers a practical solution to maintain skin hydration and combat aging signs, ensuring the skin remains youthful and radiant.","Main Ingredients

Black Soybean Extract is rich in antioxidants such as genistein, daidzein, and ferulic acid. These help to protect the skin from environmental damage, soothe the skin, and improve the appearance of fine lines, loss of firmness, and uneven skin tone;
Adenosine shows anti-wrinkle, soothing, and skin-repairing effects;
Ceramide NP is one of several types of ceramides of the skin. It helps to retain water on the skin and reinforce the skin barrier, softening dry and dehydrated skin;
Red Seaweed Extract is rich in compounds such as beta-carotene and antioxidants such as zeaxanthin and lutein, helping to protect the skin from oxidative damage including blue light exposure. Additionally, it helps hydrate and smooth the skin;
Sugarcane Extract helps the skin attract and retain water. Therefore, it hydrates the skin; 
Cocoa Seed Extract has antioxidant properties.","How to use
Apply an appropriate amount of Round Lab Soybean Nourishing Toner 300ml (10.1floz) onto clean skin of the face. Then, gently tap the skin to promote absorption."
