Link,brand,volume,description,ingredients,how_to_use
https://www.caretobeauty.com/us/sensai-cellular-performance-extra-intensive-10-min-revitalizing-pads-x20/,SENSAI,x20,"SENSAI Cellular Performance Extra Intensive 10 Min Pads x20 promise to contribute to visibly revitalized, youthful and smooth skin in just 10 minutes. Specially developed for both the eye and lip contour, these innovative pads are able to offer instant results and tackle multiple concerns. On one side, this product works as an energy shot that instantly increases radiance and luminosity for a refreshed appearance. At the same time, the Extra Intensive 10 Min Pads prove to be efficient in addressing signs of aging such as wrinkles, fine lines and loss of firmness. Last but definitely not least, these pads are perfect to enjoy a deep moisturizing effect that provides silky skin to the touch. 
To summarize, resort to this multipurpose product every time you are in need of a boost of nourishment and vitality.","Main Ingredients 
 
 Koishimaru Silk EX is a complex of Koishimaru Silk and traditional medicinal herbs that deeply moisturizes the skin and improves its ability to bind moisture. Moreover, it delivers skin-related building blocks and contributes to an outstanding silky texture; 
 Advanced CPX Vital Extract is a complex of active ingredients that activates cell renewal and boosts the skin’s hyaluron and collagen formation. In this product, this technology contains a high concentration of HA/COL Booster to provide intense hydration and like so, leave the skin looking more plump and firm; 
 Oriental Fragrance Complex with orchid, plum and apricot provides a calming effect that enhances the anti-aging action;  Ene-Activate Complex, with brown algae, provides a global revitalizing action by increasing radiance and smoothness, and refining the skin structure; 
 Cell Activator is an amino acid complex that accelerates the formation of hyaluronic acid and collagen. Therefore, it increases radiance, plumpness, softness, suppleness and firmness. 
 Acerola Extract is an antioxidant agent that prevents premature aging and revitalizes the skin.","How to use 
Apply SENSAI Cellular Performance Extra Intensive 10 Min Pads x20 by placing the pads on the eye or lip contour. Then, let it act for 10 minutes. Finally, remove the pad carefully and massage the remaining formula."
https://www.caretobeauty.com/us/sisley-paris-sisleya-discovery-program/,Sisley Paris,Not found,"This promotional pack contains the following products:

Sisley Paris Sisle&yuml;a Day and Night Anti-Aging Face Care 50ml x1
Sisley Paris Firming Concentrated Serum 4ml x1
Sisley Paris Sisle&yuml;a Anti-Wrinkle Concentrated Serum 4ml x1
Sisley Paris Sisle&yuml;a Eye and Lip Contour Cream 2ml x1

Sisley Paris Sisle&yuml;a Day and Night Anti-Aging Face Care 50ml&nbsp;is a high-end anti-aging day and night cream that targets visible signs of aging. It targets three dimensions of aging: genetic, environmental and behavioral. The last one is the one that affects the face more.&nbsp;Due to its rich formula, it has ingredients such as Rhatany Extract and Lady's Mantle Extract which deal with skin stimulation. At the same time, it regenerates the skin and boosts cellular rhythm and energy. Moreover, the Yeast and Soy Protein Complex present in the recipe ensures cellular longevity. In sum, these characteristics result in a major reduction in fine lines and wrinkles but also in an improvement in the levels of firmness, density, radiance and hydration.
Firming Concentrated Serum 4ml&nbsp;is a high-end anti-aging serum that focuses on restoring the firmness levels of the skin. It has two modes of action. The first one boosts the firming potential of the skin and the second one reactivates tensional forces. Thus, the cheekbones are full and the face has redefined contours. Besides toned, the skin is able to relax and look younger.
Sisley Paris Sisle&yuml;a Anti-Wrinkle Concentrated Serum 4ml&nbsp;is an anti-aging high-end serum that tackles all types of wrinkles, from fine lines to deep wrinkles. Hence, it visibly smoothes the skin giving it a youthful appearance. As we age, the production of collagen, an essential vitamin for keeping our complexion plump and smooth, slows down. Hence, thanks to the Cacao Porcelana Extract present in the formula, this serum restores the powerful anti-wrinkle potential of the skin. At the same time, the serum acts on different levels of the skin to ensure a complete response that leaves the facial features rested.
Sisley Paris Sisle&yuml;a Eye and Lip Contour Cream 2ml&nbsp;4ml&nbsp;is a high-end anti-aging cream designed to act on the eye and lip areas. This cream targets three dimensions of aging: genetic, environmental and behavioral. The behavioral factors are the ones that impact the most and such vulnerable parts of the face do not escape. Due to the Yeast and Soy Protein Complex, this cream visibly reduces wrinkles and fine lines, while energizing the eye contour. Additionally, the Soy Peptide Extract restores firmness levels to the upper eyelids, opening up the eye area, and smoothes the vertical lines about the lips. At the same time, a combination of plant-based ingredients is working on lightening the coloration of dark circles and reducing under-eye puffiness.",Not found,Not found
https://www.caretobeauty.com/us/sesderma-retisil-eye-and-lip-pro-aging-contour-30ml/,Sesderma,30ml,"Sesderma Retisil Eye And Lip Pro-Aging Contour 30ml (1.01 fl oz) is a hydrating cream designed for the delicate eye and lip areas, suitable for all skin types. It is specifically formulated to address advanced signs of aging such as wrinkles, sagging, and other concerns like dark spots, uneven texture, and dehydration, as well as fatigue signs like dark circles. For that purpose, this cream includes a combination of hydroxypinacolone retinoate (HPR), organic silicon, progeline, hyaluronic acid, horsetail extract, and peptides. These ingredients offer firming and anti-wrinkle benefits. It also contains antioxidants Centella Asiatica and vitamin E. On the other hand, the formula works to reduce the appearance of vascular dark circles with vitamin K oxide and caffeine. Additionally, it ensures hydration through ingredients like hyaluronic acid, rosehip oil, sweet almond oil, and glycerin.","Main Ingredients

Hydroxypinacolone retinoate (HPR) is an ester of retinoic acid, that binds directly to retinoid receptors in the cells. As a result, HPR enhances collagen synthesis, reduces fine lines and wrinkles, evens skin tone, and improves skin texture. This ingredient has more stability and less potential for skin irritation compared to traditional retinoids;
Organic silicon improves skin firmness and elasticity by stimulating support fiber synthesis and glycosaminoglycans. Additionally, it offers antioxidant, hydrating, and sebum-regulating properties;
Progeline is a biomimetic peptide that modulates progerin, a biomarker of skin aging. It reduces the synthesis of progerin to reduce skin aging, inhibits elastase activity to increase skin elasticity, and inhibits MMP activity to enhance skin firmness;
Hyaluronic acid of low and very low molecular weight molecular weight, encapsulated in liposomes, act in synergy. This ingredient boosts collagen and hyaluronic acid production and reduces MMP activity. It not only provides intense hydration but also plumping effects, therefore reducing the appearance of fine lines, and wrinkles, and improving skin texture;
Horsetail extract offers firming and antioxidant benefits due to its key components, standing out its silicon content. It also includes saponins, flavonoids, organic acids, phytosterols, tannins, polyphenolic compounds, and minerals;
SYN&reg;-TACKS is a complex peptide blend that stimulates integrin, laminin V, and various types of collagen, leading to improved extracellular matrix structure and cellular cohesion and organization. As a result, it enhances skin structure and functionality while supporting dermal communication;
SYN&reg;-COLL is a small peptide that stimulates TGF-&beta;, a growth factor that induces collagen biosynthesis and inhibits matrix metalloproteinases (MMP) that degrade collagen. In this way, it enhances skin firmness and elasticity.","How to use
Apply Sesderma Retisil Eye And Lip Pro-Aging Contour 30ml (1.01 fl oz) to the eye and lip contour in the morning and evening routine."
https://www.caretobeauty.com/us/talika-smile-code-anti-aging-duo-care-lips-2x2-5ml/,Talika,x2,"Talika Smile Code Anti-Aging Duo Care Lips 2x2.5ml (2x0.08 fl oz) is your ultimate companion for comprehensive lip and lip contour care. This innovative double-ended product is designed to give you plump, defined, and ultra-soft lips that you'll love while also targeting lip fine lines. So, in one end, you'll find the lip care solution, a non-sticky lip balm that helps pamper the lips. Infused with hyaluronic acid and peptides, it helps to plump and firm the lips, leaving them looking full and smooth. But it doesn't stop there – this balm also nourishes and softens the lips with the goodness of shea and cocoa butter, along with avocado and jojoba oils.
 Additionally, the other end of the pen is dedicated to lip contour care. It's a formula that targets the appearance of fine lines and wrinkles around the lips. Infused with divine grass, adenosine, and silk tree extracts, it helps to achieve a smoother lip contour. The result? Lips that are plump, defined, and soft to the touch, and smooth and firm lip contour. And for a touch of convenience, this unique double-ended design fits perfectly in your handbag, making it easy to use throughout the day whenever you need a touch-up. So, elevate your lip care routine with this all-in-one solution. Say goodbye to dry lips and hello to plump, defined, and ultra-soft lips, and a smoother lip contour!","Main Ingredients

Lactic Acid helps to moisturize the lips;
Hyaluronic Acid and Volumizing Peptide Complex help to enhance the volume of the lips;
Shea Butter, Cocoa Butter, Avocado, and Jojoba Oils help to nourish the skin of the lips;
Divine Grass, Silk Tree, and Adenosine help to firm the skin and fight fine lines.","How to use
Apply Talika Smile Code Anti-Aging Duo Care Lips 2x2.5ml (2x0.08 fl oz) to the lips and the lip contour, using the different formulas for each area. In the morning and evening, apply the contour care (white end with brush) to the skin of the lip contour, before the moisturizer. Make sure to target the areas with fine lines and wrinkles. Then, whenever necessary, apply the plumping lip care (silver end with doe foot applicator) to the skin of the lips, before or after any other lip product."
https://www.caretobeauty.com/us/essence-my-beauty-lip-ritual-step-2-mask-02-patch-it-6-5g/,essence,5g,"essence My Beauty Lip Ritual Step 2 Mask 02 Patch It! 3ml (0.10 fl oz) is part of a three-step lip care routine. This product is a lip mask that comprises the second step. With this in mind, this mask has refreshing and hydrating properties to nourish and repair the lips. Like so, this product is perfect to apply after exfoliation. With a lightweight creamy texture, it is pleasant to apply and has a cooling effect that soothes the lips at the same time. In addition, the formula contains valuable ingredients to care for the lips. In this case, Shea butter is the main ingredient and it deeply hydrates and nourishes the lips. The result is super soft and supple lips. Like so, the lips are prepared for any look!&nbsp;
As a last note, this product is vegan and does not contain parabens or gluten.&nbsp;To sum up, add this product to your care ritual and see the results. It's the perfect mask for getting&nbsp;lips softer than ever.","Main Ingredients

Shea butter is rich in fatty acids with nourishing properties. As so, it intensely hydrates and nurtures the lips for super soft results.","How to use
Apply&nbsp;essence My Beauty Lip Ritual Step 2 Mask 02 Patch It! 3ml (0.10 fl oz)&nbsp;on the lips and leave it on for one to three minutes. Then, massage the excess product. Do not rinse."
https://www.caretobeauty.com/us/sesderma-daeses-eye-and-lip-contour-cream-15ml/,Sesderma,15ml,"Sesderma Daeses Eye and Lip Contour Cream 15ml (0.51fl oz) is indicated for loss of firmness on delicate areas like the skin around the eyes and the lips. Thanks to the unique composition, this cream is able to have an instant and long-lasting effect on skin firmness, especially in what concerns drooping eyelids and lip loss of volume. Furthermore, ideal for all skin types, but particularly mature skins, this cream deeply hydrates the skin and helps to boost firmness thanks to the ingredient known as DMAE, which has an incredible action on muscle tone and firmness. More specifically, this natural ingredient helps to boost the synthesis of acetylcholine, responsible for muscle contraction, and therefore boosting firmness. In turn, this results in an immediate lifting effect and recovery of the muscle tone over time.
On the other hand, the presence of Hydrolized Wheat Proteins have an immediate lifting effect and help to hydrate and reduce wrinkles. Finally, Hyaluronic Acid deeply hydrates the skin and helps to reduce the appearance of signs of aging on the skin. In summary, this cream becomes the perfect ally for mature skin, specifically for the contour of the eyes and lips with loss of firmness.","Main Ingredients

DMAE is a natural ingredient that helps to boost the synthesis of acetylcholine, responsible for muscle contraction, and therefore boosting firmness due to this ability to improve muscle tonus, resulting in an immediate lifting effect and recovery of the muscle tonus over time;
Organic Silicium is needed to create collagen and elastin, enhancing the matrix density that provides support and stabilizes the tissue architecture;
Hydrolized Wheat Proteins have an immediate lifting effect and help to hydrate and reduce wrinkles;
Hyaluronic Acid deeply hydrates the skin and helps to reduce the appearance of wrinkles and fine lines;
Aloe Vera Extract and Chamomile Extract help to soothe the delicate area around the mouth and lips.","How to use
Apply Sesderma Daeses Eye and Lip Contour Cream 15ml (0.51fl oz) in the morning and evening with soft touches from the inside to the outside of the eye contour and around the lips. You can also apply directly on the lips to boost volume."
https://www.caretobeauty.com/us/sisley-paris-sisleya-eye-and-lip-contour-cream-15ml/,Sisley Paris,15ml,"Sisley Paris Sisleÿa Eye and Lip Contour Cream 15ml (0.5 fl oz)&nbsp;is a high-end anti-aging cream designed to act on the eye and lip areas. This cream targets three dimensions of aging: genetic, environmental and behavioral. The behavioral factors are the ones that impact the most and such vulnerable parts of the face do not escape. Due to the Yeast and Soy Protein Complex, this cream visibly reduces wrinkles and fine lines, while energizing the eye contour. Additionally, the Soy Peptide Extract restores firmness levels to the upper eyelids, opening up the eye area, and smoothes the vertical lines about the lips. At the same time, a combination of plant-based ingredients is working on lightening the coloration of dark circles and reducing under-eye puffiness. These results are immediate, but also long-term. Hence the skin around the eyes and lips appears smooth, firm and bright.
The Sisley Paris Sisle&yuml;a Eye and Lip Contour Cream has been dermatologically and ophthalmologically tested and is suitable for sensitive eyes and contact lens wearers.
This cream comes with a massage tool that is ideal to prepare the skin prior to the application of the cream. With its cool-tip and with adequate movements it boosts microcirculation and smoothes the skin by attenuating puffiness and wrinkles.
Thanks to its light and creamy texture, it applies easily and provides moments of comfort, leaving the skin soft. In the end, it creates a special well-being moment in the skincare routine for both the skin and the mind. Expect rested and well-preserved skin!","Main Ingredients

Yeast and Soy Protein Complex promotes cellular longevity. Soy acts as an antioxidant that prevents skin aging, diminishing the appearance of wrinkles and dullness. While Yeast, rich in vitamin B, protects the skin against pollution and balances the skin levels to ensure skin integrity;
Lindera Extract works as an antioxidant that protects the skin and prevents oxidative stress. Additionally, it stimulates cellular rhythm;
Adenosine reduces the appearance of wrinkles, smoothening and energizing the skin. It is especially effective on eyebrow wrinkles;
Plant Glycerin protects against irritation and infection, thanks to its healing properties. At the same time, it boosts skin elasticity and hydrates it, revitalizing it.","How to use
Apply Sisley Paris Sisleÿa Eye and Lip Contour Cream 15ml (0.5 fl oz)&nbsp;in the morning and evening along the eye contour area, eyelids and the contours of the lips. Firstly, before applying the cream, prepare the area with the massage tool. Start by smoothing the areas above the eyebrow, over the eyelid and below the eye, moving from the inner eye outwards. Then, smooth around the lip area, beginning at the center and moving toward the outer edges. Secondly, apply light pressure on the eyelid and below the eye. Thirdly, use the tool in a zigzag pattern between the eyebrows and the under-eye area. Fourthly, do a back-and-forth movement on the eyebrows, along the outer corners of the eye and above the lip. Finally, apply the cream."
https://www.caretobeauty.com/us/strivectin-double-fix-for-lips-plumping-vertical-line-treatment-5ml/,StriVectin,5ml,"StriVectin Double Fix for Lips Plumping &amp; Vertical Line Treatment is a 2-in-1 solution for both the lips and the delicate skin around them.
Over time, our lips start to thin, losing their fullness and even their color. And due to years of repetitive movements, like smiling, fine lines and wrinkles start accumulating around the mouth. StriVectin double formula targets those areas and helps diminish these effects. Firstly, the Plumping Treatment visibly enhances, hydrates, and smoothes the lips, adding an elegant glossy finish. Then, the Vertical Line Treatment improves the elasticity and firmness of the lip contour, thus reducing the appearance of wrinkles and vertical lines.
On its own or combined with your favorite lipstick, this innovative treatment will add a rejuvenating volume and shine to your lips, bringing them back to their youthful appearance.","Main Ingredients

Peptides are strings of amino acids essential to the skin's structure and function. They signal the skin to boost its production of collagen and even hyaluronic acid in order to restore its own barrier. Therefore, they improve the firmness, texture, and overall appearance of the skin by acting as biological messengers;
Hyaluronic Acid is a restorative ingredient naturally found in the skin's connective tissue. It not only deeply hydrates the skin but also holds in moisture, plumping it up which, as a result, also helps reduce fine lines and wrinkles. In addition, it also stimulates collagen production;
Madecassoside is an active ingredient rich in antioxidants and skin-soothing properties. It has shown promising results in preventing and correcting aging signs, such as both deep and superficial wrinkles, as well as improving skin firmness, softness, and even moisture levels.","How to use
Apply StriVectin Double Fix for Lips Plumping &amp; Vertical Line Treatment on the lips as often as needed. Around the lips, apply twice daily, morning and night, around the mouth and lip area with gentle strokes."
https://www.caretobeauty.com/us/darphin-exquisage-beauty-revealing-eye-and-lip-contour-cream-15ml/,Darphin,15ml,"Darphin Exquisâge Beauty Revealing Eye and Lip Contour Cream 15ml was specially developed to treat signs of aging and fatigue locally. Focusing on the eye and mouth area, this creamy formula targets loss of firmness boosting collagen production for an uplifted look. In addition to that, the Beauty Revealing Eye and Lip Contour Cream also works to reduce wrinkles and fine lines on both areas. When it comes to the skin around the eyes, this formula has the ability to minimize the look of dark circles and puffiness as well. With each application, your eyes and lips will look rejuvenated and visibly smoother. 
The Beauty Revealing Eye and Lip Contour Cream by Darphin is a part of the brand’s Exquisâge line. This range of products focuses on fighting signs of aging by improving skin’s elasticity, texture, and level of radiance. The Exquisâge line leaves the skin firmer and smoother through the power of in vitro tested CelluVie Complex. This component has the ability to double collagen production and reinforce the skin’s moisture barrier. Therefore, the skin is left visibly lifted and its elasticity greatly improved. Furthermore, the Exquisâge range by Darphin follows the brand’s botanical inspiration. In fact, the Beauty Revealing Eye and Lip Contour Cream has 85% of ingredients from natural origin. 
Lastly, you can easily incorporate this revitalizing product into your skincare routine by applying it in the morning and at nighttime. The soft cashmere-like formula will glide effortlessly through your skin, absorbing quickly. Try to complement its use with the serum and eye cream from the same line, in order to get optimal results.","Main Ingredients 
 
CelluVie™ Complex (Laminaria Digitata, Mukurossi Fruit Extract and Caesalpinia Spinosa Extract) greatly boosts collagen production and helps the skin to hold moisture for longer, as well.","How to use 
Use Darphin Exquisâge Beauty Revealing Eye and Lip Contour Cream 15ml in the morning and at nighttime. Apply a small amount, gently patting it on the skin around your eyes and lips. For optimal results, complement its use with other products from the same range."
https://www.caretobeauty.com/us/dr-grandel-timeless-eye-lip-firmer-15ml/,DR. GRANDEL,15ml,"DR. GRANDEL Timeless Eye &amp; Lip Firmer is a rejuvenating cream for the eye and lip areas. Besides firming and smoothing the sensitive areas around your eyes and lips, it also repairs damage caused by the environment and protects against negative external factors. The latter is in part thanks to the presence of Squalane in the formulation of this cream. Squalane is the stable version of squalene, a lipid that is naturally produced by the skin cells, and when applied topically, it has a lot of benefits. It boosts hydration which can help to make the skin look more vibrant, something particularly needed around the eye area. But most importantly, it helps fighting skin damage and free radicals that are partly responsible for accelerating aging. Lastly, with regular use, it can boost collagen production for firmer skin. Another super ingredient in the cream is the Beech Bud Extract which helps to smooth out fine lines and reduce the depth of wrinkles.
Overall, the eye and lip cream is perfect to not only reduce fine and expression lines over time but also to reduce swelling under the eyes. With light-refracting pigments, this cream is sure to give instant life to your eyes and lips.","Main Ingredients

Squalane boosts hydration, making the skin look more vibrant while fighting skin damage and free radicals responsible for accelerating aging;
Beech Bud Extract helps to prevent wrinkles, reduce fine lines, and improves cutaneous moisturization.","How to use
Apply DR. GRANDEL Timeless Eye &amp; Lip Firmer a small amount to the lip and eye contours in the morning and evening. Follow with your usual face and neck creams."
https://www.caretobeauty.com/us/dr-grandel-elements-of-nature-contour-balm-15ml/,DR. GRANDEL,15ml,"DR. GRANDEL Elements Of Nature Contour Balm offers intensive care for the eye and lips contours. It also provides a soothing and firming effect while reducing the fine lines and signs of stress and fatigue that are usually more noticeable in the eye area. 
The formulation of this balm, besides anti-aging benefits, offers the needed moisturization and protection for the eye and lips contours. With carotene and lavender extract, both promote cell and skin regeneration while supporting the development and maintenance of collagen fibers and reducing fines lines and expression wrinkles. Additionally, Epigran, an active ingredient concentrate, ensures the supply of the most important factors for a healthy complexion namely moisturization and reparation of the skin. Lastly, argan oil stimulates the moisture-binding capacity of the skin while helping to maintain its elasticity. 
With this balm, the skin around the eyes and lips will look younger and more relaxed and therefore give your complexion and overall healthier appearance.The DR. GRANDEL Elements of Nature range bears the ECO Control seal of approval thus meeting high standards of quality, sustainability, and environmental protection.","Main Ingredients

Epigran is a multi-active ingredient concentrate that provides the skin with the most important factors for a healthy and youthful appearance;
Argan oil has nourishing properties and stimulates the moisture-binding capacity of the skin and the maintenance of its elasticity.","How to use
Apply DR. GRANDEL Elements Of Nature Contour Balm to the eye and lip areas in the morning and evening after cleansing the skin. This balm can also be used as a mask for a more intensive care. Apply to the eye and lip areas and leave for 15 minutes. Either rinse the balm with a damp cotton pad or massage in gently."
